id,post_id,comment_text,author,created_utc,sentiment,TYPE,category,book,comment_num
68j0xp_56,68j0xp,"Do not worry about downvotes. Downvotes are for sandy craws when it comes to like/dislike views :) Why would any intelligent person downvote someone for a pov ? :)

Because we grew up on the mythology. Mythology, while simply fairy tales, IS History.....So what American Gods IS, is a continuation of that ""history"" in modern times.

I SERIOUSLY think people between the ages of 15-25 are NOT going to find it, on the whole, as entertaining as people over 30, who DID have to learn the names of the Gods for world History :)

Think Latin. Latin died out in my 2nd year of High School. It was a foreign language before then and counted towards that credit. It was seen as a viable course of study due to it's medical and scientific assistance. Then, one day, someone OMG dead language, GTFO and Latin was no longer taught in most public schools :)

My father had the option to learn Greek when he went to High School :)

See, it's traditional history. Romans, Greeks and their Gods. Our planets are named for them and most kids could tell you the names, but FEW could tell you who Pluto was named after or his Greek counterpart, Orcus and ALSO Hades :)

Oie, what a tangent.

Anyway, it's like a new story about an old friend :)",mynamesalwaystaken,2017-05-01T05:38:53Z,2,COMMENT,Fantasy,American Gods,56
68j0xp_57,68j0xp,"American Gods is probably the worst book I've read, partly because it's hyped to be something great and then virtually (and literally in a lot of cases) nothing happens. The short vignettes about individual gods and those they interact with are compelling and interesting and well-done. But the main story gets so caught up in trying to make the reader feel smart by filling in blanks on their own, it's bogged by static characters and  undelivered promises, and by planting interesting ideas but never following through.",mikeatwork19,2017-05-01T17:37:39Z,0,COMMENT,Fantasy,American Gods,57
68j0xp_58,68j0xp,"I don't think there's anything groundbreaking or especially amazing about the book either. There are a ton of other science fiction books who have done the whole ""personified gods"" thing in better ways. Where American Gods separates itself is with the way it somehow appeals to a much wider audience than traditional sci-fi does. That's Gaiman's thing really - packaging these things in such a way that someone who doesn't usually care for science fiction will enjoy it. ",probably_not_serious,2017-05-01T08:42:35Z,2,COMMENT,Fantasy,American Gods,58
68j0xp_59,68j0xp,"I have the bad habit of looking for metaphor where none was intended.  American Gods provides pleanty of opportunity to make that mistake.  Once I got past that, I enjoyed the story for what it is. ",whythnot,2017-05-01T19:22:06Z,1,COMMENT,Fantasy,American Gods,59
68j0xp_60,68j0xp,"Gaiman lived in Menomonie, WI ( 50 miles east of the MN border on 94) while he was writing American Gods and Lakeside is based off Menomonie and a couple other towns in the area. 
I liked the book but all the local WI connections made me enjoy it a little more. ",Chivatty,2017-05-01T10:28:29Z,1,COMMENT,Fantasy,American Gods,60
68j0xp_61,68j0xp,I read American Gods for the first time while I was traveling around Europe and it was kinda weird/fun to be reading about spots in IL and WI that I recognized while I was across the world. ,Justascruffygirl,2017-05-01T13:20:33Z,2,COMMENT,Fantasy,American Gods,61
68j0xp_62,68j0xp,"I think the style is why I like Grand Budapest Hotel so much. I just re-watched it the other day, and I happen to be in the middle of re-reading American Gods, and I was struck by how similar the style is (or how similar I thought the style is). The same with The Ocean at the End of the Lane. Just the steady advancement of the plot, almost like it was set to music you can't hear. ",james_the_lass,2017-05-01T17:28:56Z,2,COMMENT,Fantasy,American Gods,62
68j0xp_63,68j0xp,"I kind of waffle between The Sandman series and Alan Moore's version of Swamp Thing as my favorite graphic novels. I highly recommend it to anyone who liked American Gods. It takes until like the fifth volume, at least I think it was that one, but the climax and resolution of that volume is very similar to the climax and resolution of American Gods.",mpuckett259,2017-05-01T09:23:32Z,1,COMMENT,Fantasy,American Gods,63
68j0xp_64,68j0xp,"I preferred Anansi Boys, too.  I thought American Gods was good, but it moved very slowly.",DepravedMutant,2017-05-01T07:09:18Z,2,COMMENT,Fantasy,American Gods,64
68j0xp_65,68j0xp,">I SERIOUSLY think people between the ages of 15-25 are NOT going to find it, on the whole, as entertaining as people over 30, who DID have to learn the names of the Gods for world History :)


Yeah, I'm gonna have to disagree. I'm 21, loved American Gods, and I *distinctly* remember having to do all the mythology stuff in middle school world history, not to mention that kids my age ate that Percy Jackson shit *up* 24/7 as soon as they could get their hands on the latest book. It's not like any knowledge of mythology just up and vanished some ten years ago.
",Tuft64,2017-05-01T08:14:57Z,2,COMMENT,Fantasy,American Gods,65
68j0xp_66,68j0xp,"I came here to say that.  Of the two, I like ""Small Gods"" much better.  It's among the more thoughtful of the Discworld books, and the story arc is better defined.  

There are four works I know of that all came out in the 1990s, exploring these ideas about gods and their role relative to mankind:  Small Gods, Good Omens, American Gods, and Dogma.  The first three are books, the last is a movie.  To some degree the ground had already been roughly mapped in the late 1980s by Douglas Adams (in ""The Long Dark Tea-Time of the Soul"").    

To my mind, the most interesting thing about this corpus is the synchronicity -- clearly several of my favorite authors were thinking about these things at about the same time, and to some degree playing off one another.  Rather like the re-exploration of the comic superhero genre that happened in the early 2000s.",drzowie,2017-05-01T16:17:17Z,1,COMMENT,Fantasy,American Gods,66
68j0xp_67,68j0xp,"I love magical realism and I have a long leash for absurdity--in fact, I usually think it's better when these things aren't explained--but I didn't devour American Gods the way I do books that I truly love. For whatever reason, I just couldn't get connected to the characters and the narrative, despite generally liking picaresques.

It was one of the first novels I read on my Kindle, and I always wonder if that reading experience didn't make it harder for me to get into the book. ",kyclef,2017-05-01T12:24:48Z,0,COMMENT,Fantasy,American Gods,67
68j0xp_68,68j0xp,Subconsciously? American Gods has a lot in common with Long dark tea time of the soul and Gaiman wrote a biography of Adams. ,jakdanzy,2017-05-01T14:15:03Z,2,COMMENT,Fantasy,American Gods,68
68j0xp_69,68j0xp,"It very consciously reminded me of Douglas Adams, it has the exact same premise and many similar scenes as Long Dark Teatime Of The Soul.  Overall I think I liked American Gods, but the similarities were very distracting.",macrowave,2017-05-01T13:55:00Z,2,COMMENT,Fantasy,American Gods,69
68j0xp_70,68j0xp,"That's odd, because I loved American Gods but couldn't stand Kafka on the Shore...",_MrW_,2017-05-01T07:40:29Z,1,COMMENT,Fantasy,American Gods,70
68j0xp_71,68j0xp,"I'm case you're confused, the book is called Anansi ~~Boy~~ Boys, and /u/positiveandupwards liked it better than American Gods. ""'s"" can indicate a state of being as well as possession.

E.g. ""Richard's over there."" Richard _is_ over there; he does not possess over there.   ",the_agox,2017-05-01T05:31:44Z,1,COMMENT,Fantasy,American Gods,71
68j0xp_72,68j0xp,"I have.  I had to give the series two tries because the first few books really didn't catch my attention.  I've read them all now and I consider myself invested, but I don't think that series has the same sense of wonder that say American Gods and Neverwhere have.  Probably because Harry is a talented insider, despite frequently being the underdog.  Shadow on the other hand has to constantly figure out what is going on around him and how to react.  

Series that are similar to Dresden that do have that sense of wonder for me are the Libromancer books by Tim Hines, The Courts of the Feyre by Mike Shevdon, Shadow Police by Paul Cornell etc.  I think the main character being in the dark and exploring the world along with the reader is a lot of the appeal for me.  ",Chaosrayne9000,2017-05-01T20:52:13Z,2,COMMENT,Fantasy,American Gods,72
68j0xp_73,68j0xp,"unlike a lot of current sci fi or fantasy, gaiman often doesn't explain everything, and in my opinion there often isn't a load of closure at the end of some of his stories. American gods left me wanting more of shadow, and more explanation of many things.",autumnotter,2017-05-01T13:38:36Z,2,COMMENT,Fantasy,American Gods,73
68j0xp_74,68j0xp,I'm picking one aspect of it. My point is people like to assign greater meaning to a book just because it's popular. Every aspect of American Gods has been done before in a better way and will be done again. But he managed to package it for the masses. That's all. That's what he does. I'm not saying he's not a good writer - I enjoy his books. But they aren't anything groundbreaking either. ,probably_not_serious,2017-05-01T11:30:16Z,0,COMMENT,Fantasy,American Gods,74
68j0xp_75,68j0xp,"I didn't know this, but it makes so much sense now. 

I like American Gods. I don't love it, but I like it. It's slow and meandering and bleak and I used to think of it as a strange road-trip novel about the soul of America, the multiple different beliefs of all the immigrants and how that meshes with the modern world.

I wouldn't recommend it as a first Gaiman novel though.",Stars_into_infinity,2017-05-01T08:00:57Z,2,COMMENT,Fantasy,American Gods,75
68j0xp_76,68j0xp,"Thank you for the intro to Picaresque. I wonder if with this in mind I could get through American Gods. 

Wikipedia lists Stevenson's Quicksilver, Wolfe's Severian the Torturer series, Tom Jones, and Stainless Steel Rat as also being Picaresque. None of which I had any issue with, so maybe this isn't the key to it for me.",FriendToPredators,2017-05-01T20:28:38Z,3,COMMENT,Fantasy,American Gods,76
68j0xp_77,68j0xp,"I loved American Gods the first time I read when I was about 18-20, but on an attempted reread about 10 years later, I absolutely hated it. I mean HATED it- I stopped about 100 pages in. Gaimen has done others better. Nevermore has that wispy, dreamlike quality you speak of, but it held up on rereads.

Meanwhile, Lord of Light is far and away one of the best books I've read in the past few years. It really is amazing.",,2017-05-01T16:13:05Z,2,COMMENT,Fantasy,American Gods,77
68j0xp_78,68j0xp,"Havent read kafka on the shore but I loved  hard boiled wonderland. Im currently rereading american gods because its also wonderful.

They have basically the same loosely intertwined dual story structures. American gods has folkly feel and explores myths which I enjoy and hard boiled has noir feel and explores conciousness which i enjoy. So idk if its the structure or the subject matter that draws me to both. Both maybe. ",fivefourthreeto,2017-05-01T09:00:13Z,1,COMMENT,Fantasy,American Gods,78
68j0xp_79,68j0xp,"Holy shit, you absolutely hit the nail on the head. You know when you're driving somewhere and it opens up on a different road that you didn't realize was connected? Like two places that you're familiar with A and B, and suddenly figure out that they're right next to each other. 

That's what you did with American Gods and the Coen style for me. What fun :)

>""So what did we learn from this?"" 

>""Um... I don't know.""

>""I don't fuckin' know either.""",whenigetoutofhere,2017-05-01T16:10:03Z,1,COMMENT,Fantasy,American Gods,79
68j0xp_80,68j0xp,"Neverwhere is the first novel by Gaiman that I ever read; I wholeheartedly agree that it is an excellent start for the reasons you've listed above. And as it happens, is also set in the same world as American Gods. I've always hoped to see Shadow and Richard team up, as they've both fallen through the cracks.",geropsychic,2017-05-01T17:14:11Z,2,COMMENT,Fantasy,American Gods,80
2av1yp_1,2av1yp,"This was the first Gaiman book I read and I really didnt like it. Shadow was so bland, the final conflict so boring and the laws of the universe confusing. If anything people sacrifced time to could create a new age god then we'd be over run with them. This list will be super helpful though for people who have read American Gods. If I were to give Gaiman another shot, what book should I read by him? ",NinjaBurger101,2014-07-16T22:18:24Z,0,COMMENT,Fantasy,American Gods,1
2av1yp_2,2av1yp,I need to re-read American gods having this reference now. Such a great book but not knowing 80% of who they were talking about was a bummer. ,Beer_lips,2014-07-17T08:53:37Z,2,COMMENT,Fantasy,American Gods,2
2av1yp_3,2av1yp,"Why is it called ""American Gods"" when it looks like most of the gods are distinctly non-American in origin?",ptwonline,2014-07-16T18:55:16Z,3,COMMENT,Fantasy,American Gods,3
2av1yp_4,2av1yp,"Hey, quick question... where is Jesus in American Gods?",DarkForest703,2014-07-16T16:24:27Z,2,COMMENT,Fantasy,American Gods,4
2av1yp_5,2av1yp,"Oh, this is fantastic. I haven't read American Gods in years, but all the mythology in them is what makes it memorable.",merqueen,2014-07-16T17:24:48Z,1,COMMENT,Fantasy,American Gods,5
2av1yp_6,2av1yp,Not many people understand who Shadow is.  I only did because I read a book on Norse mythology and culture before I read American Gods.,Evolving_Dore,2014-07-16T19:37:25Z,2,COMMENT,Fantasy,American Gods,6
2av1yp_7,2av1yp,"Is ""American Gods"" what the NZ tv series, ""Almighty Johnsons"" was based on? Or inspired by?",,2014-07-17T01:52:46Z,3,COMMENT,Fantasy,American Gods,7
2av1yp_8,2av1yp,"AUGHHHH!  *American Gods* sounds so interesting, yet my ass is stuck in the middle of *Shadow of Hegemon*...How long is this book? I may give up on Shadows (cause it just leads into like 1-2 more sequels anyways) and partake in this instead. I've been fascinated by mythology since the 6th grade and this is up my alley :D",No_Panty_Party,2014-07-17T02:29:38Z,3,COMMENT,Fantasy,American Gods,8
2av1yp_9,2av1yp,"As much as i liked American Gods i sometimes get irritated when Hindu gods are lumped with other gods from extinct religions, supernatural for example.",ncbose,2014-07-16T19:10:24Z,3,COMMENT,Fantasy,American Gods,9
2av1yp_10,2av1yp,Well looks like it is time to re-read American Gods again.,,2014-07-17T01:49:51Z,1,COMMENT,Fantasy,American Gods,10
2av1yp_11,2av1yp, American Gods is superb! A great read that kickstarts the mind.,PatriotBlack,2014-07-16T16:05:04Z,1,COMMENT,Fantasy,American Gods,11
2av1yp_12,2av1yp,"Nearly 4 years ago, a group of members of Mobileread.com got together to discuss [American Gods](http://www.mobileread.com/forums/showthread.php?t=91091) as an alternative to the current Monthly Book Club read. I brought up this website during that discussion. It was one of the best discussions I have ever had on a book.

I love the book and have read it at least three times and because of this discussion, I think I'll add to my TBR list again.",oldhippy1947,2014-07-17T00:44:49Z,1,COMMENT,Fantasy,American Gods,12
2av1yp_13,2av1yp,I'm reading American Gods right now. I'm going to bookmark this and come back to it since I don't want to stumble upon anything remotely close to a spoiler. Thanks for posting it.,scottmarlowe,2014-07-23T12:41:15Z,3,COMMENT,Fantasy,American Gods,13
2av1yp_14,2av1yp,"You da real MVP

Seriously, American gods is one that I constantly go back and retread and discuss and analyze. It's so good. Hopefully whenever the tv series comes out, it'll be even just a little bit as good as the book.
This guide is amazing ",,2014-07-16T17:01:46Z,1,COMMENT,Fantasy,American Gods,14
2av1yp_15,2av1yp,"I just finished *American Gods* yesterday, THIS IS SO NICE. You have excellent timing. ",,2014-07-16T18:52:54Z,1,COMMENT,Fantasy,American Gods,15
2av1yp_16,2av1yp,American Gods is on my To Read list.  Would you suggest using this guide as I go or is it something that would be better to read afterwards to see what was missed?,willo_sea,2014-07-19T23:44:17Z,3,COMMENT,Fantasy,American Gods,16
2av1yp_17,2av1yp,"For some reason Gaiman has become kindof a flashpoint. Like, people really like to argue about whether he's actually a good author or not. For that reason I find it hard to find unbiased reviews of his books, or perhaps just hard not to read bias into any reviews.

I loved American Gods, but it was my first Gaiman book, I love mythology (which if you haven't gathered is the major focus of the book), and I had never encountered this sort of story based on mythological creatures in the modern world before (which I have since discovered is almost its own genre known loosely, I think, as ""urban fantasy""). So, maybe I'm not objective when I say it was a good book.",NotClever,2014-07-16T17:39:38Z,2,COMMENT,Fantasy,American Gods,17
2av1yp_18,2av1yp,"If you like Supernatural, you're going to love American Gods.",Vio_,2014-07-16T17:06:09Z,1,COMMENT,Fantasy,American Gods,18
2av1yp_19,2av1yp,"There was a ""which book would you heavily edit/re-write"" awhile ago & [I commented about *American Gods*](http://www.reddit.com/r/writing/comments/1ugnpy/do_you_ever_read_a_book_not_your_own_and_think/cehyz05). Not too spoiler-y, but I do highlight some plot details. In summary I think it's one of his least strong works & his passionate love of world-building and mythology ultimately makes for underdeveloped characters and a weak book. Some people fervently disagree as they just enjoy 'the journey' of AG. I really adored *The Ocean at the End of the Lane* so I would recommend people who hated AG to give NG another chance with Ocean.",swordofkings,2014-07-16T21:19:25Z,2,COMMENT,Fantasy,American Gods,19
2av1yp_20,2av1yp,"*American Gods* has a lot going for it, but it ultimately missed my expectations. The premise is fantastic, and it's clear a lot of work has been put into it. The main character is interesting enough, as are his companions, but there were some very weak points to the novel.

First, the antagonists of the story are pretty flat and kind of unbelievable. The point of conflict isn't very clear, so all of the posturing that occurs in the book feels impotent and meaningless. And that's where the real damage occurs because the story has no real conflict with which to climax. There's all this build up but no release. All this posturing, all this interweaving of mythologies and storylines and personalities and histories, and it all culminates into - well, it doesn't really culminate. It anticlimaxes instead, and that left me feeling like I didn't get a return on my investment (both time and emotional investment).

There are some great lines. Gaiman also has some experimental chapters that don't use the same voice as the main chapters that follow Shadow, and I found those to be fun and interesting. But, fun as they were, they never really connected to the main story (and thus is another point related to Gaiman being unable to bring it all together). It's also witty, and I laughed out loud a number of times. Gaiman knows how to write. Some scenes were very gripping, and I found myself reading chapter after chapter to see what happens next.

It's the one book I've read that I wish I could love more than I can. No other book has left me feeling so disappointed in its resolution. Lots of other people seem to love it, flaws and all, and because of that, I still cautiously recommend people to read it, if not for the premise alone.",TheGhostofWoodyAllen,2014-07-17T01:55:39Z,0,COMMENT,Fantasy,American Gods,20
2av1yp_21,2av1yp,"His newest book, The Ocean at the End of the Lane, was really short and sweet. I blitzed through it in a day and loved it, and I feel like it would work as a decent intro Gaiman book.

You could check out Neverwhere, as well. That seems the be the biggest fan favorite along with American Gods. I'm in the processes of reading it right now, and I absolutely love it.",,2014-07-16T23:55:00Z,1,COMMENT,Fantasy,American Gods,21
2av1yp_22,2av1yp,"HBO dropped American Gods for Game of Thrones(I assume), but American Gods has been picked up by Starz, [apparently](http://www.theguardian.com/books/2014/jul/01/american-gods-series-starz-hbo-neil-gaiman).",,2014-07-16T23:57:02Z,2,COMMENT,Fantasy,American Gods,22
2av1yp_23,2av1yp,"Lots of books deal with ""Armageddon Now"" style plots. For most of them, I can't buy into the concept that ancient gods would care two whits about the town, neighborhood, or even pizza parlor where the novel must (by storytelling constraints) be set. I always find there's an absurd and tritely comical element in the ""old vs. new"" gimmicks, such as having Thor get used to taxicabs, for example.

American Gods is the rare ""Armageddon Now"" style book that deals with its subject matter knowledgeably and respectfully. Moreover, Gaiman employs a very graceful plot loophole - the gods you see in the novel are merely the American versions of those gods, brought to the New World with immigrants. So now you can envision a Slavic dark god, muttering away like an old-age pensioner in a crumbling attic, without dismissing the author's diminution of another culture's mythology. It's the New World version of the god that's diminished, not the original culture.",,2014-07-17T02:40:48Z,1,COMMENT,Fantasy,American Gods,23
2av1yp_24,2av1yp,"It was my first Gaiman too. I subsequently read Neverwhere (which I liked but think that Mieville with Kraken and Ben Aaronovitch with Rivers of London did more interesting things with the concept of living London), and Stardust - and I gotta say I preferred the film of Stardust to the book, it felt a bit vague and not as funny. 

American Gods I really really enjoyed, because I love mythology and I found the whole thing kind of peaceful and sad. It's a very long book to be 'peaceful', though, and I lost track a bit at the end. I think I need to re-read it at some point. ",Meripie,2014-07-16T19:44:16Z,1,COMMENT,Fantasy,American Gods,24
2av1yp_25,2av1yp,"If you like *American Gods*, there's no guarantee you'll like *Supernatural*.",symon_says,2014-07-16T18:08:05Z,3,COMMENT,Fantasy,American Gods,25
2av1yp_26,2av1yp,"I've only read American Gods but I didn't care for the way he writes his characters.  The main character in American Gods just seems very, very flat.  I don't have the book on hand to quote from it, but as a roughly remembered example, the text might say something like, ""Shadow was very angry.""  And that's it.  No other description of his emotions, nothing revealed in his actions.  

That said, that just means I don't prefer that particular book.  I certainly wouldn't try to argue that he isn't a good author.  Just not my cup of tea.  

I'll give his short stories a try, though.",IfWishezWereFishez,2014-07-16T21:27:25Z,0,COMMENT,Fantasy,American Gods,26
2av1yp_27,2av1yp,"I've only read ""American Gods"", but I didn't like it at all. Here's why-

""American Gods"" is, to me, a book with an interesting concept (how we as a species are driven to worship things, whether they are actual ""Gods"" or commodities/luxuries), with a horrible execution. Shadow (besides having a name that sounds like a 12 year old's idea of ""cool"") is a cardboard cutout of a character, a character that is so extraordinarily passive that he does not make nearly anything in the plot happen- instead things merely happen to him (not to mention how terribly unbelievable he is- from his inconsistencies (Shadow- ""I'm not doing anything illegal"" ...5 pages later... Shadow- ""Sure Wednesday, I'll help you rob a bank"") to how he first comes to accept that the Gods are real). And the sad thing is, the rest of the characters don't far much better in the personality department.
Now Gaiman's poor characterization and his clunky prose (when I was reading the book I considered writing down some of my favorite clunkers, and I regret not doing so) would be almost forgivable if he managed to craft something with a noteworthy plot. But once again, Gaiman failed in this regard. A solid 99% of the action in the novel is never shown- Wednesday's quest is infinitely more interesting than the meandering ""adventures"" Shadow gets caught up in (and by that I mean, passively accepts) but we barely see any of it. Instead we are left with a plot that goes seemingly nowhere and with a character that does not make one bit of difference to the story for the first 95% of it. And then to top it off, we are force fed an entirely different plot about a child killer hiding in a small town- a plot that quite seriously has no bearing to the book as a whole. It is a plot cul de sac in the vein of the rooftop Chris-R scene in Tommy Wiseau's ""The Room"".

Overall, the biggest disappointment with ""American Gods"" is just how much of a missed opportunity it is. The concept of what a modern day ""God"" is is actually a really interesting one, that in the hands of a talented writer could have made for an engaging work of fiction. Sadly, it appears that Gaiman was not the correct writer for that book.",lifeinaglasshouse,2014-07-16T23:44:46Z,0,COMMENT,Fantasy,American Gods,27
2av1yp_28,2av1yp,"He's got some admirable ambition, and I like a lot of his stories, but Sandman, American Gods, and Beowulf all showed his familiarity with the Germanic/Norse and Celtic mythologies is tenuous at best, and most likely based on post-Christian versions of the legends.",manimatr0n,2014-07-17T02:30:33Z,2,COMMENT,Fantasy,American Gods,28
