id,post_id,comment_text,author,created_utc,sentiment,TYPE,category,book,comment_num
13ze1s_3,13ze1s,"Man, I have the utmost respect for HBO. They stick their necks out financially so that we can be immersed into a totally different world and their shows are quite different from the other predictable, shitty shows other networks air. Other Networks (most notably AMC with Breaking Bad) have tried to get the hang of what HBO are doing by emulating it and putting their own twist on it but HBO keeps upping the ante with shows like Game of Thrones.

American Gods isn't my favorite book by Neil Gaiman. I really loved the novel he wrote with Terry Pratchet called ~~Bad~~ Good Omens (favorite book as a kid). Even so, it is a superb book. I think that this coupling with HBO will up the ante of the gruesomeness and the humour will floor people who haven't read the book.

The book did drag on in some places though so hopefully HBO is given some creative legroom to swap things up and insert scenes they feel will benefit the storyline.

I don't know about you guys but I'm definitely going to be watching this.",FreemanHagbardCeline,2012-11-29T15:00:49Z,1,COMMENT,Fantasy,American Gods,3
13ze1s_4,13ze1s,"
[@neilhimself](http://twitter.com/neilhimself):
>2012-11-28 20:41

>Writing HBO AMERICAN GODS pilot with [@tordotcom](https://twitter.com/tordotcom) AMERICAN GODS playlist playing to keep me company. [*j.mp*](http://j.mp/SeMHHC)

----

This comment was posted by a bot. 
[[Did I make a mistake?]](http://www.reddit.com/message/compose/?to=TweetPoster&subject=Error%20Report&message=http://reddit.com/13ze1s%0A%0APlease leave above link unaltered.)
[[Make a suggestion]](http://www.reddit.com/message/compose/?to=TweetPoster&subject=Suggestion)
[[Translate this tweet]](http://translate.google.com/#auto/en/Writing%20HBO%20AMERICAN%20GODS%20pilot%20with%20%40Tordotcom%20AMERICAN%20GODS%20playlist%20playing%20to%20keep%20me%20company.%20http%3A//j.mp/SeMHHC)
",TweetPoster,2012-11-29T06:53:30Z,1,COMMENT,Fantasy,American Gods,4
13ze1s_5,13ze1s,"American Gods has been on my to-read list ever since I read Neverwhere. I've always found it is better to go from a movie/show to the book versus reading the book then watching the movie/show, so maybe I won't rush to get to it. ",mollshenanigans,2012-11-29T14:17:42Z,2,COMMENT,Fantasy,American Gods,5
13ze1s_6,13ze1s,I can definitely see *American Gods* being better as a mini-series than a book.,,2012-11-30T14:03:34Z,2,COMMENT,Fantasy,American Gods,6
13ze1s_7,13ze1s,"[Via @neilhimself last year](https://twitter.com/neilhimself/status/80090403319197696), it sounds like it will provide with both more stories and more books in the American Gods universe.  However, you can infer more sequels from that than prequels.",aranyx,2012-11-29T18:53:32Z,1,COMMENT,Fantasy,American Gods,7
13ze1s_8,13ze1s,"It's interesting that you, and so many others in this thread seem to agree.

In my experience, this was the only good Gaiman book (Well, okay, throw in Good Omens too). Like, Anansi Boys seemed like ""Disjointed American Gods part 2"", Neverwhere was ""American Gods: Kids version""

I don't know, Gaiman's writing all has a very similar style and feel, and American Gods was the only one I've read that I felt worked.

His comics and other writings (Like TV scripts) are another matter entirely.",swjm,2012-11-29T17:20:04Z,3,COMMENT,Fantasy,American Gods,8
13ze1s_9,13ze1s,"I didn't care for American Gods during my first read, but set it down for awhile, and found it to be pretty great during a later reread. It's not for everyone, but sometimes walking away for a bit can help.",Supernumerary,2012-11-29T18:45:15Z,2,COMMENT,Fantasy,American Gods,9
13ze1s_10,13ze1s,"His only works that I can read and enjoy are his short stories. *Anansi Boys* and *Neverwhere* were palatable, but *American Gods* just dragged on for too long, with characters I couldn't really give a lot of fucks about, and with an ending that just seemed tacked on. 

I didn't particularly think much of his Doctor Who episode either, but I'll be watching the pilot, if only because I enjoy HBO's cinematography. I think Gaiman can tell a story, in short chunks, and hopefully this might mean I may actually enjoy *American Gods* this time around.",bubblegumgills,2012-11-29T19:39:49Z,0,COMMENT,Fantasy,American Gods,10
13ze1s_11,13ze1s,"I saw Gaiman at a speaking engagement last July, during which he confirmed that he would be writing a sequel to American Gods. (Beyond Anansi Boys, natch.) Things can change in that amount of time, but I'd be shocked if it weren't still on the docket.",Supernumerary,2012-11-29T18:41:22Z,2,COMMENT,Fantasy,American Gods,11
13ze1s_12,13ze1s,"I enjoyed Anansi Boys moreso than American Gods. It just felt more..alive, I think in part because it did not have to give attention to so many characters and this just gave it a better pace.

Anansi/Spider is a great character to write lines for on TV, too. I can see it working.",brewlliant,2012-11-29T15:04:11Z,1,COMMENT,Fantasy,American Gods,12
13ze1s_13,13ze1s,"In fairness -- and this is coming from a die-hard Carnivale fan -- that show did not come with a built-in audience, nor was it designed to have wide appeal. It was a slow-moving, highly stylized program which really required multiple viewings (or marathons) for full appreciation and picking apart of the story.

I'd expect an American Gods program to be pretty stylized and perhaps not conventionally scripted, but also considerably more approachable than Carnivale. Still, in my secret heart, Clancy Brown is somehow involved.",Supernumerary,2012-11-29T18:50:18Z,2,COMMENT,Fantasy,American Gods,13
13ze1s_14,13ze1s,"Same here. American Gods was pretty good, but I thought Anansi Boys was *much* better. I would love to see it adapted to screen, and with it being in the same ""world"" as American Gods, I can see that happening...",konekoanni,2012-11-29T16:19:19Z,3,COMMENT,Fantasy,American Gods,14
13ze1s_15,13ze1s,"No - it ran at the same 9pm Sunday night time slot as every other blockbuster HBO show (Sopranos, The Wire, etc).  It simply hemorrhaged viewers in the second season as people lost interest.

I'm not saying American Gods couldn't work in this style, I just don't think HBO would take the risk given what happened with Carnivale.

Also, that said, personally I think there is too much levity at times in American Gods to necessarily make the super dark style work.",junkit33,2012-11-29T21:52:55Z,0,COMMENT,Fantasy,American Gods,15
13ze1s_16,13ze1s,"The biggest problem I had with American Gods is the same problem I have with basically all of Gaiman's works.  The setting is INCREDIBLE, the support characters are great, but the main character, the one you're watching navigate the setting, is SO boring.  I've seen rocks that have more personality than Shadow, Richard Mayhew, and Tristan Thorn put together.",,2012-11-29T17:20:21Z,0,COMMENT,Fantasy,American Gods,16
13ze1s_17,13ze1s,"In Australia and Europe I remember is was shown late at night on like a Tuesday.

I think we've come a long way since 2003 - amazing production quality is possible without a massive budget blowout (which happened to Carnivale)

I don't think the style had much to do with the demise of the show - just the costs didn't add up - the production costs were huge for a TV show, but these days high budget TV shows are definitely making money for studios... I think the major cost incurred by Carnivale would have been the large cast and shooting on location - something that wouldn't be the case in American Gods.

Which series' style would you see it best work in?",,2012-11-29T22:43:05Z,3,COMMENT,Fantasy,American Gods,17
ulhz47_1,ulhz47,"No, not at all! American Gods isn’t really a book with a whole lot of subtext but it seems like OP has let a lot slip by him…",CactusHibs_7475,2022-05-09T14:09:50Z,2,COMMENT,Fantasy,American Gods,1
ulhz47_2,ulhz47,"Baldurs story of revival has been potentially changed due to christian influences and been pushed forward as the focus of his role since it was more heavily pushed by some scholars in the late 1800s, early 1900s.

To say say he is not actually a part of norse mythology and a christian write in is a bold claim considering scholars in the field are still debating Baldur's role both pre and post christianity. 


Regardless, *American Gods* is not a masterpiece of literature. Gaiman wrote a fun novel that uses myth/religion to influence characters and their motivations. I disagree with your take on this particular novel, but so tend to think Gaiman is overrated generally.",BeasleysKneeslis,2022-05-09T04:11:54Z,2,COMMENT,Fantasy,American Gods,2
ulhz47_3,ulhz47,I said it's the worst book I've ever red but it's not a review. If a friend of mine asked should I read American Gods I would say don't waste your time. I'm just some dude with a ged I'm not in the habit of doing like the reviews on anything. If you don't like my opinion you can move on.,FLCLstudio,2022-05-09T18:54:03Z,0,COMMENT,Fantasy,American Gods,3
kmkx4_1,kmkx4,"I enjoyed American Gods but didn't find it as immersive as [Neverwhere](http://www.amazon.co.uk/gp/product/0755322800/ref=s9_simh_gw_p14_d0_g14_i1?pf_rd_m=A3P5ROKL5A1OLE&pf_rd_s=center-2&pf_rd_r=11KT1Q8DB17N87EHM6ZT&pf_rd_t=101&pf_rd_p=467128533&pf_rd_i=468294) which also follows the theme of there being more to the world than what we see on the surface; set in London as opposed to the US.

I'm British so maybe this had something to do with my preference.",gabwyn,2011-09-21T10:40:13Z,2,COMMENT,Fantasy,American Gods,1
kmkx4_2,kmkx4,"It's a very ambitious novel. I doubt most people had heard of the House on the Rock. I certainly hadn't. Gaiman did a lot of research, and a lot of travel. It would be very difficult for anyone unfamiliar with the place to actually write anything remotely cogent about Rock City at the top of Lookout Mountain, for instance. I made a side trip there when I was in Tennessee and it was even more surreal than described in the book. It was very clear reading American Gods that Gaiman had embarked on something that was big, maybe too big for him. I feel like he succeeded overall. He nails enough small details to give the book the regional differences it so desperately needed in order to be called American Gods. His line about people coming to Vegas not to win money but to lose money was one of my favorite insights.

After many years of reading Gaiman I've come to realize that he writes great dialogue and when it comes to the intersection of myth and reality there are few who are better at storytelling, but he is not going to burn a hole in your head with the radiance of language. If anything American Gods is almost Hemingwayish: very straightforward descriptions and almost no purple prose. This is not his default setting. It seemed like a deliberate mode that served the purpose of the book. After all, the novel was about gods walking among us. It had a stake in maintaining a believable reality that would not have been helped by the kind of prose found in, say, Stardust (which is my favorite Gaiman book).

Overall, I'd say it deserves its high reputation. Maybe not top ten, but it's a great book with a lot of compelling ideas and a shit ton of marginalia and esoterica. It's worth it just for the grifting scenes, though I guess it's really just one big grift anyway.

Shadow is an extremely boring protagonist, though.",jonathan22tu,2011-09-21T17:02:54Z,1,COMMENT,Fantasy,American Gods,2
kmkx4_3,kmkx4,"I thought the ideas were interesting, but it wasn't as entralling as it should have been. I liked the idea of it and the way it was written was clever and amusing, but that seemed to be the main thing. The plot fell second to the concept and it wasn't the most engrossing thing to read... Whenever I have said that to American Gods fans, the main response I seem to get is ""you realise that all the characters were gods?"", essentially focussing on the concept. It is a clever book rather than a riveting read.",BigFatCatInTheSky,2011-09-21T13:15:05Z,2,COMMENT,Fantasy,American Gods,3
kmkx4_4,kmkx4,">Is American Gods overated?

 Yes.  

Is it still a good book?  

Yes.  ",benutne,2011-09-21T15:21:41Z,3,COMMENT,Fantasy,American Gods,4
kmkx4_5,kmkx4,"The thing with American Gods is that it just resonates with some people.   While you will find personal lists where it in their top 5 its rarely in the top collaborative lists.  Books are pretty personal, my choices of a favorite most likely won't ben anywhere close to the same as yours.  American Gods is still my favorite Gaimen novel.  When I think about it few of my favorite novels are ones that would be on anyones top 10 list.  One of my favorites for example is book called King of Infinite Space by Allen Steele, most have never heard of it but it starts out in my state and mentions places I have been, because of that it really sucked me in early and I love the book to this day.  I have the usual top 10 fodder like Enders Game on the list as well but for completely different reasons than most people, again it was an ability to identify with the characters, they grow up in Greensboro, NC, my hometown.  For me just seeing that things like the Yum-Yum ice cream store still around in the future just kind of warmed my heart.",apester,2011-09-21T15:40:03Z,1,COMMENT,Fantasy,American Gods,5
kmkx4_6,kmkx4,"I'm a big fan of mythology and folklore, and I love Gaiman's graphic novel work. But his novels have always fallen short of my expectations. 'American Gods' has an amazing premise that I felt it never fully lives up to. The whole whole small-town subplot with Hinzelmann towards the end of the story always felt tacked on and anticlimactic. I think Gaiman works best with short stories and comics. ",clockworkghost,2011-09-21T15:55:22Z,0,COMMENT,Fantasy,American Gods,6
kmkx4_7,kmkx4,I enjoyed American Gods. A lot. But it's definitely not my favourite Gaiman book and I had the same confusion about why *this* is always his book recommended most. I much preferred Anansi Boys.,sideshow_em,2011-09-21T17:54:02Z,2,COMMENT,Fantasy,American Gods,7
kmkx4_8,kmkx4,"It's typical Gaiman fare. He did most of the stuff he did in American Gods better in Sandman and Neverwhere before. Moreover AG really dragged in parts. So yes, it is overrated in my opinion. ",the_mgt,2011-09-21T15:25:16Z,0,COMMENT,Fantasy,American Gods,8
kmkx4_9,kmkx4,"That might depend on whether or not you're a real fantasy fan.  I've been hardcore into fantasy stories since I was very young (I was playing with LEGO knights and reading The Hobbit before I was 5 years old).  American Gods is definitely one of the top 5 fantasy books in my opinion, as it has everything that you would expect form a fantasy book with the inclusion of a mundane modern setting to contrast the fantastic.

Fantasy books are about journeys and discoveries and adventures.  American Gods did all of that for me, and did it in such a way that I felt like all of this could really be happening under my nose and I would never know otherwise.",,2011-09-21T15:34:44Z,1,COMMENT,Fantasy,American Gods,9
kmkx4_10,kmkx4,"I absolutely love it, and it would definitely be on my list of top ten greatest fantasy books ever.  That said, those lists are inherently difficult, because everyone has different tastes.  I've read lots of criticism of American Gods, and a lot of it is very fair.  I completely get why the book wouldn't resonate as much with some people as it does for me.  It's really a ""your mileage may vary"" type of situation.",literroy,2011-09-21T16:27:09Z,1,COMMENT,Fantasy,American Gods,10
kmkx4_11,kmkx4,"Not trolling, but I find that all opinions about books do suffer from an over-inflation of good will proportionate to the amount of discipline one had to exercise to finish it.  Consequently, I suspect many who found _American Gods_ ""rewarding"" actually found it to be a bit of a trudge to finish and recovered their investment of time and energy in the book by overemphasizing the parts they enjoyed.  Likewise, I think many classics enjoy the same bias.

What's difficult of course is distinguishing timeless literature from the works that were purposely obfuscated in an attempt to seem clever or simply suffered from poor or insufficient editing and re-writing.  Either can be rewarding in their own way to finish, but if you want evidence that a difficult work isn't necessarily better than one that is easy to read, then simply compare _American Gods_ to _Charlotte's Web_.  I know I would put E.B. White's book ahead of Gaiman's any day.",vplatt,2011-09-21T18:04:11Z,2,COMMENT,Fantasy,American Gods,11
kmkx4_12,kmkx4,"There's actually quite a few books out there like American Gods. People enjoy the writing style, the characters, the setting, the mythology and world, but the plot is a bit of an abortion. Characters actions and the situations they get into occur more to build the world, and examine it, than to advance the plot. 

Stranger in a Strange Land reads like two books. The break is pretty clear, and occurs when Michael has sex the first time. 

The Man in the High Castle is another example of this. 

Great Expectations

",,2011-09-21T20:09:40Z,2,COMMENT,Fantasy,American Gods,12
kmkx4_13,kmkx4,"I thought American Gods was alright.  It definitely isn't top 20, in my opinion, or even 50.  Neverwhere was a bit better, but still not one I am likely to read again.  It is a shame that Gaiman isn't more well known for his really great stuff (Sandman, short stories).",,2011-09-22T00:53:22Z,2,COMMENT,Fantasy,American Gods,13
kmkx4_14,kmkx4,"I actually just put American Gods down to check reddit. I'm 100 pages from being done, and I have to say, it's one of my favorite books in a long time. I don't know if I'd say one of the best fantasy books of all time, but definitely something worth reading.",stop_being-a-dick,2011-09-22T02:55:55Z,1,COMMENT,Fantasy,American Gods,14
kmkx4_15,kmkx4,"I enjoyed reading Neverwhere much more than American Gods, but I suppose the kind-of social commentary and/or allegory in American Gods may make it seem more high-brow to people who make lists like that.  ",,2011-09-22T23:38:37Z,2,COMMENT,Fantasy,American Gods,15
kmkx4_16,kmkx4,"Is your face likely to get cut with my knife?

Okay, now that the knee-jerk reaction is out of the way, I can understand where you're coming from.  I definitely think it deserves to be among the top 100, maybe even pretty high on the list, but there are definitely issues with it that I think hinder it a bit, despite its genius.  And I personally preferred Good Omens; I thought in American Gods he took himself slightly too seriously by the end, but Pratchett tempers him well in Omens.  ",boudica88,2011-09-21T14:13:58Z,1,COMMENT,Fantasy,American Gods,16
kmkx4_17,kmkx4,"I liked the ideas in Neverwhere, but found the execution very sorely lacking. I enjoyed American Gods, I thought it was a better book, but I don't think it's top-ten-fantasy-books-of-all-time material.",Corund,2011-09-21T15:15:37Z,2,COMMENT,Fantasy,American Gods,17
kmkx4_18,kmkx4,"I doubt where you come from has anything to do with it - I'm a Brit and I preferred American Gods and Anansi Boys to Neverwhere. They are all great books, but that's the order I'd put them in. I just loved the long, winding, road-trip kind of feeling AG had. Canyons, forests, lakes, mountains, deserts, all the kind of things you see on scenic US road trip movies/docs.

edit: I was also absolutely enthralled reading Shadow as the main protagonist and I've no idea why.",,2011-09-21T12:06:00Z,1,COMMENT,Fantasy,American Gods,18
kmkx4_19,kmkx4,"Perhaps you may have a point, I had to force myself to finish Neverwhere and while I thought it was decent book it would never make my top 20, American Gods on the other hand does.",apester,2011-09-21T15:41:01Z,2,COMMENT,Fantasy,American Gods,19
kmkx4_20,kmkx4,"I think the principal difference is that American Gods is more panoramic, while novels like Neverwhere follow a single plot strand from point A to B, C and finally D. American Gods's writing is no less skilled, and there are several fantastic characters, but it follows a different narrative structure than his other work.",crapnovelist,2011-09-21T16:13:00Z,1,COMMENT,Fantasy,American Gods,20
kmkx4_21,kmkx4,"I found FF7 to be a bland, sub-par RPG with an amazing lack of gameplay innovation. It seems like it developed a rabid following because it pretended to treat its audience (mostly adolescents when it was first released) like adults by being really angsty and occasionally having the main characters swear.

Does the analogy to American Gods still hold up?",Exocytosis,2011-09-21T16:55:25Z,0,COMMENT,Fantasy,American Gods,21
kmkx4_22,kmkx4,I feel much the same way.  His endings are usually so anticlimactic that they take away from the tremendous buildup of the preceding three-quarters of the novel.  *American Gods* in particular.,BruceTheKillerShark,2011-09-22T01:58:11Z,2,COMMENT,Fantasy,American Gods,22
kmkx4_23,kmkx4,"If you're really interested in liking his writing, might I suggest one last hailmary...give the American Gods audiobook a listen. And pay particular attention to the chapters he narrates. I didn't start loving his writing until I understood -him- a bit more. 

He wants to tell you -an adult- a story similarly to how one might tell a story to a child. With that being said, he's quick to throw details at you that might seem overdone -when in fact- they're usually done with an understated wit. 

The most successful way I've ever had relaying this idea is by comparing Adams and Gaiman. Adams' is looking at his reader from a kind-of stage...he's loud, and performing to the reader. Gaiman is tells you his stories in a small dark room in front of a fireplace. ",taycky22,2011-09-23T09:01:20Z,1,COMMENT,Fantasy,American Gods,23
kmkx4_24,kmkx4,"I read it a couple years ago, and for some reason the only part of the book I remember well at all is the wintering section.

*American Gods* was good, but Tom Robbins' *Jitterbug Perfume* was more engaging, intelligent, and well-written, while dealing with many of the same concepts.",laaazlo,2011-09-21T15:36:44Z,1,COMMENT,Fantasy,American Gods,24
kmkx4_25,kmkx4,"I'm a big Gaiman fan and I like American Gods, but I'll readily admit that Gaiman's protagonists aren't usually what's captivating about his stories^(*) . Rather, the entire cast of characters and they way they interact with each other and the odd reality in each book is what makes them appealing - like dark, modern fairytales.

(*) Exception: Sandman. All of the endless are awesome. And Anansi ;)",Pteraspidomorphi,2011-09-21T17:48:40Z,1,COMMENT,Fantasy,American Gods,25
kmkx4_26,kmkx4,"I liked American Gods but, man, did I hate that Gaiman chose 'Shadow' as the name of the protagonist. ",,2011-09-21T21:15:32Z,0,COMMENT,Fantasy,American Gods,26
kmkx4_27,kmkx4,"And to round things out, I'm an American who prefers Neverwhere to American Gods.  I like them both (and would probably be more likely to recommend American Gods to someone), but really liked Neverwhere.  ",srb846,2011-09-21T16:24:21Z,1,COMMENT,Fantasy,American Gods,27
kmkx4_28,kmkx4,I'm an American and Neverwhere is my least favorite Gaiman book.  But I loved American Gods.  Never made that connection before.,annietym,2011-09-21T18:11:23Z,1,COMMENT,Fantasy,American Gods,28
kmkx4_29,kmkx4,"I love Ender's Game, but hate everything Card has done after, and everything that I know about his personality...sorry to you Card fans. I will acknowledge that he created one of the best, most influential works in SF -but- the fact that he wrote it to ""get it out of the way"" in order to tell the following books in the series, really irks the shit out of me. He's even denounced its greatness in favor of pimping the following two novels. 

/CardRant

Back to the topic, I love American Gods...but I didn't love it until listening to the audiobook, and reading it yet again. And I think it's safe to assume that American Gods bugs most people due to the relative boring nature of its main character. The narrator is the star of the show. His language is beautiful, and his extrapolation of culture and myth is worthy of the novel's acclaim on its own. ",taycky22,2011-09-23T08:56:05Z,0,COMMENT,Fantasy,American Gods,29
kmkx4_30,kmkx4,"Not really, I just read a lot (probably read too much). American Gods had many tropes that I'm familiar with. ",Bronysos,2011-09-21T18:11:46Z,2,COMMENT,Fantasy,American Gods,30
103robo_1,103robo,"I read it 10 or 15 years ago, and I loved it.  (I don't know why some people didn't like it either.)

""Christ"" and ""Jesus"" as expletives are very much a part of American speech (and I'd guess British too), whether you are a believer or not.  Ironically, it's probably the more-religious people who are less likely to use them.

I also recommend the same-universe follow-up [*Anansi Boys*](https://en.wikipedia.org/wiki/Anansi_Boys) (which is not a sequel, plot-wise).  It's actually more of a comedy, much different in tone than *American Gods*.  I'm normally hesitant at novels that intend to be funny, but it's still Gaiman, and the humor worked.  I really really enjoyed it (though I don't much remember the plot, strangely, and maybe I'll re-read it this year).",Grantagonist,2023-01-05T15:11:04Z,1,COMMENT,Fantasy,American Gods,1
