id,post_id,comment_text,author,created_utc,sentiment,TYPE,category,book,comment_num
z4tggv_1,z4tggv,"Just came here to say that I’ve gone out of my way to visit The House on the Rock twice since reading American Gods, and it doesn’t disappoint. It is far stranger and more surreal than the book lets on.",Hugh_G_Normous,2022-11-26T04:07:58Z,1,COMMENT,Fantasy,American Gods,1
z4tggv_2,z4tggv,"I loved American God's, and if you enjoyed it, I recommend reading Anansi Boys. It's more similar to American Gods than Gaiman's other novels, and also set in America.",conspicuousperson,2022-11-26T01:31:55Z,1,COMMENT,Fantasy,American Gods,2
z4tggv_3,z4tggv,"I wanted to like American Gods. I love Good Omens. I  quite like Sandman. American Gods was an amazing idea that just never really went anywhere. The prose was amazing. The characters were amazing. The worldbuilding was amazing. I was bored out of my mind. And finally when we make it to the end that's been super hyped up and is going to be worth the slog, everyone just changes their mind and goes home. I get its appeal. If you love it I'm happy for you. It just wasn't for me.",gregallen1989,2022-11-26T03:09:37Z,2,COMMENT,Fantasy,American Gods,3
z4tggv_4,z4tggv,"If you liked American Gods, I highly recommend Anansi Boys and Neverwhere.",,2022-11-26T01:41:50Z,1,COMMENT,Fantasy,American Gods,4
z4tggv_5,z4tggv,"I love Neil Gaiman, but *American Gods* is one of his books that just didn’t click for me. I like it well enough, but I don’t love it.  

I liked *Anansi Boys* much better, and I think *The Graveyard Book* is probably my favorite piece of fiction he’s written.  I just recently went through his book of essays and introductions, *The View From the Cheap Seats*, and I think I might like his essays even more than his fiction.",sdwoodchuck,2022-11-26T03:58:11Z,2,COMMENT,Fantasy,American Gods,5
z4tggv_6,z4tggv,"I have read this book numerous times.  I've found it quite compelling every read.   

American Gods has that meandering pace and almost desolate feeling that is somewhat unique to English and Scandinavian literature.   

I feel that a great part of what makes it rereadable is that what isn't said paints as much of a picture as what is said.  (Like the music theorist who suggests that the space between the notes is at least as important as the notes themselves.)   

There are so many details that people don't seem to discuss.  

>!""Shadow"" is a shade, ghosting through his life, not really alive.  Yet the cost of the resurrection that brings him fully to life means... What? He's Baldr returned, but he gave up his name. So then who does he become?!<   
>!That's probably also why Scandi Odin knows him, but doesn't identify him.!<    

>!Anansi tells stories.  Partly because stories are part of his shtick.  Yet, very likely, every time he tells one of his spider stories to a group of humans or even gods, he's getting a trickle of soma. That's why he starts those meetings with barely relevant stories.!<",PlaceboJesus,2022-11-26T05:06:38Z,1,COMMENT,Fantasy,American Gods,6
z4tggv_7,z4tggv,"Love that book. 

Makes a strong argument that public figures (celebrities, actors, politicians, etc) are nothing without a willing public there to offer support ie. worship. 

But beyond that, it's just incredibly engaging and readable and does that thing that I love most about Gaiman; take ordinary, mundane things that you would normally ignore and not give much consideration and then looks closer to find something magical there. 

I love that shit. 

It's more of a comedy but I really recommend you check out Anansi Boys. 

It doesn't have a epic scale of American Gods, but it does take place in the same world and while I don't think it's as good as American Gods, it's still a terrific, fun and funny read",derpferd,2022-11-26T11:30:28Z,3,COMMENT,Fantasy,American Gods,7
z4tggv_8,z4tggv,"I went into American Gods expecting a strong major plot and an exploration of the “new” gods we worship in the West. Instead, I got a book about the unique struggles that are so common, and often unspoken, in America. The major plot was weak and forgettable because it was really just a vehicle to explore these other issues. I do wish Gaiman had spent a little more time exploring the idea of “new” gods and the implications it has for society though.

American Gods wasn’t my cup of tea but I think it’s safe to say it’s one of the greater works in recent years and it will be a great peek into the modern American life for years to come. I wouldn’t be surprised if it someday was considered a classic even. Wonderful writing by Gaiman, I’m glad you enjoyed it.",Slightlydifficult,2022-11-26T06:28:13Z,1,COMMENT,Fantasy,American Gods,8
z4tggv_9,z4tggv,"Sometimes I feel like the only person in the world who loved Anansi Boys but hated American Gods. Thank god I didn’t start with it because I might have sworn off Neil Gaiman forever. The story is a 500-page rambling lead up to an (admittedly clever) pun. Shadow never even gets a name.

Edit: Also, the idea that gods need belief to survive was done better by Terry Pratchett nine years earlier in Small Gods.",LeafOnTheWind25,2022-11-26T17:05:42Z,0,COMMENT,Fantasy,American Gods,9
z4tggv_10,z4tggv,I hated American Gods. But each to their own. :),dillanthumous,2022-11-26T14:29:00Z,0,COMMENT,Fantasy,American Gods,10
z4tggv_11,z4tggv,Never where is my favorite Neil Gaimen book. Anansi Boys was a loose sequel to American Gods. Good Omens was amazing. Also the novelisation of Coraline. He is just such a good author,redheadsuperpowers,2022-11-26T03:35:05Z,1,COMMENT,Fantasy,American Gods,11
z4tggv_12,z4tggv,"American Gods is SUCH a great book! Personally I didn’t care for the show as much, sadly.",forgetmeknotts,2022-11-26T13:46:46Z,1,COMMENT,Fantasy,American Gods,12
z4tggv_13,z4tggv,"Gaiman is such an annoying author, in that his work is all over the place. I adore Sandman and reread the whole saga every few years. His short stories are great as well, but his novels have done nothing for me (I couldn't even finish American Gods), ditto most of his screenplay work. His Doctor Who episodes were pretty darn bad, for example.",thedarkugus,2022-11-26T07:58:04Z,0,COMMENT,Fantasy,American Gods,13
z4tggv_14,z4tggv,"American Gods is one of my favorite books, and cemented my opinion that Gaiman is one of the greatest writers alive today. You can *feel* the prose in American Gods. It has breath, and life, and weight. Such a fantastic book.",CDRuss0,2022-11-26T06:31:02Z,1,COMMENT,Fantasy,American Gods,14
z4tggv_15,z4tggv,I thought American Gods was decent until the main character meanders in some middle of nowhere town for 200 pages. I actively hated the book after that.,moltenmoose,2022-11-26T08:51:41Z,0,COMMENT,Fantasy,American Gods,15
z4tggv_16,z4tggv,"I read this book and felt like the core idea was a rip off of a portion of Tom Robbins Jitterbug Perfume. That's fine, ideas get recycled all the time, but I just thought Robbins did a much better job with the idea and for that reason I just couldn't get into American Gods. It felt very rushed and cheap to me.",anotheroutlaw,2022-11-26T02:32:58Z,2,COMMENT,Fantasy,American Gods,16
z4tggv_17,z4tggv,"I liked it at first but by the end was really unsatisfied. Felt like there was so much in the story that was just a waste of time and amounted to nothing. The chapter about the cab driver getting throat fucked by that djinn, but then having literally zero tie in with the rest of the story? And then the constant alluding to Shadow being Native American and his connections to Native American gods…but then all of that foreshadowing just got tossed out the window just for him to be Odins son? 

I think the prose was good, the story had a good foundation, but it collapsed at the finish line with a ton of unrealized potential",anythingfordopamine,2022-11-26T04:59:44Z,0,COMMENT,Fantasy,American Gods,17
z4tggv_18,z4tggv,"Loved it!  Anansi Boys is great too though very different.  And there are a couple of short stories about Shadow post American Gods.  

Frankly from what I got about the TV show my impression was that it didn’t do the book justice.  

Also check out Neverwhere.  It’s also weird and wonderful.",DConstructed,2022-11-26T03:54:41Z,1,COMMENT,Fantasy,American Gods,18
z4tggv_19,z4tggv,"I read Neverwhere by Gaiman several years ago and hated it, and ever since then I’ve steered clear of his books. Is American Gods very different from Neverwhere? Or are his books/writing style similar enough that if you don’t like one you probably won’t like any of them?",yas_okay,2022-11-26T05:05:30Z,0,COMMENT,Fantasy,American Gods,19
z4tggv_20,z4tggv,"I DNF's American Gods back in 2007 or so. I found Shadow to be an empty vessel of a protagonist, and I found the ""horrification"" of female genetalia via the Babylonian goddess to be offensive. That said, i do think that I need to revisit it with a more nuanced literary palette, and a blank slate of expectations.",Gay_For_Gary_Oldman,2022-11-26T04:29:56Z,0,COMMENT,Fantasy,American Gods,20
z4tggv_21,z4tggv,"I'm a huge Gaiman fan, but when American Gods came out, I was disappointed because it seemed pretty formulaic compared to most of his writing. Was his first big hard-hitting adult novel, and I felt it was just okay. I don't think it holds a candle too ocean at the end of the lane, or even neverwhere.",DaFugYouSay,2022-11-26T10:39:41Z,0,COMMENT,Fantasy,American Gods,21
z4tggv_22,z4tggv,American Gods is the first book I've read for a second time. I absolutely adore it and glad it found you too.,A_Vicious_Vegan,2022-11-26T05:34:18Z,1,COMMENT,Fantasy,American Gods,22
z4tggv_23,z4tggv,"I thoroughly enjoyed Neverwhere by Neil Gaiman. Such a confusing journey filled with some inventive characters and a lot of darkness to go along with it. It’s really easy to connect to the main character too. 

For American Gods I got as far as the Merry Go Around before stopping and hopefully I’ll pick it up again with the intention of finishing it.",ralin_zild,2022-11-26T09:54:05Z,1,COMMENT,Fantasy,American Gods,23
z4tggv_24,z4tggv,I have mixed feelings about American gods. I did enjoy it but it was a tough read for me. I almost dnf it,Sammystorm1,2022-11-26T13:57:15Z,2,COMMENT,Fantasy,American Gods,24
z4tggv_25,z4tggv,"Glad you enjoyed it! I enjoyed it more. American Gods irritates me because it's such a cool concept, but the writing itself is just cardboard bland. I re-read it every few years, because in my memory the story is so interesting, but in reality it's a great concept that is held back by Gaiman's so-so prose. 

This is a common theme for me with his books, and to be frank the only one I've enjoyed fully has ben Anansi Boys.",PsyanideInk,2022-11-26T04:33:40Z,2,COMMENT,Fantasy,American Gods,25
z4tggv_26,z4tggv,"""Neverwhere"" is amazing.  Sandman on Dark Horse comics drew me in, Neverwhere made me fall in love, and American Gods brought so much satirical awareness.  I love Gaiman almost as much as Vonnegut.",avarchai,2022-11-26T05:34:19Z,1,COMMENT,Fantasy,American Gods,26
z4tggv_27,z4tggv,American Gods is definitely in my top ten favorite novels.,bowens44,2022-11-26T10:14:11Z,1,COMMENT,Fantasy,American Gods,27
z4tggv_28,z4tggv,"Gaiman is hands down one of my favorite authors, and American Gods, Anansi Boys, and Neverwhere are some of my favorite books of all time.",Lore-n-Linguini,2022-11-26T15:38:01Z,1,COMMENT,Fantasy,American Gods,28
z4tggv_29,z4tggv,"Although I have American family, I'm not American (grew up in Wales), so I get the feeling I missed out on a lot of the more subtle allusions. But I still absolutely loved this book. It's bizarre that I've only recently started reading Gaiman. He's completely in my wheelhouse and it's a name I've known for as long as I can remember, but for some reason I never picked up one of his books until last year. Read Neverwhere and had a great time. Then someone at work found American Gods in a charity shop and gave it to me as an impromptu gift. Which was so nice of him (I'm actually right now wearing a scarf he gave me yesterday that he bought in Madrid! Such an awesome dude). Fantastic writing and a really interesting take on the history of the USA and its relationship with immigration. Keep meaning to check out the Netflix series as that's supposed to be top quality as well.",ArgentStar,2022-11-26T16:54:26Z,1,COMMENT,Fantasy,American Gods,29
z4tggv_30,z4tggv,"American Gods is one of my favorite books of all time. If you’re looking for another Neil Gaiman book, I quite enjoyed Neverwhere. It’s got a similar offbeat vibe, and the world-building is a juuuust vague enough to be intriguing.",Ser_Drewseph,2022-11-26T17:13:45Z,1,COMMENT,Fantasy,American Gods,30
z4tggv_31,z4tggv,"Yessss. 

Neil Gaiman really did that. I loved American gods so much.",bettelgiuce,2022-11-26T17:17:55Z,1,COMMENT,Fantasy,American Gods,31
z4tggv_32,z4tggv,"You should check out Anansi Boys next, especially if you liked Anansi in American Gods. It's the same character, same world, etc. When I finished American Gods I wanted more of it and while A.G was the better book IMO, Anansi Boys was still super enjoyable to read.",SophiaF88,2022-11-26T18:26:27Z,1,COMMENT,Fantasy,American Gods,32
z4tggv_33,z4tggv,American Gods is my favorite book and the only book I've ever read nonstop from beginning to end without putting it down.,Earthwick,2022-11-26T18:43:27Z,1,COMMENT,Fantasy,American Gods,33
z4tggv_34,z4tggv,"I'm a traveller, and I love road trips. The very thought posited by Gaiman that ""every country except America has roadside shrines, and so this country's holy places are roadside kitschy attractions"", really struck me. I've driven past, stopped at, or otherwise seen thousands of these shrines pass by- and the melancholic air that surrounds these dilapidated visions of success that someone cooked up years ago, still reminds me of American Gods to this day. Be it South of the border in south carolina, Virgin, Utah western town, wall drug in South Dakota, or the ""world's largest ______"", I can't get enough. I never want to stop finding these magic shrines to the gods of America.",,2022-11-26T21:40:08Z,1,COMMENT,Fantasy,American Gods,34
z4tggv_35,z4tggv,"Don’t forget that there are sequel short stories! The Monarch of the Glen and the Black Dog. They’re not strictly speaking necessary, American Gods is standalone, but they give further context and show what happened to Shadow after.",MrBluer,2022-11-26T22:46:54Z,1,COMMENT,Fantasy,American Gods,35
z4tggv_36,z4tggv,"I absolutely love American Gods, Ive read it so often  and it never fails to please.",Oscarmaiajonah,2022-11-27T19:43:36Z,1,COMMENT,Fantasy,American Gods,36
z4tggv_37,z4tggv,"Weirdly I loved American Gods but couldn't stand Anansi Boys, only Gaiman book I couldn't finish.",GrinningPariah,2022-11-26T04:49:21Z,2,COMMENT,Fantasy,American Gods,37
z4tggv_38,z4tggv,I kinda made the same “mistake” too by starting with American Gods. It’s my 3rd favorite book.,Rourensu,2022-11-26T03:54:34Z,1,COMMENT,Fantasy,American Gods,38
z4tggv_39,z4tggv,"I feel quite the same about American Gods—the whole book felt like “the beginning,” like it was setting a million little things up for a big, connected payoff. And then it just fizzles at the end. I enjoyed the ride (for the most part) but when the train got to the station, it turned out it was just a grey beach with cold water.",No_Poet_7244,2022-11-26T03:29:52Z,2,COMMENT,Fantasy,American Gods,39
z4tggv_40,z4tggv,"I think Neil's Fandom has two sides, and American Gods is the fork in the road that splits the pack. It's my least favorite of his books, and I feel much the same as you. It's a great work, it just missed me.",mmm_burrito,2022-11-26T15:51:12Z,2,COMMENT,Fantasy,American Gods,40
z4tggv_41,z4tggv,"I too did not enjoy American Gods. It's nice that it resonated with the OP, but for me so many of the asides just seemed to be pointless and dull. Gaiman totally makes up for it with Anansi Boys, though.

I finally got around to reading Sandman many years later and I think one can definitely see seeds of some of the same ideas later reused in American Gods, especially in volumes like ""Fables and Reflections"" and ""Brief Lives"". I suppose it works a little better because there's no expectation that the more disconnected bits are supposed to be building to something. Or maybe they're just over faster.",Jorpho,2022-11-26T16:03:19Z,0,COMMENT,Fantasy,American Gods,41
z4tggv_42,z4tggv,"Same. I love most everything Gaiman has ever written. His book *The Ocean at the end of the Lane* is my absolute favorite novel, but American Gods just fell flat for me. 

It wasn’t bad, it just didn’t do anything for me. Reimagining pagan deities in a modern world has never been a particularly interesting thing for me, so from the get go I knew I wasn’t the target audience, but I love so much of Gaiman’s work that I hoped my love of his style would help me get past a premise that didn’t interest me.

Unfortunately all it served to do was make me more aware of the elements of his style that I don’t like.

Whenever I’m getting to caught up in “Neil Gaiman is perfect and can do no wrong” I can turn to American Gods and remind myself that even my absolute favorites are not perfect.",The5Virtues,2022-11-26T05:30:32Z,0,COMMENT,Fantasy,American Gods,42
z4tggv_43,z4tggv,"It reads a lot like many of Bradbury’s longer works. It lacks structure in a lot of places, but the poetic narrative that Gaiman uses for setting make me feel like I’m there.

There are books that feel like movies in their pacing and ability to tell a story, but American Gods feels like honest to goodness literature to me. I have a better grip on the English language after reading his words.",AgentG91,2022-11-26T16:15:57Z,2,COMMENT,Fantasy,American Gods,43
z4tggv_44,z4tggv,"I thought American Gods was average. Which doesn't mean I'm saying it's bad. It just wasn't ""incredible"".

It had really cool characters and I enjoyed it initially, but it had pacing problems around the middle of it, and I felt like all the pieces were on the board, but nothing was happening, and I had to force myself to the anti-climactic end.

It was almost as if Gaiman invented this incredible world but didn't know what to do with it. So overall I would say the novel was just OK. I did enjoy the start of it, and Gaiman writes well, but the actual plot is what was a let down.",WizardryAwaits,2022-11-26T19:21:39Z,2,COMMENT,Fantasy,American Gods,44
z4tggv_45,z4tggv,"I like American Gods well enough, but it’s not my favourite. I too absolutely adore The Graveyard Book.",-Squimbelina-,2022-11-26T09:57:10Z,2,COMMENT,Fantasy,American Gods,45
z4tggv_46,z4tggv,"I'm yet to read American Gods, but I felt exactly the same with The Shining. The book goes on a crescendo, reaches an amazing apex...and then it feels like King goes through all the possible shortcuts to end the story. Someone had a great analogy above: it feels like a very scenic train ride that ends in a cold, gray and tasteless beach.",StormTheTrooper,2022-11-26T14:40:07Z,0,COMMENT,Fantasy,American Gods,46
z4tggv_47,z4tggv,"I'm currently working my way through all of Gaiman's books. Only ever read Good Omens before. American Gods is really good, but I enjoyed Anansi Boys even more. I guess I prefer the more humorous stuff.",Almacca,2022-11-26T01:42:05Z,1,COMMENT,Fantasy,American Gods,47
z4tggv_48,z4tggv,"that’s interesting, i definitely love both of these books in very different ways. Jitterbug Perfume may very well be my favorite book ever written, but American Gods was the first book i ever read in one sitting. (was Christmas in a hotel and i read the whole thing in the bathtub) 

i think although they have superficial plot similarities, they are very different books. Jitterbug Perfume is genuinely one of the most joyful, life-affirming books i’ve ever read. on the other hand, American Gods is one of the most dreamy, melancholic (while not overwrought) books i’ve ever read.",snakeantlers,2022-11-26T04:01:08Z,1,COMMENT,Fantasy,American Gods,48
z4tggv_49,z4tggv,"American Gods, A Brightness Long Ago, and The Forgotten Beasts of Eld all come to mind for purely fantasy books.

It's difficult to compare them to classics like A Tale of Two Cities, which I think is pretty comparable but isn't really trying to achieve the same thing.",VexatedSpook,2022-11-27T00:08:18Z,2,COMMENT,Fantasy,American Gods,49
z4tggv_50,z4tggv,"*Neverwhere*, *American Gods*, and *Stardust* are by far Gaiman’s best work.",7LeagueBoots,2022-11-26T13:40:52Z,1,COMMENT,Fantasy,American Gods,50
z4tggv_51,z4tggv,"I found both anansi boys and neverwhere to be much more enjoyable than American Gods. Shadow is just such a flat, boring protagonist. I still enjoyed it but it’s not his best work.",arguably_pizza,2022-11-26T17:21:15Z,0,COMMENT,Fantasy,American Gods,51
z4tggv_52,z4tggv,"Honestly, I feel this way about two of the three Gaiman novels I’ve read (American Gods, and Anansi Boys). I love everything Gaiman writes except his endings. Good Omens was better, but still not what I would have liked.",costco_ninja,2022-11-26T05:17:22Z,2,COMMENT,Fantasy,American Gods,52
z4tggv_53,z4tggv,"Nope! I saw that he came up with the idea for Anansi Boys first, but actually wrote American Gods first.",,2023-01-01T20:12:09Z,3,COMMENT,Fantasy,American Gods,53
z4tggv_54,z4tggv,"Behave you.  I liked it.   I felt the focus was different though.  Quieter because they weren’t throwing character after character at the reader.  

I did miss Anansi himself; he was my main favorite in American Gods so I would have liked more of him in his namesake book.",DConstructed,2022-11-26T05:47:04Z,1,COMMENT,Fantasy,American Gods,54
z4tggv_55,z4tggv,"He lived in Chippewa Falls, WI for a long time, and Lakeside is clearly heavily inspired by the region. I lived in Eau Claire (about 20 miles away) for years and I've always felt American Gods was one of the best literary depictions of the area.

In other words, you _can_ live there but be warned, the winters are just as bad as he describes, and there's no Hintzlemann to ward off the rust belt decay.",hbarSquared,2022-11-26T19:08:40Z,1,COMMENT,Fantasy,American Gods,55
mwquw6_1,mwquw6,I read American Gods while I was in recovery for drinking too much. The death of Mad Sweeney scene came at a crossroads in my life and the decision that I was in the right place at the right time was made that morning. It was a tool that helped propel me to where I am now. Free from booze 18 months.,eldonte,2021-04-23T13:25:10Z,1,COMMENT,Fantasy,American Gods,1
mwquw6_2,mwquw6,"I can see how you think that. For me, I hadn't actually heard about Neil Gaiman at all when I picked up American Gods on my e-reader (really cheap, sounded interesting). Going in with low expectations, I was absolutely blown away. Basically, hype can ruin anything.",mintervesting,2021-04-23T11:33:39Z,1,COMMENT,Fantasy,American Gods,2
mwquw6_3,mwquw6,"My first ""reading"" of American Gods was the full cast version of the audiobook with Gaiman reading the ""Coming to America"" sections. I truly loved this version, but apparently it's the extended version and not the ""standard edition"".

I'm not sure if I would enjoy it as much without the little side stories in the coming to America sections, and other bits that may have been left out. And I do agree that the last section can get a bit hard to stay fully engaged in.",b00pthesn00t,2021-04-23T12:27:10Z,1,COMMENT,Fantasy,American Gods,3
mwquw6_4,mwquw6,"I thought American Gods did an excellent job of capturing the slow, sprawling emptiness of middle America and the things we do to fill or run away from that void.",rocketparrotlet,2021-04-23T15:34:51Z,1,COMMENT,Fantasy,American Gods,4
