id,post_id,comment_text,author,created_utc,sentiment,TYPE,category,book,comment_num
b2b9p3_1,b2b9p3,"Im not sure what you found displeasing in American Gods, exactly?  I dont think the names were meant to be a huge plot twist, they were very obvious and the  title of the book tells you who you are dealing with.  I think that the fact that the names are so very transparent is deliberate, that the gods may be reduced in stature, due to lack of belief and worship, they may have to make shift to survive in a world that doesn't revere them any longer but contains just enough belief to keep them alive, yet they are still themselves, true to their natures.  

I loved American Gods and Neverwhere, didn't like Anansi Boys, Stardust, or his short stories.  I haven't looked at Norse Mythology, because I don't need to, we have translations of the Eddas etc in the bookcases if I feel the urge for some norse myth.

You don't have to like Gaiman, it isn't compulsory, but Im still a bit puzzled at why you don't like American Gods?",Oscarmaiajonah,2019-03-18T16:26:23Z,2,COMMENT,Fantasy,American Gods,1
i1bts4_1,i1bts4,"I would assume that the god need to be connected with the fact. Having read American Gods and having a sketchy knowledge of Norse Mythology I didn’t immediately associate Odin with knowledge. Would you link McSweeny with luck of the Irish as a saying?  

To be worshipped a God must be recognised. If there is no recognition then the god is in-worshipped",electrican-lamore,2020-07-31T18:09:31Z,2,COMMENT,Fantasy,American Gods,1
i1bts4_2,i1bts4,"Well, you could make a pretty compelling argument that we actively worship TV and 'other shit'. However, I think the point made by American Gods is about belief. That we instill power in gods by believing in them. Believing in wisdon is not the same as believing in Odin. In the modern world, unlike earlier times where one religion would replace another, we have replaced gods with science and technology. Consequently, the apotheosis of these unconventional religions have become the new gods.",legendscrolls,2020-08-02T02:08:00Z,2,COMMENT,Fantasy,American Gods,2
i1bts4_3,i1bts4,"It's not about what actually exists it's about what the masses put their faith in.

And yes...in between the old gods and the current gods there have been others, eg books

This is becoming a theology question rather than a question about American Gods",unlocklink,2020-07-31T18:09:49Z,3,COMMENT,Fantasy,American Gods,3
caypxk_1,caypxk,*American Gods* is boring.,Kitschmachine,2019-07-09T17:25:41Z,0,COMMENT,Fantasy,American Gods,1
6qjic9_1,6qjic9,"my take: american gods is largely in part a tribute to the classic american road trip, visiting a bunch of small towns over the course of the book. that lense is just as important as the ""gods at war"" lense.

imo those two combinations are what make it such a good novel. but i get that people who dislike one of the parts dont like the novel.

your criticism is valid but i think that it's sort of not a major deal because the novel isn't about shadow per se. he's just the vehicle for the story.",rjbman,2017-07-30T20:52:11Z,1,COMMENT,Fantasy,American Gods,1
6qjic9_2,6qjic9,"American Gods is my favorite book. However it's definitely not going to be for everyone. Even if they're otherwise a Gaiman fan.

It's a book almost more about a road trip then the central plot. I'd say if you made it past House on the Rock and still aren't interested then it's probably not worth continuing in your case.",Rork310,2017-07-31T02:25:03Z,1,COMMENT,Fantasy,American Gods,2
6qjic9_3,6qjic9,"I thought I was the only one who couldn't finish this book, but then my partner tried reading it and stalled out halfway through as well. 

Glad to know we're not the only one who found this book uninspiring. I really enjoyed the Sandman series, but American Gods was kind of a letdown after reading that (well, the first 100 pages were at least.) My theory is that if you've never read Sandman, American Gods seems like a much more novel and unique story, and that's why it earned the reputation it has. ",mountain-ghost,2017-07-30T23:00:58Z,0,COMMENT,Fantasy,American Gods,3
6qjic9_4,6qjic9,"I'd say American Gods is a book about stories. The main story (shadow, wednesday...) are not as important as the substories about the olden times, the gods and how they came to be. Very typical for a talented storyteller like Neil Gaiman.",Highlord,2017-07-31T04:56:12Z,1,COMMENT,Fantasy,American Gods,4
6qjic9_5,6qjic9,"I really liked Anansi Boys, it has a completely different feel and pace to it.  I should disclaim that I really enjoyed American Gods also, but I have friends that hated American Gods and still liked Anansi Boys.  It has a quicker pace and is more story-line focused.",gheat,2017-07-30T20:47:45Z,1,COMMENT,Fantasy,American Gods,5
95s8qe_1,95s8qe,"Gaiman is easily among my top 5 favourite authors and maybe even number 1. 

> ""Art thou a witch, viva espana?""

I've read American Gods, Neverwhere, and Good Omens each at least twice, and have listened to the audiobook versions countless times (there's a radioplay of Neverwhere featuring James McAvoy and Natalie Dormer that's *really good* -- this is how it was originally written, the novelization came after).",,2018-08-09T07:07:39Z,1,COMMENT,Fantasy,American Gods,1
95s8qe_2,95s8qe,"American Gods is one of my favourite books of all time. I pull it out every two or three years just to reread it. I’m a mythology buff and I pick up on something new every time. 

Anansi Boys is set in the same world as American Gods, more or less, even though it’s a very different story. It makes for an interesting comparison. ",Ddogwood,2018-08-09T01:52:14Z,1,COMMENT,Fantasy,American Gods,2
95s8qe_3,95s8qe,"American Gods is pretty dang good, hard to get better than that. ",,2018-08-09T02:19:20Z,1,COMMENT,Fantasy,American Gods,3
95s8qe_4,95s8qe,"I started reading this book but I’ve had a very tough time finishing it. I got a good chunk of the way through and while the story is alright I couldn’t help but feel the style of writing he was going for/type of story has been better done by say - Tom Robbins.

Some of my friends absolutely loved American Gods and I had really high expectations for it. I think if it was my first time with that kind of story it might have had a bigger impact but as it stands, for me it’s a little clunky. I still want to finish it one day, my hope is the pace and prose will pick up a bit at the end.",captainreadmore,2018-08-11T12:45:19Z,0,COMMENT,Fantasy,American Gods,4
95s8qe_5,95s8qe,When does the really cool stuff start in *American Gods*? I'm 160 pages in and wondering how far I need to go to see some action or finally decide to give up.,uglybutterfly025,2018-08-09T14:06:02Z,2,COMMENT,Fantasy,American Gods,5
95s8qe_6,95s8qe,"Nevwhere is a fantastic story, i'm sure you'll love it. I've had American Gods on my shelf for a while now as i've slowly been chipping away at the other unread books on my shelf, but i'm sure i'll get to it soon.",,2018-08-09T14:11:58Z,1,COMMENT,Fantasy,American Gods,6
95s8qe_7,95s8qe,"I love this book so much, I've read it 3 times. There is an amazing full cast narration of an unedited version of American Gods on audible and it is an excellent listen! I was introduced to Gaiman through the Sandman series, if you like graphic novels, it's a great saga about the 'Endless' i. e. Death, Dream, Lust, etc. ",lelly-loo,2018-08-09T18:00:32Z,1,COMMENT,Fantasy,American Gods,7
95s8qe_8,95s8qe,"I get what you're saying. While I didn't hate *American Gods* it is my least favorite Gaiman novel. *Anansi Boys* was great -- it's largely why I read AG. And I know *The Sandman* graphic novel series has been mentioned here, but it is a classic and must read for any Gaiman fan or graphic novel aficionado.",kazingaAML,2018-08-09T19:56:22Z,1,COMMENT,Fantasy,American Gods,8
95s8qe_9,95s8qe,"Well you have to remember this was his first solo novel and also it was in 96, before urban fantasy oversaturated the media in the 2000s to now. So the idea of magic, improbable characters and a whole other world being a few feet below you or through a door in a London underground tube was a pretty original idea outside of comics.

But yeah, it does suffer from a lot of find the mcguffin tropes and pointless characters. He really improved  his style in Stardust, American Gods, and Coraline.",plaidchuck,2018-08-09T09:05:35Z,1,COMMENT,Fantasy,American Gods,9
c8zod9_1,c8zod9,"I bought the book because I really really love the concept. I really want to love this book. I love the portray of the Old and New Gods. I love Mr Wednesday's plan. But there was a lot of trouble with the execution.

It wasn't clear what the stakes were. What happens if the Old Gods win? What happens if the New Gods win? Why should I care? I know what are the stakes in Watership Down, Lord of the Rings, Harry Potter etc. I do not know the stakes in American Gods.

The main character always get out of trouble due to coincidences. Not due to cunning, courage, endurance, skill etc, but luck and coincidences. Frodo had to walk all the way to Mount Doom. Hazel and gang had to brave man-made traps and predators. Shadow wins because his wife always just happens to be at the right place and right time.",Beaglers,2019-07-05T08:01:31Z,0,COMMENT,Fantasy,American Gods,1
hjzb2w_1,hjzb2w,"I really loved *American Gods,* it's honestly one of my favorite books of all time, but I think that's because I force myself to take my time with it in the same style that the story itself forces you to take your time. It meanders, road trip style, in an out of different characters, locations, attractions, myths. I really loved it and I try to make a point to reread it once a year because I love it so much. 

That being said, the style is just not for everyone. Plenty of people prefer *Anansi Boys* (which was originally written as a spin-off of AG) because the story hits certain plot beats much faster, the characters are a little more pronounced, they know who they are. 

I would recommend Gaiman's short stories if you're looking for more of his style with less of a ""journey"" (for lack of a better term).",Deliriums_BabelFish,2020-07-02T19:51:34Z,3,COMMENT,Fantasy,American Gods,1
hjzb2w_2,hjzb2w,"American Gods can be difficult as it kind of requires rather extensive knowledge of most of the world mythology to be fully enojyed - every character represents not only a specific deity, but also a whole bunch of concepts associated with that deity. Shadow's journey becomes clear in the end, but sort of only if you guess beforehand who he is... 

[This] (http://www.frowl.org/gods/gods.html) is extremely helpful, but can be considered spoilery.",bluehexx,2020-07-02T15:51:38Z,2,COMMENT,Fantasy,American Gods,2
hjzb2w_3,hjzb2w,"I kind of compare American Gods with Percy Jackson books in terms of associating myths in a story set in modern times. I love the PJ series because I had prior knowledge about Greek Mythology although not that much but I still got the references. Maybe you are right, I might read more about mythology and have a reread of American Gods. Thanks for the link!",Kalle_022,2020-07-02T16:02:27Z,1,COMMENT,Fantasy,American Gods,3
hjzb2w_4,hjzb2w,"> I kind of compare American Gods with Percy Jackson books

Yeah, no, that's a different league of literature.",bluehexx,2020-07-02T16:04:42Z,3,COMMENT,Fantasy,American Gods,4
7dle94_1,7dle94,"I read American Gods when it first came out..I re read it at least once a year because its a story I really enjoy.

I can understand why Shadow comes across as ""flat"" and empty but I think the clue is in the name...remember he is really part god, but not only does he not know that himself, but that part of him is unawakened, so he really is a ""shadow"" of what he will later become.  It isn't only the death of Laura that makes him that way, as Laura remarks at one point that sometimes she would come into a room and not realise he was there sitting in the dark.  Laura and his love of her seem to act as his anchor in the world and that is why Wednesday has to have her removed so that Shadow is available when he is ready to make his move.

Belquist was the introduction of the plot of old Gods and Goddesses existing in modern day America...later its explained how they actually came to America, and then how new Gods are made in America so tying the past and present together.  Shes just your first picture of the ordinary and the extraordinary living side by side.  Same with the stories of various arrivals...they appeared to be placed randomly in the book to show the randomness of their arrivals..some were brought deliberately, some were carried almost accidently, but they all ended up living in a strange land almost forgotten and having to struggle to survive.

Shadow was prepared to undertake the vigil on the tree because he had to, he had taken an oath and drunk the mead and this was his last act...he had nowhere to go, nothing to do or any future plans at this point, he had been drifting along doing as Wednesday asked and now Wednesday was dead and this was his final act for him.  In Norse mythology, Odin hung upon the tree, a sacrifice of himself to himself, and this is how he gained knowledge, as Wednesday hints when he quotes one of the old verses to Shadow earlier.  So here you have the two mythologies meeting each other..a son being the most powerful sacrifice for a father re Christian mythology, and Shadow also (unknowingly) being part of Wednesday so that after he is taken from the tree he is finally fully awake, he has knowledge, and although at first he only wants an end and death, he then re enters the world and finally acts with some self determination.",Oscarmaiajonah,2017-11-17T19:51:17Z,1,COMMENT,Fantasy,American Gods,1
7dle94_2,7dle94,"I also just finished American Gods on Monday. It was my first Gaiman read, and I came away from it with mixed feelings as well. First off, obviously a brilliantly creative book. He’s clearly a fantastic writer, but I agree that parts of it felt very slow, particularly the Coming to America segments. At times, it felt like Gaiman just crammed lots of brief descriptions of different Gods into the book to make it live up to its title. It could have been more entertaining to read if the parts about the old Gods had been more cohesive to the specific part of Shadow’s journey.

I loved Shadow’s dream sequences, especially the fact that they sometimes have consequences on real life, like the Thunderbirds one. I thought that was brilliant.

I thought the coin tricks and the eternal coin keeping Laura half-alive, even after her funeral, were very cool plot points. Also loved the bank con, I wish Gaiman had written a few more cons like that. Finding Allison McGovern’s body in the trunk was a crazy surprise, and the ending scene in Lakeside was awesome. Lots of suspense and interesting twists.

I agree with what’s been said about Shadow’s relationship with Laura. Shadow’s emotions are sometimes described as angry, other times as apathetic, and others still as longing for Laura. No matter what she does to him or says (telling him he’s not even alive but Robbie is, telling him Robbie liked fucking in a mirror, etc.), he doesn’t ever sway or feel conflicted about his love for her. Huh? It almost seems like he ties himself to the tree out of spite, but not to get back at her. Almost to...get her back? But then he doesn’t want her back? But he does? Weird arc for me that could have been written much more compellingly.

I did think Laura killing Mr. Town & Mr. World was badass though.",yogurt_viking,2017-11-17T17:15:30Z,2,COMMENT,Fantasy,American Gods,2
7dle94_3,7dle94,"I'm a week late to this party but here's my thoughts:

I grew up reading myths/legends/folktales. I loved all of the shout-outs to various cultures and mythologies. It made reading American Gods so much fun. 

Shadow is one of my all time favorite characters. I wanted to slap him upside his head most of the book for being a complete and utter dipshit. He made so many bad decisions by refusing to take control of his own life. In the scene where he takes the job from Wednesday at the bar there's a line. ""The drink was a tawny golden color"". I literally yelled ""Don't drink it! It's either magic or piss!"" But of course Shadow drinks it. Then Wednesday mentions it's mead and I was like ""Yep. You're fucked. Dumbass drinking stuff when a dude just said he's a leprachaun.""

I also loved how descriptive and long and winding the book was. I enjoy description and long plots. So that was a plus.

I think the reason why the characters were so flat is because they dont portray people. The characters portray ideas and concepts that look like people and live like people. Even one of the few human characters, Laura, is a zombie. She isn't living Laura. She's dead Laura who Shadow brought back. I would be willing to bet that she might even be Shadow's idea of Laura instead of Laura herself.

Shadow is the most complex character because he is more than an idea that looks human. His mother was human so he is partially a living breathing human being. He was a hollow man though throughout the book because he literally couldn't be a full person if he only relied on his human half. He didnt get angry at his wife or feel betrayed because there wasn't enough Shadow functioning to care. He was on surival mode. It was only after he realized and accepted that he had another half that he was a full person. That's why he wasn't as much of a dumbass once he came back to life and finally stopped being a pushover.

TL;DR: American Gods isn't for everyone. It has stylistic elements that a lot of people don't care for. However, if you like long, winding stories and characters that aren't quite people you might like American Gods. 
",,2017-11-24T03:21:17Z,1,COMMENT,Fantasy,American Gods,3
7dle94_4,7dle94,*Neverwhere* and *The Graveyard Book* are probably my favourite of his works. I found *American Gods* to be alright but nothing outstanding.,VoidByte,2017-11-17T21:01:03Z,1,COMMENT,Fantasy,American Gods,4
7dle94_5,7dle94,"And to add to the comment below about his choice of the afterlife being flat, I totally agree. It felt like a forced way to label Shadow as a tired everyman. I love Haruki Murakami’s books, and he does an amazing job of depicting boring everymen in absurd, fantastical situations, with interesting payoffs at the end. Different style, but wish American Gods had had a little more of Murakami in it.",yogurt_viking,2017-11-17T17:18:14Z,0,COMMENT,Fantasy,American Gods,5
bgpip2_1,bgpip2,"I agree, but for reasons different than yours.  American Gods, the book, was about America first and God’s second.  The show glosses over the unique American landscape and culture with the gods serving as soundboards for different aspects of America and the immigrant experience.  The characters in the show are too concrete most the time and when they’re being metaphorical it’s with all the subtlety of a hand grenade.  

The actual human characters were pretty awful in the book and choosing to focus so much time on them was a mistake.  Shadow especially, he may as well been in how not to write protagonists for dummies.  He was purely reactive in the book aside from one event 1000 pages into it and when you translate it to the screen it’s so much worse.  

The over all visual tone of the show is also too stylized.  When everything is Tim Burtoned you actually lose the unique aspects of your location.  

Finally it needs to pick up the god damn pace.  There’s no reason it needs more than 2 seasons.  

It’s not terrible, but it’s not as good as the book and the book had major problems.",Twokindsofpeople,2019-04-24T12:22:47Z,2,COMMENT,Fantasy,American Gods,1
bgpip2_2,bgpip2,I'm gonna be honest I did not read American gods as gritty or muted and I felt like Fuller captured the feel of the book with his direction and that it was a shame they dropped him for season 2. The biggest thing I thought was that he really did well with the vignettes showing the other gods.,,2019-04-24T14:06:58Z,1,COMMENT,Fantasy,American Gods,2
bgpip2_3,bgpip2,"I think the tone and aesthetics are right on for how I pictured things while reading the book.  As far as the changes go I think it's kind of unique in my experience in that it's almost a completely different story from the novel but I don't think it would work as well for someone who hasn't read the book as it does for me.  I think the slow pace of the show would get frustrating for someone going in blind, but for someone who's read the book and knows at least in broad strokes what that pace is building to it works fine.  Usually adaptations that stray as far from the original as American Gods has loose what made the original appealing but I don't think the show has lost that spark, that's kind of impressive.",stereobreadsticks,2019-04-24T14:42:32Z,2,COMMENT,Fantasy,American Gods,3
bgpip2_4,bgpip2,"I thought it was pretty good, but it’s been a long time since I read American Gods. I understand your complaints though.",mybodyisapyramid,2019-04-24T04:37:37Z,2,COMMENT,Fantasy,American Gods,4
bgpip2_5,bgpip2,"Yeah, you were who I wanted to hear from. I just saw the world differently in my head. Except maybe Shadow. He seemed right but everything else about what I saw was not what I feel when I read the book. I guess I don't see Gaiman as otherworldly so much as our world adjacent. And especially with American Gods I see it as Michael Zulli versus Marc Hempel.",nutherdrunk,2019-04-24T12:48:03Z,2,COMMENT,Fantasy,American Gods,5
bgpip2_6,bgpip2,"Aww. I liked Altered Carbon. But, as I said in another comment, I wasn't attached to that story. The adaptation wasn't as good as the book but the Poe hotel was fun and it opened the door to an interesting series.

And I really tried to be open minded with American Gods. I knew from the Vikings that it wasn't for me but I wanted to try. I mean... I enjoyed the League of Extraordinary Gentleman movie because I accepted it had nothing to do with the comic. Same with Constantine. But sometimes you just want your idea to be presented on screen.",nutherdrunk,2019-04-24T05:01:39Z,2,COMMENT,Fantasy,American Gods,6
bgpip2_7,bgpip2,">Michael Zulli versus Marc Hempel

(\*googles furiously\*)

Ha - I'd be happy with either of those illustrating a Gaiman cover.

We disagree I guess, though I don't really see why people have issues when a screen adaptation turns out differently from how they  imagined it, when (important) the same creators are involved with both.

See, if LOTR had turned out wildly different, that would have been a problem for me. The Hobbit did, and that *was* a problem. American Gods, Altered Carbon, even Hitch-Hiker's Guide? In each case the original creator was fully involved with each iteration and such differences as were introduced I've always found acceptable.

It's a personal thing though. If you don't like something then it's up to you. Move on, find something else, write about that :).",jfffj,2019-04-24T13:47:52Z,1,COMMENT,Fantasy,American Gods,7
la2gz3_1,la2gz3,"Urban fantasy written in archaic, high-fantasy prose would come off as unbearably pretentious. The whole point of urban fantasy is the layering of the fantastical over the mundane, usually from the POV of a character from the mundane world. Do you know anyone in real life who talks like Elrond from LotR? Unlikely, and if you did you’d probably think they were a pretentious weirdo. This is especially the case in American Gods because it’s all about how the mysteries and power of the old gods has become diminished to the point where they’re almost mundane themselves.

I can understand having a problem with the slow, meandering pacing of the book, but again if you got through the whole of the LotR trilogy then that shouldn’t be as much of a problem for you IMO.

As for the characterisation of Shadow, this is a man who has spent the last three years of his life in prison with the only thing keeping him going being the thought that he’d get to see his wife again, only to find out that she was not only dead but that she wasn’t who he thought she was. And then all the god stuff on top of that. When faced with an overwhelming change of life circumstances like that, some people focus on their feelings and try to sort them out and process, and others bury their feelings and just focus on trying to get through their day. Shadow is the latter. When the weird stuff happens he thinks that he’s hallucinating or going crazy and decides to just roll with it until things start making sense again. As a result of this Shadow is a bit flat in the first half of the book and a lot of his character development happens later in the story.",RebelScientist,2021-02-01T13:54:23Z,1,COMMENT,Fantasy,American Gods,1
la2gz3_2,la2gz3,"If I were to rank Gaiman books, American Gods would be near the bottom. I think he is strongest with more whimsical books like Neverwhere, Ocean at the End of the Lane and Coraline.",Ineffable7980x,2021-02-01T16:22:26Z,3,COMMENT,Fantasy,American Gods,2
5mgwnw_1,5mgwnw,"I thought it was okay. The plot is very slow so if you're read primarily for plot, as I do, it's a rough time slogging through. Anansi Boys is much lighter and doesn't require you to have read American Gods.",SlightlySharp,2017-01-07T17:54:17Z,0,COMMENT,Fantasy,American Gods,1
