id,post_id,comment_text,author,created_utc,sentiment,TYPE,category,book,comment_num
xgn3b4_19,xgn3b4,Misery is sooo good!! It’s not something you forget.,casteelhearts,2022-09-18T02:51:12Z,1,COMMENT,Horror,Misery,19
xgn3b4_20,xgn3b4,I just finished Misery.  I’ve had it on the back burner for about 20 years.  I enjoyed it.  I thought it was a little too slow at first.  Almost put it down.  I’m glad I stuck with it.  There are a lot of incredible scenes in the second half of the book.  I thought the ending was solid and felt right. I didn’t understand the kid with the skunk storyline.  Does that play into another book of his or was that just his inspiration to start writing again?,jc17ford,2022-11-23T02:51:29Z,1,COMMENT,Horror,Misery,20
xgn3b4_21,xgn3b4,He absolutely was! Misery was my first Stephen King book as well and none of his other books have ever even come close to surpassing this one in my mind,,2022-09-18T01:50:18Z,1,COMMENT,Horror,Misery,21
xgn3b4_22,xgn3b4,"What other non-supernatural books of his do you recommend? I’ve so far read Christine, Firestarter, Misery, The Green Mile, Thinner, and I’m currently reading The Tommyknockers, all of which besides Misery obviously are supernatural, but I love his writing style and wouldn’t mind reading something that’s not sci-fi or spooky!",3catmafia,2022-09-17T22:03:45Z,3,COMMENT,Horror,Misery,22
xgn3b4_23,xgn3b4,"*Misery* is a good place to start with King’s works! It’s generally thought to be one of his best novels, and it’s not as long as some of the other ones.",okiegirl22,2022-09-17T15:17:10Z,1,COMMENT,Horror,Misery,23
xgn3b4_24,xgn3b4,"You could always get your feet wet with one of his great short story compilations. It would give you a taste of his style with a great variety of settings and a much smaller time commitment.

Skeleton Crew, Night Shift, and Everything's Eventual are three of my favorite King short story books.

If you're determined to read something longer -- and he's a master at making a thousand pages fly by -- then these are considered some of his best: The Shining, It, Misery, Pet Sematary.

One of his newer books I thoroughly enjoyed that doesn't fall into the typical ""monster"" genre is 11/22/63. Without spoiling anything, it's about someone that finds a way to step into the past and experiment with ways to change history.

Finally, and most brilliantly, many of King's stories link together in a meta epic Gunslinger (Dark Tower) series. I personally wouldn't start there, but it's a fun ride once you've gotten deep into his catalogue.",lolhal,2022-09-17T15:29:32Z,1,COMMENT,Horror,Misery,24
xgn3b4_25,xgn3b4,Misery is also decently short if I remember correctly.,FourCylinder,2022-09-17T19:00:28Z,2,COMMENT,Horror,Misery,25
xgn3b4_26,xgn3b4,It’s honestly mostly downhill if you read misery first (considered one of HIS BEST).,doublepoly123,2022-09-18T06:06:29Z,2,COMMENT,Horror,Misery,26
xgn3b4_27,xgn3b4,Misery is one of my favorite novels and I had *no* clue about the original ending. Thank you for blowing my mind! Hot damn.,myneighborpikachu,2022-09-17T22:58:00Z,1,COMMENT,Horror,Misery,27
xgn3b4_28,xgn3b4,"King started writing *Misery* as a Richard Bachman novel, but then his identity was blown with the release of *Thinner*.",HugoNebula,2022-09-18T09:50:13Z,3,COMMENT,Horror,Misery,28
xgn3b4_29,xgn3b4,"Misery is the only Stephen King book that gave me anxiety to the point I almost couldn't read it and I never understood why.  This explains it, because it's so real, she's so real.",herbalhippie,2022-09-18T02:55:06Z,1,COMMENT,Horror,Misery,29
xgn3b4_30,xgn3b4,That’s like me with Salem’s lot. I’ll give the misery a try next week once I’m finished with my current book. Thanks!,MysticLimak,2022-09-18T04:40:44Z,2,COMMENT,Horror,Misery,30
xgn3b4_31,xgn3b4,Cool!! Thanks for this. I’d always heard his short stories are great but wondered which ones. Think I’ll definitely be diving deeper into his books after Misery!,stubbornturnips,2022-09-17T17:05:46Z,1,COMMENT,Horror,Misery,31
xgn3b4_32,xgn3b4,"I recommend The long walk, The shining, Pet Sematary, Cujo, and Gerald's Game after Misery. All good books but not big Bois like IT and The Stand (both are good too)",,2022-09-18T10:22:33Z,1,COMMENT,Horror,Misery,32
py0ggr_1,py0ggr,"Hey, I just read this last week as the first book I've read in over a decade! I also loved it. Went out and bought The Shining, Pet Sematary and IT right after. Already burned through the Shining and PS but I think I'm going to read something else before diving into IT. Misery was my favourite of the bunch, but I thought they were all great.",,2021-09-29T18:36:34Z,1,COMMENT,Horror,Misery,1
py0ggr_2,py0ggr,You should read Dolores Claiborne next - it’s got a similar style to Misery.,CaveJohnson82,2021-09-29T19:39:07Z,2,COMMENT,Horror,Misery,2
py0ggr_3,py0ggr,The book is far superior to the movie and the movie was amazing!  Misery was one of those books I just couldn’t put down. Sooooooo good!,S3tty,2021-09-29T23:47:08Z,1,COMMENT,Horror,Misery,3
py0ggr_4,py0ggr,"Misery is awesome inside Stephen King who is generally awesome. Also, i wasn’t disappointed by the movie, after reading the book",woodquest,2021-09-29T17:48:56Z,3,COMMENT,Horror,Misery,4
py0ggr_5,py0ggr,"Oh I love the book so much! (Less than 11/22/63, but a close second favourite). I love it's broader implications, the story of how obsessive fans/fandoms can make authors despise their own work. I read somewhere that Misery was about how Stephen King felt about being boxed by fans into writing horror only (not 100% sure). It also made it so easy to understand how an author could start to hate their most loved character because of crazy fans and toxic fan culture. Like how George R. R. Martin isn't writing more GoT books or Sir Arthur Conan Doyle wanted to kill off Sherlock..",aykray,2021-09-29T18:53:09Z,1,COMMENT,Horror,Misery,5
py0ggr_6,py0ggr,Misery is one of the few stories where a legit debate can take place on which is better; the movie or the book.,the_doughboy,2021-09-29T22:51:58Z,1,COMMENT,Horror,Misery,6
py0ggr_7,py0ggr,"Misery is in my top 4 Stephen King books! I'm so glad you enjoyed it. If you haven't already, I definitely recommend watching the movie! Kathy Bates is incredible as Annie. My husband thought the movie was a little campy, but clearly it stuck with him because he refers to me as his dirty birdie sometimes! 

If you liked misery, the others in my top 4 are The Stand, IT, and The Long Walk. The latter is more of a thriller than a true horror, but I love it! Happy reading, I hope you love it all!",RedBeardtongue,2021-09-30T00:40:54Z,1,COMMENT,Horror,Misery,7
py0ggr_8,py0ggr,“Misery” is one of the few Steven King books I’ve read that is legit good and not 500 pages too long.,,2021-09-29T19:15:20Z,1,COMMENT,Horror,Misery,8
py0ggr_9,py0ggr,"Back in the day I saw a stage adaptation at a small theatre of ""Misery"" that blew me away. If you ever see it playing anywhere, I'd recommend seeing it.",Whifflepoof,2021-09-30T00:24:47Z,1,COMMENT,Horror,Misery,9
py0ggr_10,py0ggr,"It was the first King I read and maybe the most enjoyable. I’ve like his other books too, but Misery is just so engrossing and hard to put down.",Flobonious83,2021-09-30T03:28:29Z,1,COMMENT,Horror,Misery,10
py0ggr_11,py0ggr,I love Misery! Should really reread it. Annie is such a fantastic character.,throwaway62719836,2021-09-30T05:00:37Z,1,COMMENT,Horror,Misery,11
py0ggr_12,py0ggr,"Only parts I didn't like were when you had to read long excerpts of the book misery written by Paul. 
I ended up skipping it after awhile, hopefully that wasnt a crucial part to the story.",,2021-09-30T08:01:33Z,0,COMMENT,Horror,Misery,12
py0ggr_13,py0ggr,"Misery is one of the few that I have yet to read by King.

Side note: I moderate a small subreddit dedicated to discussing his work. Come join us! We love thoughtful analysis like this! /r/constantreader",JimRennieSr,2021-10-06T02:56:34Z,2,COMMENT,Horror,Misery,13
py0ggr_14,py0ggr,Misery is SK’s best book imo,,2021-09-30T10:40:38Z,1,COMMENT,Horror,Misery,14
py0ggr_15,py0ggr,What u/theKGS says - but also I’ve seen it described as a sister book to Misery. I’m not sure I agree with that - lots of King books have events and characters interlinked - but it has been said!,CaveJohnson82,2021-09-30T13:35:42Z,2,COMMENT,Horror,Misery,15
py0ggr_16,py0ggr,"Misery itself counts. The book is good, but Kathy Bates is excellent.",AjeebMaut,2021-09-29T20:25:14Z,2,COMMENT,Horror,Misery,16
py0ggr_17,py0ggr,"The Green Mile was first written and released in six 75 page (approximately) monthly instalments. As with any episode based piece, each instalment finished with a cliff hanger which is probably partly why it made such a good movie; it was already structured as a series of acts, like a play.

I always liked how Kings writing style and subject matter developed and overlapped through this period. In Misery (1987) Wilkes was tortured by the continuity trick that was played in the cinema serial and gave Sheldon a bollocking for using the same device in his ‘resurrection’ of Misery. 

Nine years later King tests himself by writing the Green Mile in instalments. The direction of each instalment was influenced by readers reactions to the previous instalment, but he knew he must avoid the dirty birdy plot device despised by Wilkes. 

Similarly, King wrote the Dark Half after his stint writing under the pseudonym Richard Bachman. This is among his best IMO.

EDIT: tricky dicky to dirty birdy… the ol’ memory ain’t what she used to be!",,2021-09-29T21:27:21Z,2,COMMENT,Horror,Misery,17
wrw0c4_1,wrw0c4,"*Misery* was my introduction to King.  I found a dog-eared copy of it on one of my parents' bookshelves (we had two in the basement filled with books) and read it when I was fourteen or so.  I quickly branched out into *It*, *The Stand*, *Pet Sematary*, and *Cujo*.  All are great, with the first two being among my favorite overall novels.",improper84,2022-08-19T02:12:12Z,1,COMMENT,Horror,Misery,1
wrw0c4_2,wrw0c4,"when i first tried getting into stephen king, misery was the first book i ever got by him. i enjoyed it a ton and it quickly became my favourite book of all time. rereading it was just as good of an experience. it’s such a damn good book and i love it so much.",mychubbyguineapig,2022-08-19T01:37:28Z,1,COMMENT,Horror,Misery,2
wrw0c4_3,wrw0c4,"This is interesting to me because to me Misery is a weaker King book (from the less than ten I've read). The Shining, even Pet Sematery are stronger in nearly every way.",Auspicious_dissenT,2022-08-19T16:08:01Z,3,COMMENT,Horror,Misery,3
wrw0c4_4,wrw0c4,"I thought that unlike most of his later works, the ending to Misery worked well.",cinnapear,2022-08-19T09:39:19Z,1,COMMENT,Horror,Misery,4
wrw0c4_5,wrw0c4,"still, misery is one of the few king books where the feeling of 'that was a shit ending' is so memorable, even though I can't remember what the actual ending is anymore.",Dohi64,2022-08-18T23:38:35Z,2,COMMENT,Horror,Misery,5
wrw0c4_6,wrw0c4,"I've read two: Misery and The Shining. They are great books. They take a while to build up the characters (his characters are incredible) and the atmosphere and they can sometimes be a bit slow (though I didn't think so with Misery) and his endings are not normally great but he is called the king of horror for a reason and I would definitely reccomend his books. The books are often quite realistic with many of the things they deal witb (alcohol, loss of a child etc) which adds to the fright. Misery is a shorter read so I think it will be great.",BobTheBlob78910,2022-08-19T21:42:57Z,1,COMMENT,Horror,Misery,6
wrw0c4_7,wrw0c4,"It really is. I've seen really dramatic gore in horror movies and none of them made me feel sick. The only horror involving injury that has made me look away is Misery. I don't know what it is but, Lord, it was enough.",WanderingBadgernaut,2022-08-19T03:35:09Z,1,COMMENT,Horror,Misery,7
wrw0c4_8,wrw0c4,Oh so that's the name for it! I cannot handle body horror and Misery really lived up to its name with that.,WanderingBadgernaut,2022-08-20T02:02:11Z,0,COMMENT,Horror,Misery,8
1ke02m_1,1ke02m,"Wishing there was a ""TIL-Dexter is a real person who took care of the Pediatric Nurse who Inspried Stephen King's Novel ""Misery"" when she got out early on a ridiculous technicality""",WaitForTheDerp,2013-08-15T12:51:35Z,3,COMMENT,Horror,Misery,1
1ke02m_2,1ke02m,About Schmidt was scarier than Misery. I still have nightmares about Kathy Bates naked in a hot tub.,jondaniels16,2013-08-15T13:37:00Z,2,COMMENT,Horror,Misery,2
1ke02m_3,1ke02m,"Wait...am I thinking of the same misery with kathy bates and the author of her favorite book? I never read the book, but it couldn't be THAT different could it?
",kylemc90,2013-08-16T00:07:19Z,2,COMMENT,Horror,Misery,3
1ke02m_4,1ke02m,Her crimes don't seem to match up with the story line of Misery at all.   I'm confused.,johnq-pubic,2013-08-15T13:04:57Z,2,COMMENT,Horror,Misery,4
1ke02m_5,1ke02m,"In Stephen King's *On Writing*, he explains how he starts his stories and uses *Misery* as his example.  He didn't mention that it was based on a real person, just based on a question and a phrase that he had heard in his head. He starts with a particular question and asks what would happen if the character was forced to make a decision. 

I'm a bit confused by the headline because I've heard this before. If King did base it on her, he's never admitted it.  I think this is just a coincidence. ",,2013-08-15T14:50:20Z,2,COMMENT,Horror,Misery,5
1ke02m_6,1ke02m,"Huge Stephen King fan here...I recommend Misery, Pet Semetary, 'Salem's Lot, The Stand, IT, and, course , The Dark Tower 

He also has a bunch of short story compilations: Skeleton Crew, Everything's Eventual, and Full Dark, No Stars (made up of 4 novellas) is what I recommend. ",theorys,2013-08-15T07:15:06Z,1,COMMENT,Horror,Misery,6
1ke02m_7,1ke02m,"Misery was decent. The Talisman, Black House, IT, and The Stand are probably his best novels.",falcongirl,2013-08-15T12:50:50Z,2,COMMENT,Horror,Misery,7
1ke02m_8,1ke02m,"This has always been my problem with King. I find his stories that use the supernatural use it like a crutch, and the real world counterparts of his stories are a lot more frightening to me.

For example:

IT  - could easily be a story about kids / grownup kids facing down a serial rapist.

Christine - how far obsession will drive some people.

Carrie - how far bullying will drive some people.

The shining - how far loneliness will drive some people (coupled with a preexisting condition)

The Stand - could have been a standard after the end story, albeit one that focuses a lot more on the politics of an after the end type society. All the religious stuff kind of ruined it for me. Instead you could actually call it an examination of how humans perceive normal events, and coincidences, as divine in origin when most of their standard societal systems are stripped away.

firestarter - the aftereffects of heinous experiments done by the CIA (eg the unabomber)

There are plenty of King works that don't lend themselves to this mental exercise, but the ones that rely minimally (or not at all) on the supernatural are the most horrifying to me - Misery.


",anorakman,2013-08-15T12:22:16Z,0,COMMENT,Horror,Misery,8
1ke02m_9,1ke02m,I hear while he was in hospital recovering from that nurses were under strict instructions not to make Misery references,xgloryfades,2013-08-15T09:53:05Z,1,COMMENT,Horror,Misery,9
1ke02m_10,1ke02m,"Actually, she imprisons him long before she finds out he had killed off Misery. 
Edit: also, I don't remember there being any 'hero' clippings in Annie Wilkes' scrapbook, just clippings of unexplained deaths. ",mockingjayonfire,2013-08-20T18:06:56Z,2,COMMENT,Horror,Misery,10
1ke02m_11,1ke02m,"This is true, but not necessarily. As another poster pointed out before I woke up to this thread having gone big, when the author is poking around Annie Wilkes' houses during one of her outings, he finds evidence to suggest that she had committed dozens of crimes similar to that of her real-life counterpart, leading to her loss of job and reputation and eventual seclusion.

Perhaps slightly off-topic (it's been almost a decade since I read Misery), was there not a (vague?) suggestion (or two?) that it was the death of Wilkes' husband that set her off killing at the hospital - or that she had killed her husband? Just curious.",brigodon,2013-08-15T15:30:13Z,2,COMMENT,Horror,Misery,11
1ke02m_12,1ke02m,"hahahahahaha, only time I have ever heard anyone use ""cockadoodie"" was in misery.",VitaminDeath,2013-08-15T11:03:29Z,3,COMMENT,Horror,Misery,12
1ke02m_13,1ke02m,"Misery is about kidnap, detention and murder, she murdered children, the connection is tenuous at best, that they are both medical professionals means very little, in Misery it has almost no relevance whatsoever.",DAsSNipez,2013-08-15T14:39:36Z,0,COMMENT,Horror,Misery,13
154ox1y_1,154ox1y,"As someone who writes for a living, I LOVED Misery because it could almost be an allegory for the writing process itself. It's also just a really awesome book. When I was younger, I turned up my nose at Stephen King because I thought ""he was so overrated!"" And then when I got over myself and started reading his stuff in earnest ... I love it. Not all of his books are great and some are pretty crap, but the good ones are just magnificent.",ShortcakeAKB,2023-07-20T16:52:46Z,1,COMMENT,Horror,Misery,1
154ox1y_2,154ox1y,"If OP thinks the ending to Misery is unsatisfying, I have some really bad news about virtually the rest of King's books. And I say that as a big fan.",SmedleyButler03,2023-07-20T12:51:26Z,0,COMMENT,Horror,Misery,2
154ox1y_3,154ox1y,"Misery is by far my favorite King book. It’s so tense  and anxiety inducing. While the movie is excellent, the book is still better.",RyFromTheChi,2023-07-21T01:36:58Z,1,COMMENT,Horror,Misery,3
154ox1y_4,154ox1y,"Honestly I thought duma key was more intense than misery, with a better sense of isolation and definitely more “typical” horror. You can tell they were written decades apart but I prefer it, considering both protags are recovering somewhere isolated after an accident and must combat some scary shit.",softcore_UFO,2023-07-20T13:21:48Z,1,COMMENT,Horror,Misery,4
154ox1y_5,154ox1y,"Funnily enough, I completely disagree. The story is fantastic but the style of this novel was frustrating to me. I didn't like reading it. I did, however, enjoy the story as it is a little bit better than the movie. This era of King is hard for me to enjoy though, which is crazy because he wrote my favorite novel by him around that time. The Drawing of the Three. But I couldn't stand The Tommyknockers and Misery was just a miserable read.",TheBadBandito,2023-07-20T21:56:21Z,0,COMMENT,Horror,Misery,5
154ox1y_6,154ox1y,"There's nothing supernatural in Misery, so if that's what you're looking for you may as well stop now. There are plenty of other King books that have magic/alien/sci fi/fantasy twists, but this ain't it.

If it's his writing style you think is ""terrible"" and ""utterly awful,"" that's fine, you're entitled to your opinion, but he's pretty consistent with that so you're not likely to get into other works either.",jpiro,2023-07-20T14:30:18Z,2,COMMENT,Horror,Misery,6
154ox1y_7,154ox1y,"Oh, ok. I get what you're saying then. I agree - the best books leave us wanting more. But yeah, Misery wraps up with a beautiful bow compared to most of SK's books, so just be aware lol",SmedleyButler03,2023-07-20T12:54:46Z,2,COMMENT,Horror,Misery,7
15dbr2x_1,15dbr2x,Misery is my favorite Stephen King Novel.,OriginalName687,2023-07-30T04:20:34Z,1,COMMENT,Horror,Misery,1
15dbr2x_2,15dbr2x,Does anyone know why any persons first name would be Misery?,CliveWashington1,2023-07-30T09:52:39Z,3,COMMENT,Horror,Misery,2
15dbr2x_3,15dbr2x,I’d forgotten both those books were published in the same year. Misery was just so much better than Tommyknockers.,Kon-Tiki66,2023-07-30T06:22:13Z,1,COMMENT,Horror,Misery,3
15dbr2x_4,15dbr2x,King has said that Misery was his book about cocaine addiction and that Annie is a representation of that addiction. She is cocaine.,blottotto,2023-07-30T21:55:23Z,3,COMMENT,Horror,Misery,4
15dbr2x_5,15dbr2x,"Puritans named their children pretty crazy things, and it sounds vaguely Puritan-esque to me. I don’t exactly remember what time period the book series Misery itself was supposed to be set in King’s novel.",playeronetaynun,2023-07-30T10:15:40Z,3,COMMENT,Horror,Misery,5
15dbr2x_6,15dbr2x,"*Misery* was intended to be King's next Richard Bachman novel, and they tended to be leaner and pacier than his own works. The writing dates at the end of the book indicate it took a couple of years to write, and some of that would include the delays caused by King's pseudonym being discovered in the middle of writing the book. The dates at the end of *The Tommyknockers*, however, indicate it took King about five years from start to finish, which tracks. It was the book which finally prompted King's wife Tabitha to stage an intervention to get him off the drugs and booze.",HugoNebula,2023-07-30T09:28:40Z,1,COMMENT,Horror,Misery,6
wz4vcy_1,wz4vcy,"The *Misery's Return* sections can be fascinating to read, especially as the missing letter keys parallel the various body parts Sheldon loses as the plot movies on, and given that Sheldon considers them to be actually pretty good, a complete turnabout to his previous convictions about his Misery work, when they're clearly not.",HugoNebula,2022-08-27T15:49:58Z,1,COMMENT,Horror,Misery,1
wz4vcy_2,wz4vcy,"I speed read through the Misery parts of the book. If it wasn't for those bits, misery would be a solid six of six stars for me.",,2022-08-27T15:25:48Z,2,COMMENT,Horror,Misery,2
wz4vcy_3,wz4vcy,Misery will always be one of my favourite Stephen King novels.,Purple-Count-9483,2022-08-27T19:23:04Z,1,COMMENT,Horror,Misery,3
wz4vcy_4,wz4vcy,"Misery’s Return is absolutely hilarious. In the context of the overall novel they’re whatever, but if you read them on their own, it’s just this soapy Gothic romance that suddenly starts employing outdated and pulpy tropes. Bees and African goddesses, what the fuck.

Although I’ll never not laugh at Paul Sheldon screaming Africa during the climax of the novel.",missfishersmurder,2022-08-27T20:31:25Z,0,COMMENT,Horror,Misery,4
wz4vcy_5,wz4vcy,"I haven't read Misery yet (it's on my list), but I read Lisey's Story a couple years ago. If I remember right, there wasn't too many people in it, and it was mostly in their house and Boo'ya Moon. I've only read it once, and it was hard to get going, but once it picked up, I couldn't put it down lol. Now I want to reread it. I just started Billy Summers, but I've hit the wall after reading a bunch of my dad's books in a short period of time.",Lucycrash,2022-08-27T20:53:11Z,3,COMMENT,Horror,Misery,5
wz4vcy_6,wz4vcy,"Misery is more scary because this is some possibly real life shite...enough people have been captured, tortured, either gotten free or died.

It...well most of us have a wealthy fear/phobia/dislike/avoidance of clowns, and obviously for good reason.",KeeperofAmmut7,2022-08-27T20:46:50Z,3,COMMENT,Horror,Misery,6
wz4vcy_7,wz4vcy,Misery was my favorite until 112263 but yeah. LOVED Misery,chhmindflex,2022-08-28T12:17:56Z,3,COMMENT,Horror,Misery,7
wz4vcy_8,wz4vcy,"I always remember misery as the book I could’ve read in one sitting but needed to take a break from halfway through cause it was too intense, at the moment that the firm replaced with the hobbling scene (phrasing it like this to avoid spoiling people). It’s the only book I remember having had to do that with (there probably are others but I don’t remember those titles).",cleo7717,2022-08-27T22:07:41Z,1,COMMENT,Horror,Misery,8
wz4vcy_9,wz4vcy,"I think you should give It another try. I feel like the movie adaptations of It into a story about a scary clown, while the book was so much more subtle and not really about Pennywise at all. He was also pretty rarely a clown at all in the book. 

Pennywise was never It, the people in the town were It. It was Bev's dad, and It was Eddie's mom, and It was the bullies who tortured the loser's club. It was the people who saw what was happening but never helped and always looked the other way. It was the all the racism (and other isms) in the town. That's as real as it gets. 

Unfortunately later adaptations missed this subtlety entirely, which is a shame, because I think it can easily go toe to toe with Misery as far as exploring the dark corners of humanity.",Madmorda,2022-08-27T23:00:02Z,1,COMMENT,Horror,Misery,9
yumbq9_1,yumbq9,"not quite the Misery-level of anger, but it still bugs me how hard the ball was dropped at the end of the Tearling trilogy. 

>!Broadly, the series is about the country created by a group of people who time traveled from the near future to the far past in an attempt to give society a do-over. Things quickly fall apart and the present timeline is full of slavery and religious oppression. The current queen is trying to reform things, but starts a war in the process. The book is peppered with these notations from future historians studying the queen's reign, telling you she succeeds in winning the war but you're wondering how she does it (you know, like in Dune).!<

>!ANYWAY, this future timeline where the queen is successful gets erased because in like THE LAST FEW PAGES, the queen decides to time travel AGAIN. She goes back to the past, erases her present, and SOMEHOW that fixes everything. Way to undermine your premise! ""You can't fix your problems with time travel, you have to actually put in the work to change society. Oh no wait, just time travel again in the second to last chapter.""!<",HyperbolicTelly,2022-11-14T07:15:52Z,0,COMMENT,Horror,Misery,1
