id,post_id,comment_text,author,created_utc,sentiment,TYPE,category,book,comment_num
6isq9t_1,6isq9t,"Nice article. King really got it all. I believe some of his books will be redone as until 20xx. He just finds the feel of a time with a great, chilling story and studios can go from there. 
Though most King adaptions might have been dud, so many are really good or classics, looking at (I'm sure I'm forgetting some) shining, green mile, stand by me, apt pupil, Misery and #1 IMDb best movie Shawshank redemption.
A truely amazing achievement. He might become the most movie adapted writer ever (if he not already is).",Erich_LeRouge,2017-06-22T11:45:13Z,1,COMMENT,Horror,Misery,1
6isq9t_2,6isq9t,"Hollywood has ruined King's reputation in a lot of ways.  I'm a big Stephen King fan and so many times I've been made fun of by people who've never read one of his books and base their judgement of him based on the shitty adaptations of his books.  My husband was one of them.   I finally convinced him to read The Dark Tower series. He read it, finished the last book and immediately picked up The Gunslinger and read the whole series again.  It is hard for him to admit he was wrong but he did in this case.  He's gone on to read The Stand,  IT and 11/22/63. 

There have been some good adaptations like: Misery, The Green Mile, Shawshank, The Dead Zone, Carrie, The Shining (I know not everyone agrees on this one but I really love the movie.  I think Kubrick really captured the surreal, creepy descent into madness).

King just continues to impress me.  He's still putting out quality work this late in his career. I was blown away by 11/22/63. I thought it was one of the best books he's written.  Also really enjoyed the Mr. Mercedes trilogy.  He's a great writer.  He has me hooked within the first 2 pages.  Few writers are able to draw me in that quickly.  
",Gaia227,2017-06-22T20:07:41Z,1,COMMENT,Horror,Misery,2
6isq9t_3,6isq9t,We could start a company...and make Misery...,Mantisbog,2017-06-22T15:05:21Z,1,COMMENT,Horror,Misery,3
6isq9t_4,6isq9t,Misery loves miserable company. FTFY,,2017-06-22T20:51:12Z,3,COMMENT,Horror,Misery,4
6isq9t_5,6isq9t,Misery loves company is so on the nose in this sense. ,RuariWasTaken,2017-06-22T20:55:24Z,1,COMMENT,Horror,Misery,5
6isq9t_6,6isq9t,"Authors are rarely given permission to write the movie script based on their book.  It was William Goldman (author of The Princess Bride, and Butch Cassiday and the Sundance Kid) who adapted Misery into a screenplay.  When studios get a good author to adapt a Steven King novel, it becomes a good movie.  When studios try to chintz out and hire some hack to adapt a novel, it rarely becomes a good movie.  This is why some movies based on King's books are good and some are bad.",KJ6BWB,2017-06-22T16:35:39Z,1,COMMENT,Horror,Misery,6
6isq9t_7,6isq9t,"Meh. I'd argue that Carrie, The Shining, Misery, and to a lesser extent Christine were all really well executed. Maybe not so much the newer ones.",colwhatever,2017-06-22T15:55:52Z,1,COMMENT,Horror,Misery,7
6isq9t_8,6isq9t,And Misery and Dolores Claiborne!!,teachhikelearn,2017-06-22T21:11:59Z,2,COMMENT,Horror,Misery,8
6isq9t_9,6isq9t,"Agreed on Apt Pupil. I don't remember a single one of his other short stories like I do that one. Wowza. 

I'd add to that list:

Firestarter
Needful Things
Christine 
Misery
The Dark Half
Pet Semetary

Can't really go wrong with most of his books. The guy knows how to tell a story. ",,2017-06-23T01:30:26Z,1,COMMENT,Horror,Misery,9
6isq9t_10,6isq9t,"I am on a King binge right now. 

I have Misery, Finders Keepers, Cujo, the first Dark Tower book, Mr. Mercedes, 11/22/63, and Doctor Sleep. So once I get through all of those I will definitely check out those other ones.",karelhusa,2017-06-22T16:55:31Z,3,COMMENT,Horror,Misery,10
4cftao_1,4cftao,"That's interesting, I feel the same way about those books but the other way round! I've tried and failed with Jane Eyre so many times that I've just written it off now as a book I will never enjoy. I like my misery and angst I think.",takhana,2016-03-31T12:35:32Z,3,COMMENT,Horror,Misery,1
4ux4ed_1,4ux4ed,If you enjoyed misery you might like rose madder ,jken11,2016-07-28T02:00:35Z,3,COMMENT,Horror,Misery,1
4ux4ed_2,4ux4ed,"I'm 21 and have been making an effort to recapture the desire i had for reading when i was younger (Started as a pre-teen obsessed with Goosebumps, Harry Potter and Deltora Quest).
Misery was the FIRST book i started this process with about a year ago, and what a book it is. Annie Wilkes is absolutely despicable, and i think the strong emotional response that everyone feels towards her is because of the setting (or lack thereof) that the book traps you in.

You never really leave her house in the mountains, as a reader you are hopelessly trapped in Annie's isolated world of mental torture and anguish. It's perfect for her character and i totally agree with your perception of her as one of fiction's most terrifying villains.

I've now become a huge (albeit new) fan of Stephen King's works. I read ""Hearts In Atlantis"" twice on a trip through Europe and now i'm up to the third book in ""The Dark Tower"" series. 

I have a new all time favourite writer :)",,2016-07-28T13:43:26Z,1,COMMENT,Horror,Misery,2
4ux4ed_3,4ux4ed,"Saw misery when I was 14. Can't watch anything with Kathy bates in it. 

Fun fact for those who don't know: Annie Wilkes is cocaine and Misery outlines Kings issues with addiction. Wilkes forces King to write another book much in the way a psychological/physiological addiction ""forces"" a user to consume more drugs. 
",MikeAlpha93,2016-07-28T04:02:29Z,2,COMMENT,Horror,Misery,3
4ux4ed_4,4ux4ed,"I agree with most of this, but I wouldn't say she lives in a world where she's the only real thing. 

Yes, she is selfish and stubborn in the childish sense... But, her world is fantasy. Not of herself, but peopled by the pulp-fictional and melodramatic characters in her books (ostensibly her only form of entertainment or connection to the world). These are her friends and family. 

She has deep mental problems but she is also lonely, so she retreats further into an insular psychological place made up of her favorite novels and characters. This habit has over time become a delusion that compounds her instability, and might explain the complete lack of remorse she shows for her volatile and violent actions against Paul in the real world (since she is so disconnected from it).

For Annie Wilkes, it's not about abusing another human being; it's about channeling and rescuing her favorite fictional character. This is the only way she knows how to do that. 

There's also the implication that her actions are a mirroring of the melodrama of her books - outward blame and violence, love and sorrow. She wants to embrace misery (because she is depressed and doesn't know it) but lacks the basic empathy to access such an emotion. Both Misery and misery have forsaken her. She yearns for feeling, and the violence and manipulation is an expression of her frustration for the fact that she simply cannot feel in the same way Misery does.

Otherwise, yeah... she is a terrifying, fascinating, psychopathic creation.",,2016-07-28T10:57:25Z,2,COMMENT,Horror,Misery,4
4ux4ed_5,4ux4ed,Ever since I read Misery all my pvp characters on online games are named Novril.,MikeHauntPS4,2016-07-28T14:35:22Z,3,COMMENT,Horror,Misery,5
4ux4ed_6,4ux4ed,"I have a three in one book of Carrie, the Shining, and Misery that my dad bought my older brother when he was 14, and I was 9. He couldn't get through the Shining and gave it to me, and I read all three within about 6 months. And I've loved Stephen King ever since <3


But yeah Annie Wilkes is scary as shit",gigs1890,2016-07-28T09:27:03Z,3,COMMENT,Horror,Misery,6
4ux4ed_7,4ux4ed,"I've been in awe of King's ability to capture the darkest depths of the human psyche ever since I picked up Misery (my first King book, shortly followed by Carrie and Salem's Lot). Annie Wilkes is so realistic; I can absolutely believe that there are many people like her in the world and they just don't act on it because they'd get caught. Obsessive fans are a terrifying thing and King completely nailed it when he created Wilkes (or she created herself, who knows with King?) - I immediately thought of her when [some nutters tried to kidnap Joss Stone](https://www.theguardian.com/uk/2013/apr/03/joss-stone-would-be-killers-jumbled). I might have to go on a bit of a Stephen King binge, haven't read him in ages.",charvisioku,2016-07-28T10:27:54Z,1,COMMENT,Horror,Misery,7
4ux4ed_8,4ux4ed,"The book and the film adaptation are both classics. The changes made were totally the right decision because what works in a novel with internal dialogue and more time to develop characters doesn't necessarily suit the visceral, fast pace of film. The horror in the books works incredibly well but could be very campy if translated to film. In the book you get much more of a sense of the emotional and psychological toll that the experience has on Paul while the film gives two great actors the chance to really embody the characters and have some fun - same goes for The Shining. Love when a great book is adapted in a way that makes it a very different but equally brilliant experience. The climax of the Misery novel still gives me the heebie jeebies though. When they describe how they found Annie... *shudder*",guybrush54,2016-07-28T10:32:09Z,1,COMMENT,Horror,Misery,8
4ux4ed_9,4ux4ed,Misery is one of the most memorable books I have ever read. Stephen King really is brilliant. ,753UDKM,2016-07-28T14:40:20Z,1,COMMENT,Horror,Misery,9
4ux4ed_10,4ux4ed,I have read most of King's books at least twice but I can't do Misery again. I remember being supremely unsatisfied with her eventual defeat. There was no death gruesome enough to satisfy my revenge lust after reading that book.,bdgbill,2016-07-28T19:55:45Z,0,COMMENT,Horror,Misery,10
4ux4ed_11,4ux4ed,"When I was reading Misery for the first time, I used to put the book down after a chapter or two because she was horrifying to me. Her character is very well written and reminded me of my mother's behavior only of course less intense.",My_new_throw,2016-07-28T03:09:15Z,1,COMMENT,Horror,Misery,11
4ux4ed_12,4ux4ed,"Misery is, to this day, the only book I've ever had to put down and walk away from because of how badly it unsettled me (the hobbling bit...)

And Kathy Bates' portrayal of her in the film is just incredible. ",AlexCattoo,2016-07-28T04:23:02Z,1,COMMENT,Horror,Misery,12
4ux4ed_13,4ux4ed,Misery is the reason I now call batshit crazy women Goddesses.,Rhadammanthis,2016-07-28T04:39:00Z,3,COMMENT,Horror,Misery,13
4ux4ed_14,4ux4ed,"Yeah, the climax of misery made me sick to my stomach. And yet it is addicting to read on, kind of masochistic, because I felt worse after having read it.",LWZRGHT,2016-07-28T05:53:59Z,0,COMMENT,Horror,Misery,14
4ux4ed_15,4ux4ed,"Oh man, good read. Could you believe the chainsaw?! This was y first King book..maybe second to IT, and I thought Misery was just absolutely terrifying and so so well done",,2016-07-28T06:02:21Z,3,COMMENT,Horror,Misery,15
4ux4ed_16,4ux4ed,Misery was about Stephen King's cocaine addiction.,,2016-07-28T06:03:58Z,3,COMMENT,Horror,Misery,16
4ux4ed_17,4ux4ed,"I was literally having this exact discussion the other day. We were discussing the most terrifying fictional characters and I name dropped Annie.


She's not supernatural. She's not a demon or a zombie- she's just fucking crazy. People like her exist and it's terrifying to think that it's possible to run into someone like that... Or even end up in the hands of someone that delusional. I get chills when I read Misery. It's so great.",,2016-07-28T06:42:20Z,1,COMMENT,Horror,Misery,17
4ux4ed_18,4ux4ed,"Ugh Misery. Such a hard movie to watch. One of the most memorable villains of any movie, ever. The book can only be even worse with the details that would have been missing from the film.",DannieJ312,2016-07-28T06:48:29Z,2,COMMENT,Horror,Misery,18
4ux4ed_19,4ux4ed,I read Misery when I was 12 and I still think that it is one of the most disturbing stories I've ever read. ,manicmouse77,2016-07-28T08:10:08Z,1,COMMENT,Horror,Misery,19
4ux4ed_20,4ux4ed,"I finished King's ""On Writing"" last Wednesday, saw Misery in the store...bought it and read it in a day. It is just fantastic!

Honestly the scene where she makes him drink the dirty water, something about that just haunted me. The entire book and the characters are just ALIVE. Amazing work, King really has the knack for bringing characters to life. 

",TheWritersSigil,2016-07-28T08:10:24Z,3,COMMENT,Horror,Misery,20
4ux4ed_21,4ux4ed,"I dabble in writing. When I read Misery, I was left absolutely terrified. I have never been a fan of King or even read any of his books. But Misery fucked with me in a way no book has. I was left with an uneasy feeling for *days*.",Setsand,2016-07-28T11:08:21Z,1,COMMENT,Horror,Misery,21
4ux4ed_22,4ux4ed,"I KNOW. Whenever someone asks for a recommendation on a creepy or genuinely scary book, I recommend Misery.

I haven't yet dared watch the movie...",,2016-07-28T14:02:57Z,1,COMMENT,Horror,Misery,22
4ux4ed_23,4ux4ed,"Kathy Bates is a fine actress, but ever since seeing Misery, every film with her in it is a horror film in my eyes.  Titanic?  Clearly a story of Molly Brown's sabotage.",themanbat,2016-07-28T07:25:26Z,0,COMMENT,Horror,Misery,23
4ux4ed_24,4ux4ed,"When I was 11, my classmates and I (about 20 of us) decided to go to the movies. We were bouncing ideas around and someone suggested Misery. I had no idea what it was about and didn't know what to expect, but decided to go with the flow.  
This movie has haunted my dreams ever since. The sledgehammer scene popped up in my head for decades, making me close my eyes and whimper. It is the stuff of nightmares",moriartyj,2016-07-28T04:53:39Z,3,COMMENT,Horror,Misery,24
4ux4ed_25,4ux4ed,"So funny you mention DoloresClaiborne, who was simply trying to save herself + the child, in a backward world that subjected them to such misery.

And the OP needs to watch 'Misery' the film.  Excellent cast and interpretation of the book.

**** the talented beautiful Kathy Bates played both lead roles!",ReereeWarbler,2016-07-28T01:50:23Z,1,COMMENT,Horror,Misery,25
4ux4ed_26,4ux4ed,"I'm so glad you mentioned that lawnmower scene. Damn, when someone says Misery the first place it takes me to is this part of the book.

Years later, and I still can't look at lawn mowers without Misery popping to my head. 

It really stuck with me. I cried so much because the kid was just a rookie. He didn't know what he was coming into and he lost everything because of it.",Jacksonspace,2016-07-28T04:54:30Z,1,COMMENT,Horror,Misery,26
4ux4ed_27,4ux4ed,"No, you are correct. In an interview with Rolling Stone, King said ""Misery was a book about cocaine. Annie was cocaine. She was my number one fan.""

[Source](http://www.rollingstone.com/culture/features/stephen-king-the-rolling-stone-interview-20141031)",pamperedguy,2016-07-28T02:41:06Z,3,COMMENT,Horror,Misery,27
4ux4ed_28,4ux4ed,"The only movies of his I think that actually turned out good are:

* The Shining  (Kubrick version)

* Carrie

* The Mist 

* Green Mile

* Shawshank Redemption

* Misery 

It seems like a big list, but when you think about the amount of movie/mini series adaptations he has, it's actually pretty small. ",pspiq5,2016-07-28T11:44:23Z,2,COMMENT,Horror,Misery,28
4ux4ed_29,4ux4ed,"The Shining is alcoholism. Tommyknockers is cocaine. Misery has two levels: one is the psychopathic stalker, and one is the existential dread of a meaningless existence (being forced to do something to stay alive, even though you don't want to and see no value in it). Annie Wilkes represents the pressures of life that force you to keep going to a job you don't want to do, sucking all the joy out of life, right up until you die.",neotropic9,2016-07-28T05:37:46Z,2,COMMENT,Horror,Misery,29
4ux4ed_30,4ux4ed,"Great to know, I was about to ask this question!  Stephen King is one of the authors blessed enough to have amazing movie adaptation.  I've learned 50% about Stephen King via books (It, Dark Tower, The Stand etc.) and the other from amazing movies (Misery, The Shining, The Mist - actually I had read the novel before but such an amazing movie, Room 1408 - again more from a short novella I think ...)

I now have the urge to read the book of all these movies I enjoyed so much.

",mstrblaster,2016-07-28T02:37:43Z,1,COMMENT,Horror,Misery,30
4ux4ed_31,4ux4ed,"Now I'm cracking up imagining the Misery-style plot twist of every Kathy Bates move.

P.S. I Love You? Kathy Bates actually killed the husband in the first place.

The Blind Side? Kathy Bates gave Michael his learning disorder through slowly poisoning his after-school snacks.",smooth_jazzhands,2016-07-28T15:44:47Z,3,COMMENT,Horror,Misery,31
4ux4ed_32,4ux4ed,"And his endings are the worst blue balls ever. He's someone who can craft the most captivating tale about the most bullshit thing and no matter how captivated I am, by the wrap up it's almost always unfulfilling. 

Yet The Dark Tower, The Stand, IT, Misery, fucking like everything are all phenomenal stories that I can't imagine not existing. ",andsoitgoes42,2016-07-28T06:53:41Z,3,COMMENT,Horror,Misery,32
4ux4ed_33,4ux4ed,"He actually specifically mentions it as his cocaine period (hence all the snow).

I think it was in the latest Rolling Stone article he was in.

edit: [Found the article](http://www.rollingstone.com/culture/features/stephen-king-the-rolling-stone-interview-20141031?page=4)  

""Misery is a book about cocaine. Annie Wilkes is cocaine. She was my number-one fan""

The whole article is a great read.",mikehod,2016-07-28T13:37:01Z,3,COMMENT,Horror,Misery,33
4ux4ed_34,4ux4ed,"""Take the psychotic nurse in Misery, which I wrote when I was having such a tough time with dope. I knew what I was writing about. There was never any question. Annie was my drug problem, and she was my number-one fan. God, she never wanted to leave."" [Source](http://www.theparisreview.org/interviews/5653/the-art-of-fiction-no-189-stephen-king)",UncleLongHair0,2016-07-28T14:08:51Z,2,COMMENT,Horror,Misery,34
4ux4ed_35,4ux4ed,"There is a quote in the Misery wiki where he specifically says she was his drug addiction, and his number one fan.",Puskathesecond,2016-07-28T07:21:36Z,2,COMMENT,Horror,Misery,35
4ux4ed_36,4ux4ed,"[Spoilers for Misery the novel](#s ""He gets his feet chopped off and cauterized with a blowtorch"")",Kerse,2016-07-28T03:22:46Z,3,COMMENT,Horror,Misery,36
4ux4ed_37,4ux4ed,"I agree, his endings are often very disappointing... I was completely sucked into the whole of Under the Dome, but the ending... Meh. (And don't even start on the TV-series... Ugh.)

But 11/22/63 was amazing from start to finish, so was Misery, I loved the Stand (although the first 3/4 was also better than the last part in my opinion...)",,2016-07-28T14:05:35Z,1,COMMENT,Horror,Misery,37
4ux4ed_38,4ux4ed,"King on Misery: “Once in a while, something will declare itself so obviously that it’s inescapable. Take the psychotic nurse in Misery, which I wrote when I was having such a tough time with dope. I knew what I was writing about. There was never any question. Annie was my drug problem, and she was my number-one fan. God, she never wanted to leave.”",MarthaFarcuss,2016-07-28T06:43:06Z,1,COMMENT,Horror,Misery,38
4ux4ed_39,4ux4ed,I read William Goldman's book about being a screenwriter. He adapted Misery and said that Stephen King fought to keep the hobbling be the same as in the book. But the people involved with the film (I cant remember if it was producers or just Goldman himself) felt that cutting off the foot was too much. And that hobbling him with the giant hammer would be just as much of an impact,Hrududu147,2016-07-28T08:32:57Z,3,COMMENT,Horror,Misery,39
4ux4ed_40,4ux4ed,Just re-read *Misery.* Can confirm left.,Jimmel845,2016-07-28T12:10:50Z,1,COMMENT,Horror,Misery,40
xgn3b4_1,xgn3b4,"I have never seen a villain described as viscerally as Annie Wilkes. 

I have experienced psychotic delusions. I have also witnessed the behavior of other people who have psychotic delusions. 

Annie Wilkes is the most realistic and horrifying portrayal I have *ever* seen of mental illness. I was terrified of her because I knew what she was feeling but also because I understood how Paul felt being around her. 

She is the proof that you can write a horrifying villain with zero fantasy-monster qualities. No monsters, no demons, no ghosts. Just a severely mentally ill human woman. 

The way he describes her as being solid (you could poke two fingers up her nose and hit something solid), how he compares her to an African idol…Stephen King was at his best when he wrote Misery.",KombuchaEnema,2022-09-17T15:09:52Z,1,COMMENT,Horror,Misery,1
xgn3b4_2,xgn3b4,"So when I read Misery around 1987 I was living in an older home, with up stairs bedrooms. I was reading in bed, put it down, drifted off and in a half dream state heard the wooden steps creaking. In my dream this was Annie coming up to break my legs ( in reality it was my wife headed to bed ). This went on for some time ( wife trying to be quiet and not wake me ) and tension built. When my wife got to the foot of the bed I broke free of my paralysis, sat bolt upright and screamed bloody murder. The wife was not amused.",lostnthot,2022-09-17T18:24:41Z,1,COMMENT,Horror,Misery,2
xgn3b4_3,xgn3b4,"The funny thing is I thought Misery had a silly premise, until I read the last three books of the Dark Tower. You hear that Stephen? I'm looking for your ass!",B9Canine,2022-09-17T16:31:45Z,3,COMMENT,Horror,Misery,3
xgn3b4_4,xgn3b4,"And I'm sure the book enjoys spending time with you.

Because everybody knows that...

...*Misery loves company*!",weirdgroovynerd,2022-09-17T14:25:38Z,1,COMMENT,Horror,Misery,4
xgn3b4_5,xgn3b4,"I'm kinda intimidated to read King because he has so many books, but I heard about Misery and I'm thinking of going for that one",,2022-09-17T14:23:36Z,2,COMMENT,Horror,Misery,5
xgn3b4_6,xgn3b4,Misery is a great Stephen King book. If you get a chance I suggest you watch the 2 season mini series Castle Rock. The ending ties in an Annie Wilkes origin story.,Few_Inside_2125,2022-09-17T17:02:57Z,2,COMMENT,Horror,Misery,6
xgn3b4_7,xgn3b4,I don't think he's written anything that made me feel as uncomfortable as Misery. Movie's great too.,Terpizino,2022-09-17T20:13:19Z,1,COMMENT,Horror,Misery,7
xgn3b4_8,xgn3b4,Misery was a brilliant book. It scared me for years,universechild9,2022-09-17T17:34:04Z,3,COMMENT,Horror,Misery,8
xgn3b4_9,xgn3b4,Misery was my first King novel and I loved it. I really felt like I was watching a movie the whole time I was reading. I could see the little room she kept him in and the big old typewriter and the boxes of novril pills. The whole combination of fear and dependence was insanely good.,chrs_trnr,2022-09-17T23:08:30Z,1,COMMENT,Horror,Misery,9
xgn3b4_10,xgn3b4,"I love IT and The Stand because of how expansive they are. Misery is so small by comparison, but just works so amazingly well. Love all of them. 

One day, I’ll read works by other authors, I swear.",madfishius,2022-09-18T01:56:10Z,2,COMMENT,Horror,Misery,10
xgn3b4_11,xgn3b4,"I don't read much fiction, but I'm a sucker for being spooked. I love picking up a book of his and reading it around late summer/ autumn. I'm about to start misery, the last one of his I read was Salem's lot, which was a lot of fun",,2022-09-17T18:55:48Z,1,COMMENT,Horror,Misery,11
xgn3b4_12,xgn3b4,"Literally just finished reading Misery a few nights ago. Incredible! The tension, suspense, and discomfort  King is able to portray is simply astounding. I don’t think I’ve ever been as terrified of a character in a book as I was of Annie. I’ve seen the movie several times before and now having read the book, I’m even more in awe of Bates and Caan’s acting, along with the overall adaptation. 

I decided to read Dead Zone as soon as I finished, but now I’m regretting not going with Dolores Claiborne which was my second choice. Was also debating his new one, Fairy Tales, The Green Mile, or Tommyknockers.",CocoaRain718,2022-09-18T01:04:14Z,1,COMMENT,Horror,Misery,12
xgn3b4_13,xgn3b4,"Misery was the first King book I read… The shinning, doctor sleep… too many to name but for sure check out The Outsider.",Notorious809,2022-09-18T03:02:21Z,1,COMMENT,Horror,Misery,13
xgn3b4_14,xgn3b4,Misery is the only book that I literally could not put down. It's probably the most exciting book I've ever read.,KeaPlaysTV,2022-09-18T06:30:51Z,1,COMMENT,Horror,Misery,14
xgn3b4_15,xgn3b4,"When I first read, I was unable to put it down until finished. Not a huge Stephen King fan, and mostly read history, but Misery is one of my all time favorite books.",jgawrons,2022-09-17T19:02:19Z,1,COMMENT,Horror,Misery,15
xgn3b4_16,xgn3b4,this book is amazing and I read it all in one day. I'm not a frequent reader or specifically a fan of Stephen king (his stuff is ok but I'm not a big fan of horror either) but misery is an amazing book. make sure to watch the movie with Kathy Bates! she's a powerhouse and perfect for the role of Annie,Just_Lion_9363,2022-09-17T22:50:42Z,1,COMMENT,Horror,Misery,16
xgn3b4_17,xgn3b4,"Weird fact about me, I watched the Kathy Bates movie dozens of times growing up and for some reason always assumed Misery was a horse until I read the book. I have no idea why.",Oneforthatpurple,2022-09-18T02:12:39Z,3,COMMENT,Horror,Misery,17
xgn3b4_18,xgn3b4,"Misery is King's best overall novel in my opinion.  It works from page one to the last.  it might not be the most ambitious plot, but it's an example of a simple story told extremely well vs a complex story done average.  

the movie adaptation is uncommonly  good too.",McFeely_Smackup,2022-09-18T02:38:42Z,1,COMMENT,Horror,Misery,18
