id,post_id,comment_text,author,created_utc,sentiment,TYPE,category,book,comment_num
yumbq9_2,yumbq9,Well it’s the author of misery themselves with the Stand. I Love that freakin book though.,SomeKindoflove27,2022-11-14T03:19:04Z,1,COMMENT,Horror,Misery,2
yumbq9_3,yumbq9,"I don't know about going all Misery on King, but I didn't finish Cujo. When a certain event happened near the end of the book, I threw it across the room and said, ""You bastard."" Later I skimmed the remaining pages to make sure King hadn't just been making it *appear* that the thing happened when in fact he was going work things out.

The other one is probably Bridge to Terabithia. Come on, [author name]! Susan or Suzanne C...? Nah, that's the author of Hunger Games. I don't feel like looking it up. Dumb book.",Opus-the-Penguin,2022-11-14T03:39:52Z,0,COMMENT,Horror,Misery,3
yumbq9_4,yumbq9,"Given that nobody’s been forcing me to read a book I didn’t want to since university, I’ve not intentions of going Misery on any writer, not even the ones I dislike, not evens the ones I had to read at uni.",bofh000,2022-11-14T08:05:33Z,3,COMMENT,Horror,Misery,4
zhw8i8_1,zhw8i8,"I prefer the book, too. It’s fortunate that both renderings are fantastic for their particular mediums. In the film, great casting, editing, and cinematography are all on point. 

For the novel, there is so much more room to explore the themes of toxic fandom, addiction, and psychosis. Even further, this book is about writing novels from the perspective of a successful, yet critically derided author. I still can’t figure out the plot to the Misery meta novel that is written in the book, but you gotta admire the ambition.",Oblique_Strategy,2022-12-10T17:50:55Z,1,COMMENT,Horror,Misery,1
zhw8i8_2,zhw8i8,"Agree, but I think that's true of most good books. I think the vast majority of SK movies/series are garbage. The exception is Misery, the ones that aren't horror (11/22/63, shawshank, and green mile), and the newer It. However, the book is still better for each of these imo.  

I thought the series 11/22/63 was brilliant until I read the book and then tried to rewatch it.",,2022-12-10T20:41:05Z,2,COMMENT,Horror,Misery,2
jebj03_1,jebj03,I tolerate no slander of the masterpiece that is IT. But that being said misery the book was very good and much better than the movie,Jwed85,2020-10-20T01:22:52Z,1,COMMENT,Horror,Misery,1
jebj03_2,jebj03,Misery is my favorite King book. It’s definitely better than the movie. It’s so intense and anxiety inducing. Could not put it down.,RyFromTheChi,2020-10-19T22:31:00Z,1,COMMENT,Horror,Misery,2
jebj03_3,jebj03,I love Misery!!! I still get panicked when I read that shit. 🤟🏻,emmapaint,2020-10-20T00:46:31Z,1,COMMENT,Horror,Misery,3
jebj03_4,jebj03,I watched Misery right after I read the book a few months ago. I liked them both but the cockado book is far superior. That’s not to say I didn’t also enjoy the film. They were both fun.,,2020-10-23T15:12:23Z,3,COMMENT,Horror,Misery,4
jebj03_5,jebj03,I remember thinking Misery sounded a bit boring before I'd seen it but Kathy Bates really made the movie great to me. Not read the book yet,coolrunningsuk,2020-10-19T21:58:18Z,3,COMMENT,Horror,Misery,5
yh19ns_1,yh19ns,"Misery is the book that stopped me from reading King for a very long time. No hope at all in the plot just one long stressful pile of pain. Read his book On Writing, he was becoming a full blown alcoholic in this era, starting with The Shining.
I’m back to reading his books again as they aren’t all so loaded with such darkness since those days.",,2022-10-30T06:55:29Z,0,COMMENT,Horror,Misery,1
yh19ns_2,yh19ns,misery is one the best books i ever read. the ability to do much in basically one setting blew my mind. king is king,Nemohoe5,2022-10-30T03:30:12Z,1,COMMENT,Horror,Misery,2
yh19ns_3,yh19ns,The first time I read misery my heart was pounding the whole time!,Emperor_Palps_247,2022-10-30T18:11:21Z,0,COMMENT,Horror,Misery,3
yh19ns_4,yh19ns,"Also echoing that I'm jealous of you experiencing this for the first time! I got Misery from a yard sale when I was like, 12. It scared me to my core and it still pops into my head all these years later. His most frightening book, imo- the claustrophobia and panic of it is palpable.",TheCheeseDevil,2022-10-31T12:16:44Z,1,COMMENT,Horror,Misery,4
ka6odv_1,ka6odv,"Misery just might be my favorite King! Personally, I found the hobbling scene in the book to be FAR more effective than the scene in the movie (although it’s still a brilliant scene in the film). >!In the book’s version, even after Annie’s downfall Paul is still in downright awful shape. In addition to emotional scars and PTSD, he has no foot and (I believe) no thumb? It’s such a grim way to leave your protagonist, and I think just enhances Annie even more as a villain.!<",alkaseltzerelsa,2020-12-10T03:59:45Z,1,COMMENT,Horror,Misery,1
ka6odv_2,ka6odv,"Misery is also my favorite King book. Fast paced, and nonstop suspense. I could not put it down in the second half. Can’t remember the last time I read a book that gripped me so hard. Annie is the best.",RyFromTheChi,2020-12-10T23:12:11Z,1,COMMENT,Horror,Misery,2
ka6odv_3,ka6odv,"Misery misery misery that’s what you’ve chosen, I offered you books and you spat in my face",CaveGlow,2020-12-10T09:03:10Z,0,COMMENT,Horror,Misery,3
ka6odv_4,ka6odv,I get the feeling with a lot of King books that he gets bored towards the end so he finishes off rather sloppily. Misery was one of the few that feels like he followed through.,godlessnihilist,2020-12-10T12:23:13Z,1,COMMENT,Horror,Misery,4
ka6odv_5,ka6odv,"I wouldn't say it was my favorite all-time book or even my favorite Steven King, but there was something electric about Misery. I couldn't put it down, and found myself reading faster and faster so I could get to the end.",76PAGES,2024-01-29T02:50:57Z,1,COMMENT,Horror,Misery,5
ka6odv_6,ka6odv,"Yes, I was going out of my mind rooting for Paul to get away with stuff and also just terrified that she’d reappear at any moment.

Also, who the eff is downvoting all these comments? If you don’t like Misery, then go read another post. Dang.",emmapaint,2020-12-10T18:54:41Z,1,COMMENT,Horror,Misery,6
g29nmb_1,g29nmb,"Annie is cocaine. Misery is literally about cocaine abuse.

Edit - King wrote Misery about cocaine addiction specifically: “Misery is a book about cocaine. Annie Wilkes is cocaine. She was my number-one fan”",mrmattyf,2020-04-16T06:33:39Z,3,COMMENT,Horror,Misery,1
g29nmb_2,g29nmb,"I read that book a couple of years ago. It was actually the 1st Stephen King book I read. I had a question about the book though. Does the Misery book that Annie makes him write have any significance to the story? I know there are parts where it is just 3 or 4 pages of the book within the book, but I skipped most of those parts. It seemed irrelevant to me.",,2020-04-16T08:20:15Z,2,COMMENT,Horror,Misery,2
g29nmb_3,g29nmb,"Misery is my favorite Stephen King novel that I've read so far. It's such a thrilling story. There were so many disturbing parts that made my stomach churn. It's excellent!

Also the movie is good too..It's streaming on hulu right now.",Blackyoshi28,2020-04-16T15:39:33Z,1,COMMENT,Horror,Misery,3
g29nmb_4,g29nmb,"No, not really. But I don't think *Misery* is remotely happy. Short of Annie coming out on top, it has about the same ending I'd imagined most writers would have settled on. It also has that same tone *Thinner* ends on, in that the reader can extrapolate their own darker ending from what King heavily implies. One of the reasons I think that *Cujo* (minus all the Castle Rock references) would have made an excellent Bachman book.",HugoNebula,2020-04-17T11:57:51Z,2,COMMENT,Horror,Misery,4
4qs0k8_1,4qs0k8,"Personally prefer bathing in the misery of others, rather than wallowing. But each to their own! ",Pale_King101,2016-07-01T15:24:40Z,2,COMMENT,Horror,Misery,1
4qs0k8_2,4qs0k8,I prefer to have the misery of others sluiced onto my torso as I'm suspended from the ceiling. ,savois-faire,2016-07-01T17:56:02Z,3,COMMENT,Horror,Misery,2
bkycrp_1,bkycrp,"I’ve read quite a few of Kings books, and Misery is pretty damn good!

If you’re interested in picking up another King novel I’d recommend The Dark Tower. If you like the first one, there are another 6 to follow. King said that The Dark Tower is the center of his fictional universe. It’s a really good read, with a lot of depth. Also, the movie of the same title is NOTHING like the books.",SerScronzarelli,2019-05-05T14:38:12Z,1,COMMENT,Horror,Misery,1
bkycrp_2,bkycrp,"I really liked Misery, but my favourite is The Dark Half which explores an author and his alter ego. I also really liked Bag of Bones for the mystery in it. (I like books about writers.)",,2019-05-05T17:10:18Z,1,COMMENT,Horror,Misery,2
bkycrp_3,bkycrp,I'm new to kings work ( currently reading book 5 of dark tower ) and I think Misery is my favorite so far.,ghostghost31,2019-05-06T03:53:16Z,1,COMMENT,Horror,Misery,3
bkycrp_4,bkycrp,"Misery was great, I literally couldn't put it down. I found myself really liking the book within a book when they're going to see it they had buried Misery, so much so that I forgot I was reading a completely different book!",SweptFever80,2019-05-06T22:48:33Z,1,COMMENT,Horror,Misery,4
bkycrp_5,bkycrp,"I feel like she has become even more believable.  With fandoms and stan culture so prevalent now, Misery is still so believable.",EveryCliche,2019-05-06T17:28:23Z,2,COMMENT,Horror,Misery,5
bkycrp_6,bkycrp,"The box i found also contained the stand and pet sementary. Im considering reading pet sementary and maybe after that the stand. The 1000+ pages of the stand scare me a little though, im a pretty slow reader (misery took me a month exactly to finish)

Edit: i have one more book before  these 2 called norwegian wood, have you read it? What are your thoughts, ive heard its pretty good.",lars10000100,2019-05-05T20:59:55Z,3,COMMENT,Horror,Misery,6
kageni_1,kageni,"Pet peeve: I hate people say ""this author predicted the future"" when the author was just writing based on stuff that already existed at the time. It's not like Misery featured anything that's specific to toxic internet fandoms.",PartyPorpoise,2020-12-10T15:38:28Z,2,COMMENT,Horror,Misery,1
kageni_2,kageni,"Actually, Misery totally *didn't* predict today's toxic fandom.

-Annie Wilkes is just one person, no mob hate pile-on effect 

-No fan-to-fan ""ship wars""

-No ""if you like this character you're an entitled racist misogynist incel who promotes domestic abuse and school shootings""",MllePerso,2020-12-10T16:55:21Z,3,COMMENT,Horror,Misery,2
kageni_3,kageni,"Misery is about King's cocaine addiction. King wrote about this in his book On Writing. 

[https://bookriot.com/writing-and-addiction-in-stephen-kings-misery/](https://bookriot.com/writing-and-addiction-in-stephen-kings-misery/)",NikkiSharpe,2020-12-12T17:46:54Z,3,COMMENT,Horror,Misery,3
kageni_4,kageni,"Yeah there were already several big ""insane stalker fan"" type stories in the media at that time well before anything to do with today's fandoms. The murder of John Lennon, the attempt on Ronald Reagan by a crazed Jodie Foster fan, etc. Misery has more in common with that sort of thing, and is also inspired by King's interactions with his own fans.",Disparition_523,2020-12-10T21:34:41Z,3,COMMENT,Horror,Misery,4
2mqflm_1,2mqflm,I love Stephen King and enjoyed Misery. There is a claustrophobic quality to the book. It is limited in it's settings and most of it takes place in the protagonists head and a small home. The atmosphere is close and uncomfortably cloistered.  King does an admirable job of creating a horrific tale out of the most ordinary of circumstances. One human against another.,Just1morefix,2014-11-19T03:22:11Z,1,COMMENT,Horror,Misery,1
2mqflm_2,2mqflm,"Misery is not my favorite book by King, but its decent. If you want scary and creepy, get the new one, Revival. Genuinely disturbing, the creepiest thing he's written since Pet Sematary.",docwilson,2014-11-19T03:44:35Z,0,COMMENT,Horror,Misery,2
2mqflm_3,2mqflm,"Misery was not creepy/scary in the traditional sense - in terms of what you'd expect from King - but it was by far one of the most suspenseful books I read. I read many Stephen King novels, but Misery is probably my favorite. ",Integrs,2014-11-19T14:09:49Z,1,COMMENT,Horror,Misery,3
2mqflm_4,2mqflm,"I really liked Misery.  It's been years since I read it, but I remember it to be a very intense read and there is a really interesting aspect to the book in regards to the fact that the story revolves around an author.",cplcarlman,2014-11-19T03:11:36Z,1,COMMENT,Horror,Misery,4
2mqflm_5,2mqflm,"I really enjoyed reading *Misery* and as someone who's read a lot of his work, I would have to say that if you're new to the King it's a great introduction to his work and style.  I wouldn't call it a heavy read, but it's definitely not light either. *Misery* isn't scary in the ""AHH! Monsters!"" kind of way, but in the psychological way. However, I would say it's one hundred percent worth your time and you're definitely going to get plenty of creepy. Enjoy it!",iiRenity,2014-11-19T03:22:22Z,1,COMMENT,Horror,Misery,5
2mqflm_6,2mqflm,"*Misery* is great. ""Creepy"" is the right word for it.",Cole-Spudmoney,2014-11-19T05:07:20Z,1,COMMENT,Horror,Misery,6
2mqflm_7,2mqflm,"Oh, sorry. TL;DR No, I wouldn't read Misery off the bat if you are concerned with heavy or long. Definitely start off with Bachman books and work your way up to Misery. It's a great book, but a brick. ",frustwrited,2014-11-19T12:03:37Z,2,COMMENT,Horror,Misery,7
2mqflm_8,2mqflm,"I did read *It* a long time ago and I didn't like it, but it's been so long I honestly can't recall why I didn't. It's going to need a reread from me to really form another opinion of it. However, people on /r/stephenking seem to praise it quite a bit. It is much heavier of a read, though. 

Edit: And you'll definitely get some ""Oh god!"" moments out of *Misery*!",iiRenity,2014-11-19T03:33:29Z,2,COMMENT,Horror,Misery,8
2mqflm_9,2mqflm,"I was unaware that he had a whole sub dedicated to him haha thank you again! I'll see what they say about It and Misery, cheers!",IShatYourPantsSorry,2014-11-19T03:38:24Z,2,COMMENT,Horror,Misery,9
2mqflm_10,2mqflm,"Haha! No problem. So far I've got Misery, The Stand, and Revival sitting in my mind. They all seem good, where to begin... Thanks for the insight!",IShatYourPantsSorry,2014-11-19T04:29:02Z,1,COMMENT,Horror,Misery,10
9eptx4_1,9eptx4,"Oooh, I finished *Misery* only last week. I really liked it! It was a super stressful read, though, because it was just so insane. *Misery* was my third Stephen King read and definitely the best one so far. ",Kartoffelmad,2018-09-11T20:51:47Z,1,COMMENT,Horror,Misery,1
9eptx4_2,9eptx4,"Yes! I was actually hooked to the beginning of Misery""s return. I wanted the whole thing. ",Troothdotcom,2018-09-10T19:03:45Z,1,COMMENT,Horror,Misery,2
9eptx4_3,9eptx4,"The other two were *The Colorado Kid* and *Carrie* and then I got halfway through *The Shining* a decade ago, but I recently got it from the library. Hoping that loving *Misery* will spur me on! ",Kartoffelmad,2018-09-12T06:20:57Z,2,COMMENT,Horror,Misery,3
9n6bkv_1,9n6bkv,"Misery is one of my favorite Stephen King books, but it wasn’t scary to me either. I think the idea of someone being your biggest fan & holding you hostage is scary, which is what makes the plot creepy, but it wasn’t a book that kept me up at night. Pet Sematary and It were genuinely scary to me though, so I’d recommend those!!",hailaayyy,2018-10-11T03:25:51Z,2,COMMENT,Horror,Misery,1
9n6bkv_2,9n6bkv,"Misery is not a scary book, it's a thriller and a darn good one.  Read the Exorcist, or Legion by William Peter Blatty those are really scary.  I've read most of Stephen King's old books and only a couple have scared me, one of them was The Dead Zone and another one was The Long Walk by Richard Bachman, I read it when I was a kid and it scared me when I pictured myself going on that long walk...",Jorge777,2018-10-11T10:22:39Z,1,COMMENT,Horror,Misery,2
9n6bkv_3,9n6bkv,"King wrote a thriller with Misery. It’s not scary, it’s suspenseful though. It’s only suspenseful if you empathize with the characters, as with all thrillers. The villain is classically evil and wonderfully written. I guess she is scary in her own way. 

Now then, spookiness is not the same as scary. Getting spooked involves more than getting scared. You can get scared by a loud noise, but you can get spooked by an unexpected disembodied voice that you hear whispering over your shoulder, in the dark, when you think you are alone  but you know you are not, and that voice it telling you in a cold breath to come play. 

I don’t think Misery was a good choice to test how spooked you can get. Other people have some better literature for it. ",ArthurBea,2018-10-11T17:45:20Z,0,COMMENT,Horror,Misery,3
9n6bkv_4,9n6bkv,"I have read Misery, Pet Semetary, and Salem’s Lot.  I was never scared during any of them. For the first two, maybe it’s because I had seen the movies when I was younger and generally knew what to expect, but I think the more likely reason is that I just don’t really get scared by books. 

I thought they were all very good, though. I’m a big fan of King despite his quirks.  

I have It and The Shining on deck though, so maybe I’ll see if something changes.",,2018-10-12T05:31:02Z,2,COMMENT,Horror,Misery,4
6g53l1_1,6g53l1,"I'm actually spending the year trying to read every piece of writing by King I haven't read before, and oddly I haven't read Misery yet ",Joyrock,2017-06-10T00:05:46Z,1,COMMENT,Horror,Misery,1
6g53l1_2,6g53l1,"Why? 

I am on the other side and loved Misery, but I am curious why you thought it was disappointing.",c64person,2017-06-09T13:14:12Z,1,COMMENT,Horror,Misery,2
1331pwz_1,1331pwz,"That's my issue with McCarthy's writing. It feels pornographic in its violence and misery, and in a way that doesn't appeal to me.",My_brother_in_crisis,2023-04-29T23:26:16Z,0,COMMENT,Horror,Misery,1
1331pwz_2,1331pwz,"Cormac McCarthy writes about the American experience. What you find depressing or overly burdened with misery is because that’s how he views what happened. Remember “Blood Meridian” is not a fable, it is based, more or less, on reality. 

Yes his books are violent, yes they are graphic and in some cases haunting but I can’t think of a writer who does it as well as him. Unceasing bleakness may be an attribute of his but it is utterly compelling. I finished “The Passenger” last week and I was so eager to read the follow up, “Stella Maris”,  that I read the book I chose as a break between the two in three days. Both books are, as you’d expect brilliant but bleak. 

Suttree is very good but different; it’s not anywhere near as violent as “Blood Meridian” and it’s not as epic as the Border Trilogy in terms of scope. It’s more of a personal, central character focused story. I’d recommend it but if you’re having problems with McCarthy’s bleakness, maybe read someone else in between.",,2023-04-29T19:31:47Z,2,COMMENT,Horror,Misery,2
ao402c_1,ao402c,">I've only seen the movie, but Annie didn't seem to be TOO evil before she learned of Misery's death.

There's an entire scene in the film where Paul finds Annie's scrapbook of hospital deaths for which she was suspected and tried, but not convicted.
",HugoNebula,2019-02-07T17:23:25Z,3,COMMENT,Horror,Misery,1
ao402c_2,ao402c,"Sorry if I'm spoiling the book, you should read it's short, and if you get a good edition it's a new literary experience, trust me! (I could spoil why if you want to...)    
  
From what I understood she wanted Misery to continue, but she might have wanted to read it forever, so I'm not sure she would have released him, maybe she wouldn't have killed him but she would have kept him alive for as long as she could.  
  
Killing him sounds inevitable since she would be going to jail otherwise, but I don't think it was explicitly said in the book or the movie.",,2019-02-07T18:34:14Z,1,COMMENT,Horror,Misery,2
6x4nn7_1,6x4nn7,"The movie is pretty good actually. A few changes of course but Kathy Bates does an AMAZING job. She puts the psycho on for sure. Misery is one of my favorite King novels. The Girl who Loved Tom Gordon was a grwat read, more psycologic than supernatural. Pet Semetary is one of my all times favorites, I also enjoyed Christine and Carrie(waay better than the movies, but the last couple are pretty supernatural). I know a lot of people who love The Stand (It's too intimidating for me XD). ",UnregisteredPunk,2017-08-31T04:24:37Z,1,COMMENT,Horror,Misery,1
6x4nn7_2,6x4nn7,"I know this is common knowledge, but OP is new to King so I'm reposting the obvious so he can see the book in a more literary light.

Misery is one of King's deeper, more allegorical works. In the 80s, King suffered crippling drug addiction. In Misery, Annie is supposed to be his addiction personified, cocaine in particular. King had been wanting to get off drugs and try writing new styles, but felt the drugs were forcing him to keep doing more of the same ol' same. Paul's struggle alone in a creepy room fighting Annie is really a junkie's horrible attempts at getting clean. At the end of the book, the author has successfully changed his style, written a new hit book, and right when he thinks he has hit the happiness jackpot, he enters a room and hears Annie's voice. This doesn't mean a killer attacks him, but that his addiction can't be beat by something as simple as success, Annie will always be lurking in the back of his head no matter what he does.",doctor_wongburger,2017-08-31T10:07:20Z,1,COMMENT,Horror,Misery,2
6x4nn7_3,6x4nn7,"I hope you read more. I'm jealous of you actually. I wish I could go back in time and read Misery, The Stand, IT, The Shining for the first time again.",Cheeto717,2017-08-31T18:07:09Z,2,COMMENT,Horror,Misery,3
6x4nn7_4,6x4nn7,"Only King I've read so far I regret was Tommyknockers.  Misery was the second novel that I ever read.  Pet Sematary was the first, when I was twelve.  King is fun, and authentic to himself most of the time - and wicked insightful about small town American life.",Duaniac,2017-09-01T01:03:52Z,1,COMMENT,Horror,Misery,4
2qoocc_1,2qoocc,"I think I have done the same thing too but with Revival. Weird though, before I read Revival I read Misery. I started IT but that was about two weeks ago and im only on the 3rd chapter.",,2014-12-29T14:09:33Z,2,COMMENT,Horror,Misery,1
2uknmj_1,2uknmj,"Yep! Green Mile, Shawshank, and Misery. ",JMPesce,2015-02-03T02:20:17Z,1,COMMENT,Horror,Misery,1
3hseba_1,3hseba,I have never read misery myself but I had some trouble getting through IT because some of it felt so tedious but I pushed myself to read those parts and I am happy I did because at first it was kind of dull but then it got really exciting and good so I would say no but someone else might have a better opinion then mine.,EternalSweetTooth,2015-08-21T00:49:47Z,2,COMMENT,Horror,Misery,1
3hseba_2,3hseba,"Depends on the part.
The first draft, where [Minor Spoiler](#s ""Sheldon isn't really trying and adds Annie as a character"") is important because the details affect how Annie reacts during the pages that follow.

The second draft, where [Minor Spoiler](#s ""Sheldon has his characters pull Misery out of a bee sting-induced mistaken burial, and the stuff that follows with the bee-goddess"") also has some value, because the content of these scenes include objects that King uses as motifs as he goes along. If you're also the guy/gal who blanks out and skips over every time Annie says ""And now I must rinse"", then you're okay to skip. If you're looking to draw poetic art value, then read the manuscript sections for artistic context.

tl;dr--Unless you like reading for symbols and art value, you're okay to skip. ~~And if you're treating this like a James Patterson thriller novel, shame on you. /s~~",8andahalfby11,2015-08-21T03:21:49Z,2,COMMENT,Horror,Misery,2
2sfq4h_1,2sfq4h,"~~What exactly is Abject Misery Per Sentence?~~
Nevermind I get it now",AwesomeDon703,2015-01-14T23:15:06Z,3,COMMENT,Horror,Misery,1
