id,post_id,comment_text,author,created_utc,sentiment,TYPE,category,book,comment_num
j1a18t_146,j1a18t,"I read the Shining and Dr Sleep this summer and my view on the movie was punched in the gut. King's not exactly known for the greatest endings of his books, but I thought they were fabulous... especially in comparison to the movies. I was so disappointed how Dr Sleep the movie ended compared to the book. Why veer from something so good?!",NoBananaRunts,2020-09-29T02:05:44Z,1,COMMENT,Horror,The Shining,146
j1a18t_147,j1a18t,"I think it's fascinating how the Shining was pretty heavily panned when it was released but somehow became this monumental cornerstone of the horror genre.

I dont think its that great.",AreYouNobody_Too,2020-09-29T02:08:37Z,2,COMMENT,Horror,The Shining,147
j1a18t_148,j1a18t,You're saying 'The Shining' had a worse adaptation than 'Lawnmower Man?',Procrastanaseum,2020-09-29T02:12:57Z,2,COMMENT,Horror,The Shining,148
j1a18t_149,j1a18t,Didnt read the shining but doctor sleep was dopeeeer,,2020-09-29T02:18:53Z,3,COMMENT,Horror,The Shining,149
j1a18t_150,j1a18t,"Feel no shame it is just how source materials and adaptations are. The shining is a prime example.
Heck if one reads Mike Carey Lucifer and watch the series adaptation they would be plain upset. Similar with Harry Potter and i dear say even the Godfather.",DestinyHasArrived101,2020-09-29T02:37:25Z,2,COMMENT,Horror,The Shining,150
j1a18t_151,j1a18t,"I read The Shining when it first came out in the late 70s. Happened upon that paperback on a little rack in a hardware and sporting goods store and just happened to pick it up. Knew nothing about King at the time.

The book blew me away; like nothing I had read before. I couldn't sleep or put it down until I finished. What a wild and chilling tale.

The movie came out a few years later and I was anxious to check it out. As I watched, I was hugely disappointed. As OP pointed out, so many critical plot and character details were missing, replaced by all sorts of cheesy, halloween-style fluff instead. I haven't watched the movie again in all these years. The movie might be fun for somebody unfamiliar with the book, but it is a *completely* different story. It shouldn't even have the same title.",West_of_Ishigaki,2020-09-29T03:21:01Z,1,COMMENT,Horror,The Shining,151
j1a18t_152,j1a18t,"The Shining is one of the greatest movies ever made, regardless of genre. If you think it’s worse than the Dark Tower, you lack a fundamental understanding of how influential Kubrick’s masterpiece is on so many different angles. Adaptations shouldn’t ever be a 1-1, it virtually never works. Adaptations are about the changes that are made by a skilled hand, and that capture the vibe the film is trying to go for.

While I can see your point about the movie—and you are certainly entitled to your opinion—what that movie did for horror and the art of filmmaking is not to be belittled. The music is haunting, the cinematography is thoroughly unsettling (the way Kubrick angles all the cameras low so as to make the Overlook look massive), and Jack Nicholson’s performance (that bar scene with Loyd being one continuous take). It’s a masterclass. You think its generic because you benefit from 40 years of its legacy; you’ve seen all its tricks because everyone has already emulated them.",ForTheLoveOfOedon,2020-09-29T03:25:41Z,1,COMMENT,Horror,The Shining,152
j1a18t_153,j1a18t,"The Shining was such an incredible book, read while avoiding the movie my entire life. The main change I hated was killing off the cook, because the final scene of the book was the most dreadful thing I have ever read wondering what might happen",Imabigfatbutt,2020-09-29T03:43:23Z,3,COMMENT,Horror,The Shining,153
j1a18t_154,j1a18t,"I felt the same way. I’m not really a horror fan, and The Shining is actually one of my favorite books ever, for the same reasons you mentioned. It was written so well, the storytelling amazing. When I saw the movie, I was really let down. Not that Kubrick is a poor movie maker, I guess I was just biased and expected more.",,2020-09-29T03:46:13Z,1,COMMENT,Horror,The Shining,154
j1a18t_155,j1a18t,"I can agree that the film is a poor adaptation of the book but Kubrick always used novels as jumping-off points and that doesn’t have any bearing on the quality of the film. Dr. Strangelove, Full Metal Jacket, Eyes Wide Shut, and basically every other one were adaptations of books. Nobody ever complains about any of those because they weren’t by a massively successful author. Kubrick’s unfaithfulness to the source material in The Shining is something that I can see upsetting the author and fans of the book, but that was his MO at that point. 

The book was inspiration and in the same way that one killer inspired both Psycho and Texas Chain Saw Massacre. Does the book deserve a faithful adaptation? Sure. But Kubrick is largely considered the greatest American filmmaker there ever was and he gets to treat Stephen King’s book how he wants. 

I really cannot imagine how you consider that a generic horror film. This rant is me trying to be polite about how ignorant calling The Shining generic in comparison to a Stephen King book is",,2020-09-29T03:53:28Z,3,COMMENT,Horror,The Shining,155
j1a18t_156,j1a18t,"I love both. Personally, I like it when a filmmaker takes an idea from a book and makes something new. The stuff that happens in the book version of The Shining is there whenever you need it, right there in the book. The film version of The Shining is a great adaptation because it is clearly inspired by the book, but it turns the story into something much more elemental and cinematic.",fhost344,2020-09-28T12:32:33Z,1,COMMENT,Horror,The Shining,156
j1a18t_157,j1a18t,"> I almost don’t even think of them as the same story



This is the right way to think of them. The film is an excellent film—but its a terrible adaptation. The novel makes Jack, Wendy, and Danny three dimensional characters; in the novel they’re very one note. Also, I don’t really understand how the film can be titled “The Shining” when the actual shining is basically nothing more than a footnote in the film. Again, I don’t want anyone to think I’m saying that the film is *bad*—it’s not; in fact it’s excellent, for what it is—but its a different thing entirely from the novel. You will appreciate both more if you conceive of them as entirely separate things",Halloran_da_GOAT,2020-09-28T13:07:30Z,1,COMMENT,Horror,The Shining,157
j1a18t_158,j1a18t,"Not to mention the entire subplot of the native Americans massacre. 

I think it’s a brilliant film, by a brilliant filmmaker, but maybe they just should’ve called it something else. The shining (abridged)",Daveprince13,2020-09-28T14:51:06Z,2,COMMENT,Horror,The Shining,158
j1a18t_159,j1a18t,"I’m in the same boat. The Shining as a film is a tense experience and completely different, but still a great watch for the disturbing imagery, music, atmosphere and the fantastic performances. I read the book a few years ago and it just evoked a while different set of feelings. Jack was a good man, all the way to the end, Wendy was a stronger character and Danny was a clever kid who was wise beyond his years. The hotel felt more evil and honestly the whole thing made me afraid to leave my room at night for a few days. It was powerful. Doctor Sleep evoked a different kind of dread, but also horrified me in other terrible ways, with the True Knot being some of the most evil monsters I had ever read about, and yet somehow making them into people too, which drew conflicting emotions. I think the film actually did a great job adapting the book more faithfully with the ending altered to pair with the film of The Shining while also paying homage to the original book. It was heart-breaking but I kind of enjoyed the tragic ending for the films versus the books. They’re two alternate takes on the story and I can appreciate them both, though the books will always win out in the end.

I’ve learned to be more open-minded about adaptations after the Silent Hill movie. I adore the video game series and know all the lore and creepy shit behind it, so when the movie went off-the-rails with characters, beings that didn’t belong and the general flow of the story, I was a little off-put, but in the end I just looked at it as an alternate take on the story and was happy to enjoy it for what it was. Yeah, there are bad adaptations and those deserve to be criticized, but there are also adaptations that simply draw inspiration from the source material and tell a different version of the story. Sometimes they’re great and can enrich the overall experience, and sometimes they flop hard. You just have to give it a fair shake and make your own decisions about what you like and don’t, but in this one case I truly believe that both versions of The Shining and Doctor Sleep deserve praise, if not exactly equal merit.",DomLite,2020-09-28T19:53:10Z,1,COMMENT,Horror,The Shining,159
j1a18t_160,j1a18t,"The book The Shining, was only the starting point for Stanley Kubrick to tell his own story.

Kubrick definitely had his own agenda and brought in a bunch of themes and puzzles that don't appear in the book. Of the two, Kubrick's movie is the masterpiece for my money.",Aleph_Alpha_001,2020-09-28T20:44:20Z,3,COMMENT,Horror,The Shining,160
j1a18t_161,j1a18t,">I think you have to appreciate them as two separate entities. The Shining is my favorite King novel, but I also love the movie for what it is. The movie excels with giving you that feeling of dread, as well as the  very creepy atmosphere and of course the acting which make this film a classic. With that being said, I can see why King was upset with how it was adapted. I almost don’t even think of them as the same story.

I think this is the key thing to appreciate about adaptations. Kubrick was a hell of a director, and he fundamentally understood how to create a powerful cinematic experience. He keenly understood the medium.

King is a master of his medium. The unfortunate part, is that the two mediums have entirely different pressures and methods of telling stories. They correlate to a degree, but they only seem to overlap in broad strokes.

You can get away with 800 pages of setup, only to resolve the whole novel in 200. In a film, you have three acts to work with, and your setup needs to be done after the first or you lose your audience.

It really is apples and oranges. When you compare character building, motivation, and story arcs though, you can really make clear comparisons. The real difficulty is when you rigidly cling to aspects that work in one medium and fully expect them to work in another without taking away from all of the other aspects that make the film work as is.

And let's not forget the trainwreck that was Maximum Overdrive. King couldn't even do a good film adaptation of his own work, so it really shows that it's a completely different skillset. No one ever let him direct again after 1986.",,2020-09-28T22:11:35Z,2,COMMENT,Horror,The Shining,161
j1a18t_162,j1a18t,"Please watch “Room 237” the documentary on The Shining OP. It’s a bunch of experts and fanatics discussing and deconstructing their film. The film is an anti-adaption. It is actively thumbing it’s nose at the source material and utilizing it as the foundation for something original. A story Kubrick wanted to tell visually. It is so deep and rich and insane. The doc gets a bit long in the tooth, but given some insane shit it points out there is right there on the film you can’t help but know Kubrick was using The Shining to channel some other-worldly emotion and intensity that is bigger than the story.",Balls-over-dick-man-,2020-09-28T23:48:22Z,1,COMMENT,Horror,The Shining,162
j1a18t_163,j1a18t,"Honestly, even by today’s standards I can’t see how you’d call it generic. Sure many tropes featured in it have been done to death, but a film is more than the sum of its parts and I genuinely have yet to see another film that creates an underlying sense of dread and unease like the shining does.",ape_fatto,2020-09-28T23:12:21Z,3,COMMENT,Horror,The Shining,163
j1a18t_164,j1a18t,"Yeah, ""generic horror movie"" is the last way I'd described *The Shining*.",ATXBeermaker,2020-09-28T21:54:12Z,2,COMMENT,Horror,The Shining,164
j1a18t_165,j1a18t,"Yeah personally I find ""The Shining"" to be a pretty unremarkable book (nothing wrong with it, but I don't see most people list it among King's best, and I'm not his biggest fan to begin with), whereas ""The Shining"" is among the great, enduring, horror classics.

It's just a different medium, trying for very different things. I totally understand why King dislikes it, it tramples all over his original vision, and throws it in the trash. But if the goal of an adaptation is to be faithful, what's the point? A direct translation to a new medium will always be worse than the medium it's intended for. 

If your summation of the film is strictly about plot beats (characterization, motivations, etc), well then, that's not really the heart of the movie? Film is a visual medium. If you evaluate any movie on the terms of a ""summary and bullet point presentation"", then that's entirely missing the point. 

Doesn't mean you have to like the movie. It's a pretty alienating watch, on many levels (pacing, acting, unresolved loose ends, intentional ambiguity, etc). But if your reaction is purely ""the book painted the family as loving, and the movie is dark and cold, so it sucks"", that's pretty shallow? It's perfectly fine to use that to articulate why you prefer one to the other (we all have our own tastes), but I'd at least keep an open mind as to why the film is still discussed decades later, and is very well regarded by many critics. My university recently did a fancy restored 35mm print showing of it, with a lecture before, and a packed house. I wouldn't just leap to the conclusion that those professors missed the part where Jack was supposed to be a loving father, and be dismissive of the reasons people might be packing the room decades later. It's a weird movie, and arguably quite flawed, but it is *not* shallow, however you slice it.",Ziddletwix,2020-09-28T13:11:44Z,2,COMMENT,Horror,The Shining,165
j1a18t_166,j1a18t,"This: King wrote a brilliant book, Kubrick directed a brilliant *movie*.

Has anyone here read the shining? That'd be a 40 hour long movie in terms of content.",Cyndershade,2020-09-28T14:36:12Z,2,COMMENT,Horror,The Shining,166
j1a18t_167,j1a18t,"Now I’m not endorsing this interpretation of the film whole heartedly buuut there is a theory that the shining is about jack’s guilt for abusing his son Danny. There’s a lot of interesting parallels of abused kids and Danny in the film.

Obviously that is not in the book at all and I liked it as an interpretation.",,2020-09-28T12:43:47Z,2,COMMENT,Horror,The Shining,167
j1a18t_168,j1a18t,"People who watch the Shining today think it's generic and trope-filled, but they don't realize that Kubric is the one that made those tropes.",Pertyrobo,2020-09-28T17:39:41Z,0,COMMENT,Horror,The Shining,168
j1a18t_169,j1a18t,"I want to believe OP is just some tryhard teenager. Calling The Shining a generic horror movie just because it's not entirely faithful to the book, yeesh.",iwazaruu,2020-09-28T16:40:56Z,0,COMMENT,Horror,The Shining,169
j1a18t_170,j1a18t,"Maybe he watched ""shining"" not ""the shining"".

[https://www.youtube.com/watch?v=ZexYRkIRhVs](https://www.youtube.com/watch?v=ZexYRkIRhVs)",pattysmife,2020-09-28T20:52:37Z,3,COMMENT,Horror,The Shining,170
j1a18t_171,j1a18t,"This. The Shining is one of my favourite books, but the film is excellent, it’s about as far from a generic horror movie as can be. They are both masterpieces in their own right.",ape_fatto,2020-09-28T23:07:19Z,3,COMMENT,Horror,The Shining,171
j1a18t_172,j1a18t,"Kubrick basically took the concept of the novel and created his own story with his own version of Jack Torrance; he couldn’t care the less that the character represented King’s struggle with alcoholism.

I like Stephen King but in my opinion The Shining is not among his best novels, while Kubrick’s version is undoubtedly a masterpiece of horror cinema and of filmmaking in general.",Future1985,2020-09-28T12:28:22Z,1,COMMENT,Horror,The Shining,172
j1a18t_173,j1a18t,"> The Shining main character is flawed but clearly loves his family, especially his son

Have you seen the ""remake"" that came out in the late 90s early 2000s? What are your thoughts on that (if you've seen it)?        
I've never read the book, but I've seen both movies and I think the remake captures your quote much better than the Kubrick version. The dude from Wings who plays the main character really comes across as loving his family and that there's ""something other"" which is compelling him to act as he does.",ToiletPhoneHome,2020-09-28T12:33:43Z,1,COMMENT,Horror,The Shining,173
j1a18t_174,j1a18t,You don’t like Shelley Duvall in the shining? She makes it 10x scarier for me,bootherizer5942,2020-09-28T19:15:55Z,0,COMMENT,Horror,The Shining,174
j1a18t_175,j1a18t,"As others have said, ""influential"" is the correct read rather than ""generic"". 

I didn't really care for The Shining movie, either as an adaption or as a horror movie in general, but I can admit that much.",Serendipities,2020-09-28T18:54:56Z,2,COMMENT,Horror,The Shining,175
j1a18t_176,j1a18t,"Problem is, it was his first time watching it. Obvious he has watched other horror films that were made after it, so there is no way for him to understand the context of when the shining was released in theaters for the first time",Take14theteam,2020-09-28T15:47:52Z,3,COMMENT,Horror,The Shining,176
j1a18t_177,j1a18t,"I like most of Mike Flanagan's movies, but he doesn't have anything resembling a unique and distinct voice like Kubrick brings to The Shining. His movies/shows are all polished and serviceable-to-good, but *far* more deserving of the 'Generic' label than The Shining. Doctor Sleep is okay but it really feels like a world away when it comes to filmmaking.",vagenda,2020-09-28T14:25:18Z,1,COMMENT,Horror,The Shining,177
j1a18t_178,j1a18t,"The Shining has been on my To Read list for a while, and it just went to the front after this comment. Absolutely brilliant.",M31550,2020-09-29T00:58:19Z,1,COMMENT,Horror,The Shining,178
j1a18t_179,j1a18t,"I agree about Dr. Sleep. I read it because I loved the Shining so much, but it came off silly and not very scary at all. The only parts I liked were the beginning before the weird shine sucking vampires really got into the story. Weirdly enough I did enjoy the movie. It isn’t some cinematic masterpiece but it was definitely entertaining.",Roux319,2020-09-28T13:02:24Z,0,COMMENT,Horror,The Shining,179
j1a18t_180,j1a18t,Eh it’s still the shining that Danny and Jack grapple with the whole movie isn’t it? I mean isn’t that why the hotel so easily manipulates Jack?,bubbles1990,2020-09-28T16:01:24Z,2,COMMENT,Horror,The Shining,180
j1a18t_181,j1a18t,"WWZ the movie doesn't even pretend to follow the book though.  Like, it's not the same setting, not the same plot...  hell, even the zombies are fundamentally different (fast movers vs. traditional shamblers).  Like, at least with The Shining they have the same setting and characters and hit similar plot points.  WWZ shares a title.",Ravanas,2020-09-28T16:30:58Z,0,COMMENT,Horror,The Shining,181
j1a18t_182,j1a18t,"Agreed. The only horror film I've seen that comes close in terms of how it slowly builds a sense of impending dread is Hereditary, which is well worth a watch if you've not seen it. The Shining is 40 years old but it's still my absolute favourite horror film (and not out of sentimentality).",Greggybread,2020-09-29T02:26:32Z,1,COMMENT,Horror,The Shining,182
j1a18t_183,j1a18t,"No kidding, name the films that are like the Shining, come on!!",GoodGuyGinger,2020-09-29T04:08:33Z,3,COMMENT,Horror,The Shining,183
j1a18t_184,j1a18t,"Yeah OP is one of those people that going off of this I wouldn’t trust their taste/recommendations when it comes to film lmao

Clearly they know nothing of the horror genre, how visual storytelling differs from reading, what makes a film work, etc. From a completely objective artistic/film making standpoint Op is fucking bonkers to think The Shining is the worst king movie.",NeutralJazzhands,2020-09-28T17:15:12Z,0,COMMENT,Horror,The Shining,184
j1a18t_185,j1a18t,That's true too! They mention the shining but don't do much with it in a story sense.,Oathtocats,2020-09-28T12:57:12Z,2,COMMENT,Horror,The Shining,185
j1a18t_186,j1a18t,"I'm only starting The Shining, and after reading these comments I'm stoked to finish it. I watched the movie with no intention of reading the book but I'm glad it'll be a different experience.

I was a bit confused by OP calling The Shining movie generic, which is a word I would use for those Carrie adaptations.",blinko-blonko,2020-09-28T21:51:36Z,3,COMMENT,Horror,The Shining,186
j1a18t_187,j1a18t,"It's particularly interesting that the Steadicam, which was used for that scene, had only been existence for one year prior to filming The Shining. Yet, Kubrick still insisted on the majority of the sets being designed around using the Steadicam. He was truly brilliant!",AugustiJade,2020-09-28T16:16:41Z,1,COMMENT,Horror,The Shining,187
j1a18t_188,j1a18t,"Exactly! Kubrick doesnt necessarily make adaptations, he takes the work of an author and makes it his own. He knows what to change and what not to. A book can never be directly copied to a movie, the two mediums are too different. The shining by Steven King and Stanley Kubrick's The shining are too different to compare. I feel like Kubricks version is much like 2001 a space odyssey (which he also made) as in every viewer walks away with a different interpretation, and i think OP is not doing it justice by only giving the film a surface level reading. Stephen King's book is also amazing, no doubt about it. The book is much more straightforward than the film, which some people will like and some won't. Point being it's impossible to compare and contrast the two.",HARJAS200007,2020-09-28T13:29:03Z,1,COMMENT,Horror,The Shining,188
j1a18t_189,j1a18t,"> I mean isn’t that why the hotel so easily manipulates Jack?

Jack doesn't have the shining, though. In the book, the hotel goes after jack because he's weak and it wants danny because his shining is so strong. As far as I can remember, the shining itself doesn't play much role at all in the film. It's been a while since i watched it though so maybe i'm misremembering.",Halloran_da_GOAT,2020-09-28T16:04:38Z,2,COMMENT,Horror,The Shining,189
j1a18t_190,j1a18t,"I'm not surprised because any character Jack Nicholson plays is going to go from 1 to 100 at the drop of a hat and come across as pretty crazy or over the top at least.  I'm sure that Kubrick intended to change Jack's characterization from the beginning or he would have cast someone else.

The Shining is the only Kubrick movie that I can enjoy watching, and that's only if I see it as a story that happens in an alternate world from the book - or a different level of the Dark Tower, since we're referring to King.  It's a great story about a man on the edge who succumbs to insanity in a creepy, isolated hotel and who's insanity infects his family in different ways - to the point where it could be argued that everything Danny sees was influenced by his father's madness.

The book is about a fractured family who still love each other, but who are isolated in an evil, haunted hotel that uses the fractures against them in order to steal the psychic abilities of the little boy by first terrorizing him and then manipulating his father into killing him.  

Of the two plots I prefer the haunted evil hotel over the human insanity.  I hear about so much human evil in the world that it is unsurprising to find it in movies too, even when paired with possible supernatural events - but the idea of a hunted hotel with an evil agenda to devour the soul of an innocent child is terrifying! 

I will admit to loving most of King's concepts because he takes the usual horror tropes and twists them into the realm of the unexplainable ""what if"" that has no logical explanation.  I see where it leads to unsatisfactory endings in some of his books - but then again, I can't see any real-world fight against the supernatural having a satisfying or even clear-cut ending.",kayjee17,2020-09-29T02:02:36Z,1,COMMENT,Horror,The Shining,190
j1a18t_191,j1a18t,"Rob Ager has a whole series on The Shining film and how it was made. It goes over exactly what you're talking about. Rooms the are impossible, hallways that lead nowhere, etc",aSmallCanOfBeans,2020-09-28T16:17:40Z,3,COMMENT,Horror,The Shining,191
