id,post_id,comment_text,author,created_utc,sentiment,TYPE,category,book,comment_num
dt5edc_1,dt5edc,"I feel like I'm in the minority who loved Doctor Sleep more than The Shining. I do admit the two dont feel much alike minus the characters and locations. Though I'm also someone who found neither book really terrifying or uneasy to read. Oddly I wanted more of the True Knot moments to try and feel them being villainous other than a whole two scenes(?) Of actual villain things shown. 

Though now that you mention it, I do wanna read the Stand again since it's been nearly 15 years since I've done so, just to compare it. Guess my King kick continues.",hallowedstar,2019-11-08T03:13:01Z,1,COMMENT,Horror,The Shining,1
dt5edc_2,dt5edc,"I started reading this book and I think I have to stop. 

To me, it’s not even comparable to The Shining. I feel the writing is lacklustre and I’m having a hard time understanding all the misplaced sexuality. I usually really enjoy Stephen King but this is making me cringe.",SirHector,2019-11-08T21:56:09Z,0,COMMENT,Horror,The Shining,2
dt5edc_3,dt5edc,"I was so disappointed in Doctor Sleep:( It didn't feel like the Shining at all, it was vampires in trailers:(.",Jorge777,2019-11-08T18:17:28Z,0,COMMENT,Horror,The Shining,3
3wf58n_1,3wf58n,"I saw the movie maybe 10 years or so ago.  It was a decent movie, but I didn't really see what all the fuss was about.  I certainly didn't find it scary, but horror movies usually don't get to me.  

After reading the book a year or two ago, I see why Stephen King didn't like the movie.  It totally changed some main points in the book (without mentioning anything specific to keep from spoilers).  

I enjoyed it far more than the movie.  The sequel Doctor Sleep was decent, but not quite as good.  It's almost as if it could have been a completely different novel, with no ties to The Shining.  ",rube,2015-12-11T20:21:15Z,1,COMMENT,Horror,The Shining,1
3wf58n_2,3wf58n,I remember reading The Shining as a teenager in study hall ... and watching as every hair on my arms stood straight up on end.  Still one of the scariest books I've read.,__tmk__,2015-12-11T20:45:37Z,1,COMMENT,Horror,The Shining,2
3wf58n_3,3wf58n,"I always mention how different the books are, the only times I've heard bad reviews of Doctor Sleep have been when somebody be went in expecting The Shining. ",courtoftheair,2015-12-12T21:26:29Z,3,COMMENT,Horror,The Shining,3
2j4xsd_1,2j4xsd,"I love The Shining.  I was especially enthralled with Danny, such a brilliant kid.  I think Stephen King does an exceptional job with his character development, it just feels so genuine. 

The movie does do a good job, but the book is vital to witness, in King's own words, ""the true history of the Torrance family.""  Next, you should read Doctor Sleep.  There is a scene in there that brought tears to my eyes regarding Danny & Jack.",lady_lannister,2014-10-13T20:44:09Z,1,COMMENT,Horror,The Shining,1
2j4xsd_2,2j4xsd,"I love the book so much, I don't know how King does it, but the detailed yet not overbearing way he describes the violent scenes are so so real. Sometimes I feel when I'm reading I feel the author is trying to make an impact, to really try and make the reader feel horror/shock/discomfort. I don't get that with King. The tension in the shining is incredible! The movie was a let down for me because it was not much like the book, but as a stand alone movie, it's good, very art house with the imagery and music.",styrofoam_nun_,2014-10-14T13:42:18Z,1,COMMENT,Horror,The Shining,2
2j4xsd_3,2j4xsd,"If you haven't read *The Dark Tower*, that's something you must tackle at some point. One of the best stories I've ever read. The first book in the series is  *The Gunslinger*. It's short but, if it doesn't grab you, continue on to the second book, *The Drawing of the Three*. *Then* you'll really start getting it!

As far as hardcore horror, *The Shining* and *IT* are his two most terrifying books, IMO. And you've already experienced *The Shining*. I highly recommend reading the book *It* next.

*Salem's Lot* is a great vampire story (no glitter or hair mousse)

*Christine* is great, especially if you like cars. 

Also, if you're a King fan, you MUST read *The Stand*. Many fans consider *The Stand* to be King's masterpiece. I can't say I fully disagree with that sentiment. It will leave you slack-jawed.",Tech-Mechanic,2014-10-14T03:15:06Z,1,COMMENT,Horror,The Shining,3
8rz753_1,8rz753,"It is a different kind of book in some ways, but if you liked The Shining I would recommend the sequel Dr. Sleep. But I’m the weirdo who likes Dr. Sleep just a little bit more than The Shining.",happiness_in_pottery,2018-06-19T00:44:11Z,1,COMMENT,Horror,The Shining,1
8rz753_2,8rz753,"Ready Player One, Sapiens, SPQR: A History of Ancient Rome, The Shining, A Farewell to Arms, All the Light We Cannot See, Survivor, His Dark Materials, Empire of the Sea, Zen and the Art of Motorcycle Maintenance, and Brave New World",Kung-Fu_Tacos,2018-06-18T14:31:00Z,3,COMMENT,Horror,The Shining,2
8rz753_3,8rz753,Dark Materials is a must-read for sure. SPQR is great for somebody wanting to dive into Ancient Rome for the first time. Survivor I read in two days. The Shining I read in three. That must mean something! ,kvanzanten,2018-06-18T17:43:57Z,1,COMMENT,Horror,The Shining,3
98aqj0_1,98aqj0,"You're quite correct. Since the Kubrick adaptation has been the dominant version of the story in pop culture, all of the sadness and personal failings in the book that inspire genuine empathy and sympathy for the characters are gone. 

Uncle Stevie himself has said he never really liked the adaptation for precisely that reason. ""\[It's\] cold,"" he said. To paraphrase, he said that he felt that Kubrick treated the Torrances as little rats in a lab rather than human beings. He isn't wrong. While the Shining's film isn't bad overall, it's also not really the same story King wrote. ",Tygrus,2018-08-18T22:47:16Z,1,COMMENT,Horror,The Shining,1
98aqj0_2,98aqj0,"I definitely find The Shining scary per se. Definitely unsettling, and overall your description matched what I felt. What's even scarier is the slight projection King had written himself on to Jack Torrance. Man, what a good book.",DETECTIVEGenius,2018-08-18T18:51:08Z,1,COMMENT,Horror,The Shining,2
98aqj0_3,98aqj0,"I found The Shining sad as well. So sad reading Jack's fall from grace. He tried to do his best for his family, but he messes up big time.",OliviaElevenDunham,2018-08-18T21:41:56Z,3,COMMENT,Horror,The Shining,3
dk347s_1,dk347s,The Shining.,mistersmithutah,2019-10-19T12:54:00Z,3,COMMENT,Horror,The Shining,1
dk347s_2,dk347s,"Most disturbing that I did not like:  American Psycho.  Hands down.  

Most disturbing that I did like: NOS4A2 (this is the one with the scary ass kids, right?   That shit freaked me out.  Great book though)

Scariest: The Shining

Scariest moment: Danny being chased by hedge animals in The Shining.  Don’t know why this scared me so much but I read this book back in 1987 and this scene still stands out",jfeo1988,2019-10-19T15:34:32Z,3,COMMENT,Horror,The Shining,2
dk347s_3,dk347s,"Both in Pet Sematary and The Shining, King writes passages about how *something* is lulling the characters to sleep, and it's a sleep they can't break out of, no matter how hard they try.

I've had nightmares about that for as long as I can remember and to see it put into words really freaks me out.",annualgoat,2019-10-19T14:31:08Z,1,COMMENT,Horror,The Shining,3
dk347s_4,dk347s,"The Shining is a very disturbing, uncomfortable book to read. It's good, but I was happy to be done with it and haven't reread it since. Other King books I can read a thousand times. Thinner, Pet Sematary, lost count of those. The Shining? One and done.",Minsc_and_Boo_,2019-10-19T15:22:05Z,2,COMMENT,Horror,The Shining,4
dk347s_5,dk347s,"I must be the only one who finds King’s books long and boring. Don’t get me wrong, I love a good 700 page book but the supernatural themes do nothing for me. I struggled through IT, Pet Cemetery and The Shining. Snooze fest! 

I prefer a psychological thriller. Something that can actually take place. The human brain and mental health is far more chilling to me.",yelling4society,2019-10-24T15:23:54Z,0,COMMENT,Horror,The Shining,5
dk347s_6,dk347s,I found The Shining to be genuinely scary here and there.,,2019-10-19T13:55:42Z,1,COMMENT,Horror,The Shining,6
dk347s_7,dk347s,The most disturbing book I’ve read was The Shining by Stephen King. Only because of the wasps 🙄 I am reading it again though because I know it was only because I was young when I read it haha,Bubbafatcat,2019-10-19T15:12:27Z,1,COMMENT,Horror,The Shining,7
dk347s_8,dk347s,"I love horror books but hardly ever find them actually frightening. The two exceptions are the second half of Cujo, and any scene in The Shining where an inanimate object is suddenly animate - like when Danny is staring at the fire hose, thinking it looks like a big snake, and it suddenly falls off the wall toward him. That part made me physically flinch as I was reading.",bonhomiebear,2019-10-19T15:30:02Z,1,COMMENT,Horror,The Shining,8
dk347s_9,dk347s,I read the bathroom scene in the Shining when I was like 13 and home alone. My apartment was small and I could see the door to the bathroom for any room. I ended up sitting on the porch for hours continuing to read cuz it was better than being left alone with my thoughts. My dad came and I felt so saved but he only stayed a few minutes then I went back out on the porch...,Shewhoisgroovy,2019-10-19T16:37:27Z,2,COMMENT,Horror,The Shining,9
dk347s_10,dk347s,"The only 2 books that ever actually gave me a ""scared"" feeling were The Shining and The Amityville Horror.  The scene in The Shining where the old woman in the bathtub tries to strangle Danny made me very uneasy, and in The Amityville Horror whenever they talked about seeing eyes looking in through the window it creeped me out.  Seeing someone looking in at me from a window is probably my biggest fear, and they wrote it really well in that book.",jsparker77,2019-10-19T17:13:07Z,1,COMMENT,Horror,The Shining,10
dk347s_11,dk347s,Also one of the best books I’ve ever read. Whenever I think of The Shining I think of the absolute terror I had reading about...a firehose. King is a master.,babums,2019-10-19T13:50:56Z,1,COMMENT,Horror,The Shining,11
dk347s_12,dk347s,"I honestly don’t find books that scary. I WISH I did. I wanna feel that feeling at least once. I read the shining in middle school and I loved it, I didn’t seem to find it scary. When I initially watched the movie I did though",,2019-10-19T14:46:59Z,2,COMMENT,Horror,The Shining,12
dk347s_13,dk347s,"Having read The Shining by King in a hotel until the early hours, I dan totally relate to this feeling.",compoface,2019-10-19T19:19:40Z,1,COMMENT,Horror,The Shining,13
ga5o7_1,ga5o7,"Very nice. I hope you don't mind, but I added contrast and decreased saturation: [the Shining](http://i.imgur.com/NG3OC.jpg)",,2011-03-24T14:42:15Z,1,COMMENT,Horror,The Shining,1
2sp8ab_1,2sp8ab,"The movie is phenomenal, one of the greatest psychological thrillers of all time. King hated it because he felt it missed the point of his novel. He's wrong, the book and novel are fundamentally different. They have the same plot (generally) but are about completely different things.

* The novel is about the Shining, the hotel, and Dany's battle with supernatural forces
* The movie is about Jack Torrance (Dany's father played by Jack Nicholson) going crazy.

The character and focus of the two are totally different. The Shining is one of my favorite books and The Shining is one of my favorite movies. Really both great. I think it's a fantastic adaptation because the movie did things the book couldn't. It's a great movie in and of itself, unlike a lot of book adaptations that attempt to be a shot-for-shot recreation. Kubrick really understood what his film could accomplish and he fucking nailed it.",dragonnards,2015-01-17T06:37:51Z,2,COMMENT,Horror,The Shining,1
2sp8ab_2,2sp8ab,"There's also a three part [The Shining miniseries](http://www.imdb.com/title/tt0118460/) that King was directly involved in, and which follows the book a bit closer.",PraxisLD,2015-01-17T04:08:27Z,3,COMMENT,Horror,The Shining,2
2sp8ab_3,2sp8ab,"Dr. Sleep is OK. It's not really even related much to The Shining, just a story about Danny as an adult. A nice read.  It neither adds to nor takes away from The Shining itself. You should see the movie, though. In my opinion, as a lifelong SK fan, it's the ONLY movie adaptation of one of his works that is worth seeing. ",MiddleKid,2015-01-17T04:32:47Z,1,COMMENT,Horror,The Shining,3
2sp8ab_4,2sp8ab,I read The Shining before I watched the movie. I prepared myself before I watched it that it would not be the same. I was still disappointed with the movie.,tugboatattack,2015-01-17T06:51:11Z,3,COMMENT,Horror,The Shining,4
2sp8ab_5,2sp8ab,"he had a lot to do with the tv version of the shining, which was god awful.

edit: Apparently Kubrick knew King didn't like his version. So at the beginning of Kubrick's version, there's the helicopter shot of the highway, with a car on fire (I think it was blue?). King's version opens (I believe) with a blue car traveling along a highway. I might have the specifics wrong, but the gist is that Kubrick is giving a big ""fuck you"" to King.",Diggery64,2015-01-17T06:59:32Z,0,COMMENT,Horror,The Shining,5
xqd49e_1,xqd49e,I really like The Shining too but it's probably I didn't read much recently,PopHazards,2022-09-28T23:20:30Z,3,COMMENT,Horror,The Shining,1
xqd49e_2,xqd49e,"The first like 300 pages of the shining I thought were alright, but the last half is amazing. And the last half wouldn’t be as great without all the things in the first 300 pages connecting. It’s worth finishing!",International-Fox240,2022-09-29T02:55:01Z,1,COMMENT,Horror,The Shining,2
xqd49e_3,xqd49e,"Of King’s work, The Shining and Apt Pupil, and maybe It, for me are the ones that stick closest as being about something more than they appear.

Also, if you like historical fiction, The Terror by Dan Simmons is a good pick. Survival horror with some supernatural elements, but set in the context of a Shackleton type of expedition.",ChemistryMutt,2022-09-29T03:04:39Z,1,COMMENT,Horror,The Shining,3
xqd49e_4,xqd49e,"Got a bit of a list haha

Pine - Francine Toon…more atmospheric than horror but it’s good. 

Something Wicked This Way Comes - Ray Bradbury (I got a lot of Stephen king vibes reading it and then discovered it was written way before King so clearly an influence to him not the other way round haha)

Nos4A2 - Joe Hill - felt very like the shining….then I discovered it’s King’s son haha. A good read. 

My all time favourite is Slade House by David Mitchell….it’s not too long either.",NefariousnessOne1859,2022-09-29T13:45:16Z,3,COMMENT,Horror,The Shining,4
3duutq_1,3duutq,Please read it. It's a fantastic book. The shining is only the fourth King book I've read and The Stand is by the best. ,farcough187,2015-07-19T22:34:57Z,1,COMMENT,Horror,The Shining,1
4u7itb_1,4u7itb,"Absolutely; the book is much better than the movie, and does a much better storytelling job. It is a good movie to me, but it doesn't hold a candle to the book. Even Stephen King didn't care for the movie, saying that it portrayed Wendy as a 'screaming dishrag', etc.

source: [Stephen King Just Went About How Much He Hates the Shining Again - Cinemablend](http://www.cinemablend.com/new/Stephen-King-Just-Went-Off-About-How-Much-He-Hates-Shining-Again-68032.html) ",alinawright,2016-07-23T13:48:52Z,0,COMMENT,Horror,The Shining,1
4u7itb_2,4u7itb,"The two are very different.  I'm a significantly bigger fan of the movie than of the novel, but I did see the movie first which might have colored my view.  

I decided to read The Shining a few years ago when Dr. Sleep was going to come out.  I disliked the book enough that I never bothered reading Dr. Sleep.",well_uh_yeah,2016-07-23T09:18:59Z,2,COMMENT,Horror,The Shining,2
4u7itb_3,4u7itb,"The Shining is both my favorite horror movie and horror novel. I highly recommend reading the book as it is very different to the movie. There are a lot of events that happen in the book that were not in the movie that were cut either for budgetary reasons or because the special effects of the time didn't allow it. 
The book is also scarier in my opinion. ",teneno,2016-07-23T09:28:04Z,1,COMMENT,Horror,The Shining,3
4u7itb_4,4u7itb,"In nearly all cases, King's books are better than the films, but many of the adaptations are worth seeing at least once.

The best ones focus on character, not the threat/monster. That's where a lot of the live-action versions of his stories fall down. King makes you care about the cast so that *any* threat, no matter how far-fetched, is scary.

I'll probably be in the minority on this, but I'd also recommend hunting down the TV mini-series of The Shining. The cast isn't as good, of course, but it's competent. The FX are dated (CGI was still being polished), but the longer format gives you more of a sense of the story unfolding, more background, etc. It also features an injury with a polo mallet that's one of the more effective cringe-inducing blows I've seen as it falls into the ""less is more"" category. The blow is to the midsection, there's no blood, but the staging conveys the punch and the actors carry off the delivery of severe internal injuries quite well. If nothing else, watch it if you're a completist.",HapticSloughton,2016-07-23T10:14:38Z,1,COMMENT,Horror,The Shining,4
4u7itb_5,4u7itb,"The movie and book are two different things, plus when you are done reading The Shining you can read the sequel Doctor Sleep. ",SilverNeurotic,2016-07-23T14:32:44Z,1,COMMENT,Horror,The Shining,5
4u7itb_6,4u7itb,"Personally the movie is way better. However the book is still good if you want to immerse yourself in the world of the shining. There is more backstory and the character development of Jack is better in the book. You can slowly see him turn insane. But the book has some very, and I mean very, corny scare scenes. There are some good scares, but there are also scares with killer hedge animals and a demonic fire hose. ",BucouBoy,2016-07-23T17:54:57Z,2,COMMENT,Horror,The Shining,6
n611kj_1,n611kj,"I'm not really into scary books. But I've read the shining.
Couldn't read that at night",SnowdropWorks,2021-05-06T07:48:17Z,2,COMMENT,Horror,The Shining,1
n611kj_2,n611kj,I agree with The Shining.  I read it when I was 15 and it scared the daylights out of me.,Ineffable7980x,2021-05-06T13:37:39Z,1,COMMENT,Horror,The Shining,2
n611kj_3,n611kj,"For me, in the horror genre, it would also be *The Shining* by SK, and his novella *Apt Pupil* which was terrifying in a non-supernatural way. *Angel Manor* by Chantal Noordeloos is a very vivid, gory and scary horror book.",Lanfear_Eshonai,2021-05-06T10:14:05Z,0,COMMENT,Horror,The Shining,3
n611kj_4,n611kj,"When I was a child and reading Haunted Canada, other books that were about ghost stories, and those silly horror stories published in the 1980s (Wait Till Helen Comes, The Dollhouse Murders, etc.) were absolutely terrifying for me. Yet, when rereading these books as an adult, I don't understand why I was so scared. :/ 

I haven't read many horror books lately. Mostly because I am bored of the genre, but I did read 'The Loveliest Dead' by Ray Garton- and that was scary. The thought of living in a house where murder took place, and especially that kind of murder was horrifying. I don't think it's like 'The Shining' or 'Hell House'... but still had very spooky moments.",TiffWaffles,2021-05-06T19:29:28Z,2,COMMENT,Horror,The Shining,4
n611kj_5,n611kj,"Helter Skelter by Vincent Bugliosi,
The Yellow Wallpaper by Charlotte Perkins Gillman, and The Shining by Stephen King are the books that have managed to give me nightmares. 
I'm Thinking of Ending Things by Iain Reid was definitely an unsettling story. I'd be interested to know if anyone has seen the Netflix adaptation. 
House of Leaves will be my next scary read.",NorthernNest2619,2021-05-08T04:19:56Z,3,COMMENT,Horror,The Shining,5
n611kj_6,n611kj,"These are the books that gave me actual nightmares:
1. Hyperion
2. Pet Semetary
3. Salems Lot

No nightmares, but both Summer of Night and The Shining are amongst my top horror books.",wgpubs,2021-05-09T01:44:55Z,3,COMMENT,Horror,The Shining,6
eoww08_1,eoww08,"Maybe an unpopular opinion, but I think Doctor Sleep is one of King’s best books.

It’s not supposed to be like The Shining. It’s the product of DECADES of King mulling over the question of: what happens to Danny when he grows up? He develops that nice little contained horror novel into a world where those horrors exist outside of the mental breakdown of an alcoholic father and a kid with vaguely alluded to supernatural abilities. What’s wrong with developing that into something a bit different?

If your thing is early King, with contained psychological plots like Misery and The Shining, then maybe it’s just not for you. But I personally love both books, while recognizing that they are not the same genre. One is psychological horror, the other is more supernatural adventure. And it’s fun! I liked the characters, I like their relationships, it was cheesy but i wanted them to win and that’s always a good feeling.",avanopoly,2020-01-15T04:32:11Z,1,COMMENT,Horror,The Shining,1
eoww08_2,eoww08,"I don't think *Doctor Sleep* is very good, either as a stand alone, perhaps especially as a sequel, but there's absolutely no reason that it can't feature 'vampires', especially considered as part of King's overall multiverse.

For instance, Dick Halloran features in *The Shining* and in *IT*, which connects to the Dark Tower series, thereby to *'Salem's Lot*, and there are your vampires.",HugoNebula,2020-01-15T13:57:21Z,2,COMMENT,Horror,The Shining,2
eoww08_3,eoww08,"You said exactly one of my thoughts—Doctor Sleep is more a supernatural adventure. I think that encompasses a lot of the differences, including in tone, in scope. I probably prefer the Shining because I think it’s just masterfully done, but I liked Doctor Sleep too.",liz-sails,2020-01-15T05:12:12Z,2,COMMENT,Horror,The Shining,3
15pawxo_1,15pawxo,"Cujo though well written, felt a bit far fetched. Too many things left to fate. A good read nevertheless, but not as eerie as The Shining IMO.",NoTelephone3815,2023-08-16T04:28:14Z,1,COMMENT,Horror,The Shining,1
16d69dh_1,16d69dh,"I read The Yellow Wallpaper when I was depressed and in a point in my relationship where we were needing to talk about equitable division of household chores. That was a bad mix.

Reading The Shining when I thought I was home alone, in my house in the woods, to have my neighbor knock on my door and be very confused when I yelled in shock.

Reading Lolita when I was a teenage girl.

Kurt Vonnegut when I was coming down off a six month bender where I'd been overdoing alcohol and acid among other things. The tone of his books really is something else, and I think I'd appreciate it more now that I'm not in that mental state.",Spidercat99,2023-09-08T17:44:44Z,2,COMMENT,Horror,The Shining,1
16d69dh_2,16d69dh,Is 3rd one the shining?,lifequotient,2023-09-08T11:20:05Z,2,COMMENT,Horror,The Shining,2
16d69dh_3,16d69dh,"I read The Shining in a hotel too! Luckily room 217 didn't exist there, cus it would have been on my floor.",An_Ant2710,2023-09-08T11:22:30Z,0,COMMENT,Horror,The Shining,3
16d69dh_4,16d69dh,I vaguely remember reading the shining in a hotel inside of room 217.,Transgendergengar2,2023-09-08T14:59:04Z,3,COMMENT,Horror,The Shining,4
1nktu5_1,1nktu5,People bring up Kubrick changed The Shining to suit his own directorial needs. He does this with all of his films. Why people single out The Shining I'll never know.,fractalmead,2013-10-04T00:05:22Z,2,COMMENT,Horror,The Shining,1
9e006_1,9e006,"The Shining is way up there, actually.  It's far superior to the movie.

Christine was another one of my early favorites of his, and Duma Key was a great recent book.",GunnerMcGrath,2009-08-25T18:34:14Z,1,COMMENT,Horror,The Shining,1
2r62zd_1,2r62zd,I totally regard them as two separate entities. There's a reason why it's Stanley Kubrick's The Shining and not Stephen King's The Shining; the mini-series follows more closely to the book and has the true feel of a King adaption.,iiRenity,2015-01-03T14:48:21Z,3,COMMENT,Horror,The Shining,1
1wkod2_1,1wkod2,Was hoping that's what this was. The Shining is my favorite Kubrick movie and I love everything about it.,,2014-01-30T20:28:08Z,1,COMMENT,Horror,The Shining,1
1nsry5_1,1nsry5,"yes, it is worth the read. Personally, I think this is one of his best works in a long long time. We are at the levels of Salem's Lot or the Shining, or the Stand for me, no questions about that (again, for me). 

The smart thing he did was to find a very smart balance between things leftover from the Shining and new things. The ""old"" Shining things, apart from the shining capability, are kept to the minimum: the first chapter of Doctor Sleep is, by all means, a new chapter of The Shining: same characters, same bad guys, same setting. But then Doctor Sleep turns into a completely different thing: I don't want to write spoilers, but if you love King and you loved the Shining, I'd say you are 98% and 3/4 guaranteed to like this one too. Plus, the invention of the ""Steam"" is one of the coolest ideas I have seen in a long while...",i_am_theonewhoknocks,2013-10-05T19:59:26Z,1,COMMENT,Horror,The Shining,1
