id,post_id,comment_text,author,created_utc,sentiment,TYPE,category,book,comment_num
qe33qi_1,qe33qi,"I was impressed with his sequel to The Shining (Doctor Sleep). Danny as a grown-up who manages to use his ability to help others, in spite of his own trauma. Then fighting the energy vampires. Plus some closure for him in there too. Well worth the read coming off the first book.

I'd watch the two movies only after reading both books first. They're good, too, but both do play out a little different from the books",myloginisacliche,2021-10-23T12:04:01Z,3,COMMENT,Horror,The Shining,1
qe33qi_2,qe33qi,"What I always liked about *The Shining* in contrast to many of his other novels is how controlled it is. It's very tightly focused and intense. He takes just a couple of characters--and really only one primary character--and isolates them far away from everybody and everything. It's an extremely introspective and ruminative novel which sets it apart from many of his others which suffer from what I always think of as the 'cast of thousands' issue. Some of his other novels seem to depend upon a big, big supporting cast of folks to prop up the main story and there's a certain sameness which obtains after a bit. *The Shining* is really just Jack and his demons and that makes it feel very tightly wound up, and I like that.

As far as the Kubrick adaptation is concerned it is common knowledge that King did not care for it very much and he made his displeasure very clear. But the thing about it is that it is not a Stephen King adaptation as much as it is a Stanley Kubrick film, and Kubrick gives his own interpretation of King's novel which is a re-imagining of King's novel and most certainly not any kind of a mirror image.",death_by_chocolate,2021-10-23T14:38:07Z,1,COMMENT,Horror,The Shining,2
qe33qi_3,qe33qi,"My advice for watching Kubrick’s *The Shining* for the first time:

- Watch it on the biggest screen possible with a good sound system.

- Accept that it has almost nothing to do with King’s book.

Seriously, besides character names and some basic plot points, the two are completely separate products. King hated Kubrick’s adaptation, which is understandable because the film deviated in almost every way from the book, including character developments and major themes.

That said, the movie is an absolute masterpiece, visually groundbreaking and disturbing and layered. Kubrick was a literal genius (IQ of 200) and operating on a singular creative level. The most famous scenes of the movie are not even in the book. There is a whole subculture of people who do nothing but analyze the movie and come up with thematic conspiracies based on little hints and easter eggs. It’s a trip.

Both book and movie are great for different reasons. If you treat them like separate, unique experiences, you’ll appreciate both for their respective strengths.",ArtlessCalamity,2021-10-23T14:26:17Z,1,COMMENT,Horror,The Shining,3
qe33qi_4,qe33qi,"The Shining was also my first Stephen King book about 30 years ago. About the same time, I was having an issue with a large cyst at the base of my spine and in the weeks leading up to my surgery I had to soak in a tub several times a week for an hour. I can say there were times while soaking and reading the book I was absolutely terrified. I had never had that feeling from a book before in my life. I have not read a ton of King since then, but his ability to do that with words alone has stayed with me all these years.",kirked_out,2021-10-23T13:22:50Z,1,COMMENT,Horror,The Shining,4
qe33qi_5,qe33qi,"I recently read The Shining after having watched the movie many times throughout my life. I still like the movie, but I understand why so many prefer the book. Doctor Sleep (the sequel) is really good too. 

As far as other Stephen King, I highly recommend The Dark Tower series. The Talisman and The Black House have the same protagonist and tie in with The Dark Tower.",MDSplat007,2021-10-23T12:00:04Z,1,COMMENT,Horror,The Shining,5
qe33qi_6,qe33qi,"I am not a huge Stephen King fan but loved The Shining. It is one of the few books that really creeped me out, and did so without me realizing it right away. Like, I put the book down after reading for a while and realized a significant sense of dread that lasted over the next hour or two. Fun times when I was reading during a lunch break at work or the like. :)",expespuella,2021-10-23T17:31:00Z,1,COMMENT,Horror,The Shining,6
qe33qi_7,qe33qi,I read this book after watching the shining for the first time about 3 years ago. I have been hooked on Stephen King since. I have read about 25 of his books now and am always looking for more!,MattGspot,2021-10-23T14:18:10Z,1,COMMENT,Horror,The Shining,7
qe33qi_8,qe33qi,"I went down the same Stephen King rabbit hole a few years ago by picking up the Shining. I ended up reading over 30 Stephen King books, including the entire Dark Tower series. It was a fantastic ride. 

I would suggest the Stand or Salems lot next!",HoltandPhone,2021-10-23T17:38:17Z,1,COMMENT,Horror,The Shining,8
qe33qi_9,qe33qi,Man. I read the Shining when I was 12 and it remains the only book I had to put down because I was so scared my heartbeat was drowning out all other noise and my hands were shaking so hard I couldn't read the words. I nearly did a Joey and put it in the freezer.,bechdel-sauce,2021-10-23T19:45:21Z,2,COMMENT,Horror,The Shining,9
qe33qi_10,qe33qi,I was also struck by the stream of consciousness writing the first time I read that book. It was the first time an author seemed to capture the way my mind worked in stream of consciousness and made the book much more relatable and real to me. Whenever I talk to people about my favorite books I specifically mention that writing in The Shining! Glad to see someone else appreciates the exact same thing.,cocoabutterkisses_,2021-10-23T20:09:00Z,1,COMMENT,Horror,The Shining,10
qe33qi_11,qe33qi,"Just finished a book. Was about to - today - start next book. Picked out sci Fi anthology, but my eye drifted on my bookshelf to ... The Shining. I said, ""huh, it's Halloween, maybe I should read that"". 

Here is the sign. Who am I to go against the wind?",porterbrown,2021-10-23T20:26:57Z,1,COMMENT,Horror,The Shining,11
qe33qi_12,qe33qi,The ending of The Shining always makes me cry a lil.,Jesykapie,2021-10-23T15:45:00Z,2,COMMENT,Horror,The Shining,12
qe33qi_13,qe33qi,"The Shining is so good because it's perfect in suspense. We don't see all these paranormal things at the beggining, Stephen King introduce them to us slowly, though a whole book. After every paranormal thing there are some pages without it, so it's scary for the whole time

Love it.",SimeoneXXX,2021-10-23T17:42:53Z,1,COMMENT,Horror,The Shining,13
qe33qi_14,qe33qi,I read The Shining for the first time when I was 11 - that first night I had a nightmare. I have been a Stephen King fan since then.,mizmaddy,2021-10-23T23:54:46Z,1,COMMENT,Horror,The Shining,14
qe33qi_15,qe33qi,"Early King is best King. Newer King is good too, but The Shining may be my favorite of his for exactly the reasons you mentioned. The characters, the ambience, the stream of consciousness written so brilliantly creepy.",Fred_Evil,2021-10-23T14:33:32Z,1,COMMENT,Horror,The Shining,15
qe33qi_16,qe33qi,"The Shining was my first Stephen King book 20 years ago. I'd always liked Goosebumps and such, but I hadn't been allowed to read real/grown up horror stories. My mom told me I could read some Stephen King books if I finished my summer reading list for school. The Shining is still my favorite book. I love all the stories about all the different ghosts.

EDIT: The Kubrik movie changed a lot of the stuff I liked from the book. I prefer the two part/miniseries version.",anoncrazycat,2021-10-23T14:44:42Z,1,COMMENT,Horror,The Shining,16
qe33qi_17,qe33qi,"I don't enjoy violence and horror at all, but the Shining is one I do like. (It's probably because it's not disgusting just creepy.) I thrifted a vhs of The Shining that I want to watch tonight, so I was happy to see this post. I've never experienced The Shining on vhs before.",starchildx,2021-10-23T18:35:18Z,1,COMMENT,Horror,The Shining,17
qe33qi_18,qe33qi,"The Shining is one of those books that makes me dislike movie adaptations in general, and I entirely blame Stanley Kubrick for that.

Because the book is indeed phenomenal, and the movie is one of the most overrated movies ever made. The Shining itself is entirely irrelevant to the plot of the movie, Danny is mostly superfluous to his own story, the supernatural elements are scary for the sake of scary with no narrative explanation, and Halloran is a red herring used to deceive the audience into thinking he matters.

I haven’t seen the movie for Doctor Sleep, mostly because I enjoyed the book and don’t want it to be ruined for me like The Shining almost did.",I_are_Lebo,2021-10-23T13:40:44Z,0,COMMENT,Horror,The Shining,18
qe33qi_19,qe33qi,"If you like the Shining, you should definitely read The Stand.",TomatoFettuccini,2021-10-24T04:57:06Z,1,COMMENT,Horror,The Shining,19
qe33qi_20,qe33qi,The Shining miniseries starring Steven Weber and Rebecca DeMornay was far better than the theatrical movie. Watched it again a few years ago and it holds up.,Ya_Whatever,2021-10-23T17:00:44Z,1,COMMENT,Horror,The Shining,20
qe33qi_21,qe33qi,"I have yet to read the shining but I do like the movie although I’ve heard it’s very different from the book. Stephen King hates it and said that Kubrick cut out the monotony and repetition of day to day tasks that helped drive the main character made.

Also in regards you liking Stephen King. I usually love reading his stories. I just enjoy is writing style. Even the stories he wrote that I didn’t particularly like I still enjoyed reading them.",GonnaGoFat,2021-10-23T14:16:46Z,2,COMMENT,Horror,The Shining,21
qe33qi_22,qe33qi,"I’ve only read If It Bleeds, Pet Sematary, and The Shining. I loved them all so much. Seriously- make Pet Sematary your next SK read!!! It’s incredible (better than The Shining in my opinion).",CrawlingKingSnake43,2021-10-23T16:36:20Z,1,COMMENT,Horror,The Shining,22
qe33qi_23,qe33qi,"The Shining is one of my all time favorite books. If you want other King recommendations, I strongly recommend Pet Semetery and Green Mile. The book Pet Semetery also has much more depth than the movie (didn’t see the re-make, heard it’s awful). It made me pretty emotional, the way it depicts the unhealthy ways a family handles grief and trauma, while being manipulated by a great supernatural force. Green Mile is not horror (if you know about the movie you already know that) but also deals with supernatural phenomena, as well as racism and bias in a flawed justice system. Loved it.",CognitiveTeaKettle,2021-10-23T17:27:55Z,1,COMMENT,Horror,The Shining,23
qe33qi_24,qe33qi,Be sure to check out Burnt Offerings by Marasco. It had a similar slow-burn feel and actually served as inspiration for The Shining.,konapun_,2021-10-23T17:33:09Z,2,COMMENT,Horror,The Shining,24
qe33qi_25,qe33qi,"Interesting. The shining was my first title i read this year, back in January. I was extremely underwhelmed. However, that might have been because i knew the plot from watching the movie",RainbowBunnyDK,2021-10-23T17:53:43Z,2,COMMENT,Horror,The Shining,25
qe33qi_26,qe33qi,"Be sure to read Doctor Sleep, King's follow up to The Shining",trueslicky,2021-10-23T18:14:04Z,3,COMMENT,Horror,The Shining,26
qe33qi_27,qe33qi,"I also just read The Shining! After finishing The Stand, it was such a nice surprise to enjoy.",GeminiProblem,2021-10-23T18:15:53Z,1,COMMENT,Horror,The Shining,27
qe33qi_28,qe33qi,Read Doctor Sleep next! It follows The Shining,grungexgoddess91,2021-10-23T19:33:11Z,3,COMMENT,Horror,The Shining,28
qe33qi_29,qe33qi,"A lot of people will say go read “The Stand,” or “Doctor Sleep,” but personally I’d say go straight into Pet Semetary. There’s something special and down right terryfing about that book. And if you liked the characterization and dramatic build up in the Shining Pet Semtary’s will also make you hold your breath, and feel a cold chill.",OmegaRainicorn,2021-10-23T21:17:08Z,1,COMMENT,Horror,The Shining,29
qe33qi_30,qe33qi,"The Shining was my first too. If you’re looking for the next King book to read I’d read either one of his earlier, shorter books (Salem’s Lot, Pet Sematary, Carrie) or go with one of his best newer ones (IMO) Revival",GaryRodeo,2021-10-23T22:23:12Z,1,COMMENT,Horror,The Shining,30
qe33qi_31,qe33qi,"I've read a lot of Stephen King. The Shining is the only book I've ever stopped reading after general creepiness, might terrors, etc.

I straight up woke up one night with my whole room seemingly pulsing in time with my heart, and the bathtub lady standing at the foot of my bed.",,2021-10-24T00:58:03Z,1,COMMENT,Horror,The Shining,31
qe33qi_32,qe33qi,"Dr. Sleep, the sequel to the shining, is really good too! I just finished both.",jojapeggi,2021-10-24T01:13:25Z,1,COMMENT,Horror,The Shining,32
qe33qi_33,qe33qi,"I read this for the first time in the last 70's (when it first came out) and I was in junior high.  It so enjoyably scared the ever loving crap out of me.  I couldn't put it down... as long as I could find a quiet room to read which had at least one other person in it.

The song ""I'm Not In Love"" by 10cc was just becoming popular and I was reading the parts about snow covered topiary.  That ethereal start to ""I'm Not In Love"" will always remind of a cold as hell, snowy wind, blowing across supernatural malevolent hedges bent on Holloran's destruction.

This was my first ""adult"" book and I did get sideways glances from some of my teachers as I read in class.  I'll never forget those days and how intertwined they were with my reading of the Shining.",aleph_zarro,2021-10-24T01:59:02Z,1,COMMENT,Horror,The Shining,33
qe33qi_34,qe33qi,Just read Misery and had the same feeling of being uneasy the entire time. Love the movie but the book is even better. Think I might go for The Shining next...,b-napp,2021-10-24T06:42:03Z,1,COMMENT,Horror,The Shining,34
qe33qi_35,qe33qi,"I've only read Pet Sematary by Stephen King and am reading The Stand right now. Pet Sematary was such a great read and the audiobook read by Michael C. Hall is PHENOMENAL! But Pet Sematary is also a great, creepy read but it really explores grief and the process of it and how it can consume us and lead us down a path that could ultimately lead to insanity if we let it. It's an amazing book so I'm pretty excited about diving in to other books like The Shining, eventually.",OptimusCRIME107,2021-10-24T10:35:00Z,1,COMMENT,Horror,The Shining,35
qe33qi_36,qe33qi,The Shining is my read once a year book. Jack so sad. When he looking for key in the shed. I felt hope. He felt hope. Then he chucked it. I died inside. He died inside.,thismyusername69,2021-10-29T14:11:34Z,1,COMMENT,Horror,The Shining,36
qe33qi_37,qe33qi,"After reading Pet Sematary and Misery, I read the Shining. I felt like The Shining was a LOT more mild and contained less profundity. I think Pet Sematary is the best book I’ve ever read, it was very powerful and really got under my skin and in my head. Misery was a very fast-paced book and was so interesting and suspenseful. The Shining, for me, had less of an impact",no_one_hi,2023-01-23T01:11:40Z,3,COMMENT,Horror,The Shining,37
qe33qi_38,qe33qi,"I though the book and the movie were both great !

I just saw Doctor Sleep this week and I liked it, has anyone read the book ? If so, would you recommend it ? Is it as strong as the shining?",WorldsOkayestPinguin,2021-10-24T02:40:17Z,1,COMMENT,Horror,The Shining,38
qe33qi_39,qe33qi,"I had heard mixed things about Doctor Sleep, but I ended up really liking it. It's an open-hearted look at addiction and recovery. At first I didn't see a need for a sequel to The Shining, but Doctor Sleep more than justified it's existence.",TomBirkenstock,2021-10-23T15:08:33Z,1,COMMENT,Horror,The Shining,39
qe33qi_40,qe33qi,"I borderline liked the Doctor Sleep book more than The Shining, I enjoyed the character relationships much more in it. Tried to watch the movies recently as I only finished reading both books within the last two weeks, and couldn't even get half an hour in to either of them.",NiTro_Erebus,2021-10-23T15:31:50Z,1,COMMENT,Horror,The Shining,40
qe33qi_41,qe33qi,"I liked Doctor Sleep too because of how it answered so many questions and gave us closure for Danny but it just didn’t have the intensity of The Shining. I think it had the potential to be as good but didn’t quite get there.

ETA: I liked the movie but again, they had to simplify it to fit into one movie. That always sucks.",IncendiaryIceQueen,2021-10-24T03:04:14Z,1,COMMENT,Horror,The Shining,41
qe33qi_42,qe33qi,"The scariest thing in The Shining is the human aspect.  The alcoholism, the abuse, the demons in Jack.  The hotel is a distant second.",catsuperhero,2021-10-23T15:48:06Z,2,COMMENT,Horror,The Shining,42
qe33qi_43,qe33qi,"Yeah. I said this above, but the last time I watched The Shining it struck me that it's a horror movie about domestic abuse. 

It's a lot less fun to watch now.",rustblooms,2021-10-23T15:46:23Z,3,COMMENT,Horror,The Shining,43
qe33qi_44,qe33qi,"I was a serious King fan for years. I read everything by him, except that I've disliked anything written after about 2002 so read almost any. (So, read everything before 2002.)

The Shining is, by far, his best book. It is his least ""Stephen King"" book, but having taken a long hiatus from reading him, thats a good thing. His lengthy character development can get a bit tedious, and some of his early work is great for the abrupt, direct nature of its horror.

Edited for clarity.",rustblooms,2021-10-23T15:44:39Z,1,COMMENT,Horror,The Shining,44
qe33qi_45,qe33qi,"I’d like to suggest N0S4A2 as well, written by King’s son. I consider it as part of the Shining books.",Zodep,2021-10-23T16:17:19Z,2,COMMENT,Horror,The Shining,45
qe33qi_46,qe33qi,The movie of Doctor Sleep is really good. It definitely differs from the book and fits more as a sequel to the Shining movie but it is very good.,Chaotickane,2021-10-23T14:02:23Z,1,COMMENT,Horror,The Shining,46
qe33qi_47,qe33qi,"I recently saw the Doctor Sleep movie and they managed to remain pretty damn faithful to the book, with a few changes here and there to make it mesh with the film version. My biggest complaints are that they left out most of the Wendy flashbacks, and Abra's grandmother was omitted entirely, which fucking sucked. That said, they did so for a reason, because the climax had to be much different due to the change from the books of the hotel still existing rather than being blown up. What they do with that is actually narratively interesting, and circles back around to give us a meta callback to the ending of the original Shining book, which I found very satisfying. If you dislike the difference between the Shining book and movie, Doctor Sleep the movie actually goes a long way to correcting some of those wrongs and ""fixing"" it a little bit.

Other than the climax and the omission of the grandmother though? The film is almost scene for scene from the book. It's worth a watch, *especially* if you didn't care for the changes in the original film.",DomLite,2021-10-23T14:50:38Z,1,COMMENT,Horror,The Shining,47
qe33qi_48,qe33qi,Why do people say jack is a jackass at the beginning of the shining movie? He doesn’t start to lose his temper until the snow comes which is the same way in the book.,UnitedStatesOD,2021-10-23T14:52:17Z,3,COMMENT,Horror,The Shining,48
qe33qi_49,qe33qi,"It’s funny because I always heard how terrible King is at writing women. Having grown up watching The Shining, I was like sure, he must be because she is useless. Then one day I decided to read it (first King book) and I was blown away by Wendy in the book. She’s intelligent, caring, and brave, fighting tooth and nail for her family. To this day, I can’t bring myself to rewatch the film.",Ahrimanic-Trance,2021-10-23T17:26:03Z,1,COMMENT,Horror,The Shining,49
qe33qi_50,qe33qi,"Kubrick was also notoriously cruel to Shelley Duvall in order to get her into character. I don't support abusing actors, but I can't deny The Shining is a cinematic masterpiece",QuiGonJinNJuice,2021-10-23T22:52:38Z,3,COMMENT,Horror,The Shining,50
qe33qi_51,qe33qi,But the Shining is a notorious example of straying far from the source material. Its obvious Kubrick had no intention of adapting the book and wanted to use the story outline to make his own movie.,UnitedStatesOD,2021-10-24T02:13:59Z,3,COMMENT,Horror,The Shining,51
qe33qi_52,qe33qi,"I’d say The Shining book is the best version, while the Doctor Sleep movie is the best version. Sounds odd, but the doctor sleep movie just improved on it so much compared to the book",ChEChicago,2021-10-23T15:18:21Z,1,COMMENT,Horror,The Shining,52
qe33qi_53,qe33qi,"Lol I didn't say that it's the best book of all time; there are so many other books that are better than The Shining. But personally, I love it, because of both the book itself and the memories I associate with it.",,2021-10-24T14:38:52Z,1,COMMENT,Horror,The Shining,53
qe33qi_54,qe33qi,"Interesting. I may give it a try, then. Thank you for the input.

Cause for the record, while I loved the Shining book, I **hated** the movie.",I_are_Lebo,2021-10-23T15:54:27Z,2,COMMENT,Horror,The Shining,54
qe33qi_55,qe33qi,"Maybe so, but the movie features only four characters, and as a character study, it’s just awful.

Danny is a stereotypical young boy, with only stereotypical young boy interests, and no actual personality. The book had the sub plot of his imaginary friend that turned out to be named after Danny’s middle name and was an extension of his own psyche dealing with trauma, all of which is internal conflict, and all of which was absent from the movie.

Danny’s mother (whose name I can’t even recall without looking her up) is a shrill, annoying, horse faced woman that contributes literally nothing towards the movie other than victim hood, completely missing the effects that she had towards her husband and son in the book.

Halloran is a caricature of a black man, introducing concepts to the audience that are never expanded upon, and he dies the moment he tries to be anything more to the story than expository lore. In the book, Halloran took on the role of mentor and was extremely useful towards keeping Danny alive against the forces of evil. In the movie, he was entirely worthless towards any of the other characters or the overarching plot.

The worst, however, is Jack. Jack Torrence in the book is a tragic figure. A man torn between a temper he cannot control, an addiction he cannot overcome, and resentment he has yet to actually address. As a character in the book, Jack Torrence is a message to the reader, a sort of “there but for the grace of god go I”. At the end of the story, because of the temptations of the Overlook and it’s malevolent spirit entity, Jack succumbs to his own inner demons and is cast out of his own body, being used as a puppet to slay his own family. Jack in the book was dead long before the Overlook blew up, and throughout the story that ending was alluded to in references to the faulty boiler. In the movie, Jack goes insane for no real explored reason. He’s just an asshole and a psychopath that decides to torment and terrify because he’s **bored**! His death at the end of the story was pointless, as was his murder of Halloran. In the end, nothing was gained, just a spooky ghost story whose elements never add up to anything more than Cabin Fever hallucinations.

It’s not just that the themes are opposite. The movie is inconsistent in its plot, one dimensional with its characters, and shallow in its morals. It was visually striking, and the sound and set designs were excellent, and that’s about as much positive things I have to say about it.

Like I said before, Stanley Kubrick was a brilliant artist. Several of the scenes from The Shining, like several scenes from most of his movies, in particular 2001: A Space Odyssey, are art in motion. But the script is bad, the acting is sub par, and the story is disappointing. Kubrick may have been a great artist, but he was a shitty storyteller.",I_are_Lebo,2021-10-23T15:50:09Z,0,COMMENT,Horror,The Shining,55
qe33qi_56,qe33qi,"That’s just my point, though. If The Shining is one of the best examples of a horror movie that is good, that’s a scathing indictment of all the other horror movies, because it is not, objectively, a good movie. It is poorly constructed, poorly written, and poorly acted.

As far as I can tell, the sole reason why The Shining is hailed as a masterpiece of horror movies is because of the (admittedly) fantastic cinematography. That’s it.",I_are_Lebo,2021-10-23T21:20:17Z,0,COMMENT,Horror,The Shining,56
qe33qi_57,qe33qi,"So is IT, both adaptations. Those books have *waaaaay* too much material to fit into a movie, or even a two-part one. Look at the Shining tv remake. They tried to shove everything in and it just didn't work on the screen.",Im-Not-Australian,2021-10-24T03:08:53Z,2,COMMENT,Horror,The Shining,57
qe33qi_58,qe33qi,Agreed. The entire villain cast reminded me of a league of professional wrestlers or something. Such a strange difference from the shining.,mystical_croissant,2021-10-24T04:13:36Z,3,COMMENT,Horror,The Shining,58
qe33qi_59,qe33qi,There's no way you could make a sequel to a Kubrick movie. The Shining movie was as much Kubrick's as the book was King's.,neonerz,2021-10-23T15:58:08Z,3,COMMENT,Horror,The Shining,59
qe33qi_60,qe33qi,"Honestly, I so dislike King's shift in writing style that I purposely didn't read Dr Sleep because I didn't want it to ruin The Shining.",rustblooms,2021-10-23T16:29:05Z,0,COMMENT,Horror,The Shining,60
