id,post_id,comment_text,author,created_utc,sentiment,TYPE,category,book,comment_num
134xlmd_1,134xlmd,"Thank you for this insight. I’ve been looking for a book to get lost in and I think you’ve inspired me to pick up the Shining. And like you, love the movie also.",chunkyogini,2023-05-01T18:51:48Z,1,COMMENT,Horror,The Shining,1
134xlmd_2,134xlmd,"I love The Shining. The subtle creepiness that just builds and builds is amazing. The movie is good Kubrick made it a movie of his own, which is fine, but the book is just a step above. 

The movie had great jump scares, but the book was the first book I ever read that gave me goosebumps and shivers.",Commercial_Curve1047,2023-05-02T01:30:18Z,1,COMMENT,Horror,The Shining,2
134xlmd_3,134xlmd,"*The Shining* book > movie version. I have never liked the movie version despite the fact that it's pretty much a critical success. I didn't care for the changes they made from the book, i.e., the topiaries. Also, Shelly Duvall's Wendy was one-dimensional: A crying/screaming spineless victim. There have been many good (and a few great) movie adaptations of SK's books, but *The Shining* is *not* one of them.",azvitesse,2023-05-01T22:23:57Z,0,COMMENT,Horror,The Shining,3
134xlmd_4,134xlmd,I don't like Stephen King but the Shining was an exception. I felt the same about Jack. Adopting the worst traits of your father (even if he isn't really a bad person) that you had sworn not to adopt sucks and I can relate. I'm as happy as you I'm not being manipulated by a sneaky building though. The only thing I didn't like was that nothing was explained in the end. The hotel was crazy because it was.,okmisery,2023-05-01T22:59:00Z,3,COMMENT,Horror,The Shining,4
134xlmd_5,134xlmd,"I respect the path you took and I encourage anyone else who wants to follow that same path.

But for other readers: You don't have to read or watch The Shining, in order to enjoy Doctor Sleep. The sequel stands well on its own.",lucia-pacciola,2023-05-01T18:53:07Z,2,COMMENT,Horror,The Shining,5
134xlmd_6,134xlmd,"Thank you for this insight. I’ve been looking for a book to get lost in and I think you’ve inspired me to pick up the Shining. And like you, love the movie also.",chunkyogini,2023-05-01T18:52:03Z,1,COMMENT,Horror,The Shining,6
134xlmd_7,134xlmd,"The Shining is a book I will never reread. Parts of it still haunt me. Spending that much time in the mind of an alcoholic was possibly the most painful experience I’ve ever had. 

In reflection, I’d seen the movie many many years ago. I picked the novel up for the first time a few months ago. Both were good but agree the novel was far superior in its themes and development.",Just_Dot9347,2023-05-03T13:41:31Z,1,COMMENT,Horror,The Shining,7
134xlmd_8,134xlmd,"I think that if you see the Kubrick film separately from the book, it’s a very good movie. They definitely did Wendy poorly, and I wish they had touched on the shining and alcoholism more in the movie.",kaladin-throwaway,2023-05-02T01:59:08Z,2,COMMENT,Horror,The Shining,8
134xlmd_9,134xlmd,"I read the Shining and watched the movie very young, and that’s how I look at them. The movie is amazing, but it’s not necessarily great as an adaptation of the book.",Denverdogmama,2023-05-02T12:16:48Z,2,COMMENT,Horror,The Shining,9
qtebz5_1,qtebz5,"I’m currently reading some short stories by king before I “dive into” one of his books. I’m surprised at how boring I find his writing and I’m not sure I’m going to pursue his novels. I feel like a cynic but every story seems the same as the shining. The same familes, same foreshadowing, scenes involving adultery, and an ending that seems like a cop out every time. Even his usage of alliteration makes me upset somehow like he’s trying too hard in certain areas when I’m craving more substance, plot, and realistic dialogue.",baebae4000,2021-11-14T01:04:32Z,0,COMMENT,Horror,The Shining,1
qtebz5_2,qtebz5,"The Shining was my spooky October pick last year and I remember being into it. I was never pee-pants scared but I really like how King builds suspense. He doesn’t always follow through on that build and I think he really leaves a lot of it up to his readers. My favorite parts of the few King books I’ve read are when the main characters are scared because their own imaginations are running wild. They’re expecting a bloody dead corpse with cloudy eyes and rotten teeth reaching out for them, grabbing them, eating them. Their hair is standing on end and sweat is tickling their scalp and running down the back of their neck. Then they reach for the doorknob, turn it, open it wide and… sometimes nothing is there. But King just spent two pages making the reader feel what the character feels. THAT is what he’s good at. When I read King, I live in his stories. However, endings are not his strength and the books I’ve read tend to fall off towards the end. Regardless, I’ll probably keep picking up King books in the future. 

Side note - I thought Dr. Sleep was better than The Shining.",LucindaBobinda,2021-11-14T01:52:13Z,1,COMMENT,Horror,The Shining,2
qtebz5_3,qtebz5,"I’ve never read horror before this was my first time ever and I don’t believe that anybody who read The Shining and the first 500 pages or so can say that they were just enthralled and amazed the whole time. It is a very slow book which I guess is something I’m not that into. The first 500 pages or so nothing much happens. It’s just him wanting to drink, checking the boiler and wiping his mouth. It’s not much. Sure the last 100 pages or so stuff does happen and it is exciting and is well written it just wasn’t the horror I was expecting. Sorry if I struck a nerve",PenelopeJune8,2021-11-14T03:07:12Z,2,COMMENT,Horror,The Shining,3
qtebz5_4,qtebz5,"> and I don’t believe that anybody who read The Shining and the first 500 pages or so can say that they were just enthralled and amazed the whole time.

Well, then I guess the many hundreds of thousands of people who've read the book over the last 45 years can heave a sigh of relief that you've finally rocked up and corrected their thinking for them. If only we could have your taste and insight.",HugoNebula,2021-11-14T11:56:54Z,0,COMMENT,Horror,The Shining,4
qtebz5_5,qtebz5,Oh that’s interesting! I think I kinda messed up while reading The Shining because I expected like a horror movie I think but it was still a good book with some scary parts and I like what you said with the ‘it hides at the corner of your eyes’,PenelopeJune8,2021-11-14T16:49:37Z,1,COMMENT,Horror,The Shining,5
qtebz5_6,qtebz5,Sorry for sharing my opinions if I had known this was so sentimental to you I might have been more sensitive. Also I (see there I go again saying my opinions. You think I’d have learned the first time) feel like some interesting things did happen in the first 500 pages just I had no problem putting the book down it was not really a page turner for me nor did I feel just an excited rush whenever I had spare time to read. I’ve felt that way before. When I realize that I have spare time to myself to read it’s a feeling that makes me so happy when j get to read a book I love and am sad to put down when I have a life to attend to. This however was not that book. Also I wasn’t speaking for others I said THE WHOLE TIME. Yeah sure there were parts in there that I enjoyed like learning the family’s background but I said that I felt like nobody the entire time was just enthralled and amazed. I should have probably used better word choice and said ‘I feel like the majority of people who read The Shining were not amazed or enthralled the whole time’.,PenelopeJune8,2021-11-14T17:37:12Z,2,COMMENT,Horror,The Shining,6
qtebz5_7,qtebz5,"Reddit is all about opinion and conversation, but—as you note—you expressed your opinions by denigrating those of others. Many people love *The Shining* and enjoyed every page. You can say that you didn't without making out all those who came before you are wrong or for some reason lying.",HugoNebula,2021-11-14T18:07:03Z,0,COMMENT,Horror,The Shining,7
qtebz5_8,qtebz5,"King called Kubrick's film of *The Shining* a beautiful Cadillac without an engine, but his dislike of it goes far beyond that it's a superficial adaptation of his book. King wrote a sympathetic study of a man struggling with alcoholism and insecurity, career and family pressure—almost without at the time realising he was writing about himself—and Kubrick threw it all away and let Nicholson play crazy from the outset, and made the character of Wendy—a far stronger and more assured character in the book, in many ways based (again, unknowingly) on King's wife—a weak and ineffectual screamer. He didn't take it personally because it was his book that was diminished, but himself and his own demons, and his family.",HugoNebula,2021-11-14T17:43:34Z,0,COMMENT,Horror,The Shining,8
2kz159_1,2kz159,"Absolutely. They are both great in their mediums, and yet completely different. The Shining book is very much about the horror of alcoholism, whereas the Shining movie is pure horror. There's a chapter in the book that made me shiver with fright, concerning danny and that damned room(217?).

Well worth reading.",,2014-11-01T15:50:47Z,1,COMMENT,Horror,The Shining,1
2kz159_2,2kz159,"The Stephen King world can be very different in the books and I recommend losing yourself in the books. Read The Shining, then read the Bachman Books and Night Shift to keep the mood going. I'd say the only two books that are movies that you don't need to read are Shawshank and Green Mile. They were pretty much copies of the books and *felt* the same as the books.",dirtcreature,2014-11-01T14:34:54Z,1,COMMENT,Horror,The Shining,2
2kz159_3,2kz159,"Read it.  I had read the Shining about a dozen times before I ever saw the film.  To me, the book is better - scarier, creepier, more detailed, more interesting.  The movie came across as a little stark to me.  I don't want to say that the movie oversimplifies things, but it doesn't give you the same experience at all.",acidotic,2014-11-01T15:59:54Z,1,COMMENT,Horror,The Shining,3
2kz159_4,2kz159,"I read the shining a few months ago after watching the movie a million times, I don't usually like watching the movie then reading the book but I took a shot at it since I've been on a King kick lately. So worth the read! It's was much different than the movie but both are equally great pieces of work! Also I really enjoyed Dr. Sleep! Another great read!",AliBabbles710,2014-11-01T16:06:56Z,1,COMMENT,Horror,The Shining,4
2kz159_5,2kz159,This was very recently discussed on this [amazing/fun podcast.](http://top100project.com/podcasts-not-100-project/the-shining-1980/)  Ryan and Bev are going through the AFI list of top American movies and podcasting about each one.  The Shining was the last one they covered.  I think they both read the book and much of the show is discussing the similarities and differences.  Enjoy.,HeBurns,2014-11-01T20:07:26Z,2,COMMENT,Horror,The Shining,5
2kz159_6,2kz159,"I saw the movie first. I read the book because I wanted more insight into the mysteries of the film. I was really disappointed by the book and I don't think it holds a candle to the film. I think Kubrick's adaptation is so far removed from the original source material. Even Stephen King wanted to remake the film (which is insane because the shining is one of the best, scariest films of all time). The film is genius and the book I thought was pretty underwhelming.",miilkyytea,2014-11-01T21:34:18Z,2,COMMENT,Horror,The Shining,6
2kz159_7,2kz159,"Oh yes!  'The Shining' was the only book that was so terrifying to me that I couldn't read it for more than an hour at a time. And every time I put the book down, I'd have to watch 'MST3K' or 'Looney Tunes' to relax. ",hermana,2014-11-01T16:37:45Z,1,COMMENT,Horror,The Shining,7
2kz159_8,2kz159,"Yes and you should see the Simpson's parody as well. Also, Dr Sleep was just ok, maybe a 5 where the Shining is a solid 10.",BostonRich,2014-11-01T17:23:54Z,1,COMMENT,Horror,The Shining,8
2kz159_9,2kz159,"The Kubrick movie is a fine film, but it's only based on the most basic aspects of the book.

I just finished reading The Shining about a week ago and the answer is a definite yes to reading it.  Like most books you will learn much, much more about the roots of the story.  Plus, without any real big spoilers, let's just say that if you were annoyed that Dick Hallorann got killed so easily in the movie then you'll be much happier with the book.  ",Valahiru,2014-11-01T18:10:22Z,1,COMMENT,Horror,The Shining,9
2kz159_10,2kz159,"If you look at the time it was written in King's life, it's almost about his own struggle with alcohol. Booze was the bad guy. Certain events could have been caused by hallucinations or blackouts. 

The movie erases the strongest instances of this and makes the clear-cut bad guy Jack and makes the hauntings literal and undeniable. 


They're both good. Just different. 

Watch the miniseries version of The Shining. Yes, that exists. It's extremely cheesy and the boy who plays Danny is very punch able. But it's as close as you'll get to a movie that matches the book's storytelling. ",RIFT-VR,2014-11-01T16:22:46Z,1,COMMENT,Horror,The Shining,10
2kz159_11,2kz159,"As someone who just did both, I would say yes! I have my own personal rule which is NEVER watch a movie after I read the book. I always have trouble separating the two, which is what everyone tries to tell me.  Not being a huge King fan, I loved the Shining. I also watched the documentary Room 237 before watching the Kubrick movie, and I began focusing on the ""other messages"" they say Kubrick was trying to put forth. For the first time in my life, I was able to enjoy the book and the movie, even though they are EXTREMELY different!",,2014-11-03T18:57:56Z,1,COMMENT,Horror,The Shining,11
2kz159_12,2kz159,"Yeah. Kubrick completely changed the intent of the story. I know you have to change things when translating a book to a different medium,  but you *must* keep the authors intent alive. Kubrick did not. At all.

That being said, I love Kubrick's film. But it isn't The Shining.  ",Wine_Queen,2014-11-01T15:31:18Z,0,COMMENT,Horror,The Shining,12
2kz159_13,2kz159,"I must be the only person alive who actually likes the mini series. Granted, it was the first ""The Shining"" I saw as a kid, later read the book and saw the Kubrick movie, but I prefer the mini series to Kubrick's version because the amount that Kubrick strays from the book bothers me.
",artemisdragmire,2014-11-02T00:56:38Z,1,COMMENT,Horror,The Shining,13
2kz159_14,2kz159,"No, Kubrick may be a genius, but it definitely doesn't show in *The Shining.* The book is tons better, plus the movie totally misses the point of the book in the first place.",measureinlove,2014-11-01T16:43:58Z,0,COMMENT,Horror,The Shining,14
2kz159_15,2kz159,"Not Sure why it is so stupid. Some adaptions are very loyal to the source material, some are not. The Shining may be a great book but if the film was extremely loyal to the source material I most likely would not bother reading it since I would know all the plot points and twists from seeing the film. Now that I know that they are significantly different I will read the book.",purplehaze1274,2014-11-01T18:37:36Z,2,COMMENT,Horror,The Shining,15
2kz159_16,2kz159,"Wha?? Everyone should be reading books; don't be ridiculous. Plus, we're talking about Stephen King here. The Shining is great but it isn't exactly Proust. 

What on earth makes you feel so entitled and better than everybody else?",takesallkindsiguess,2014-11-01T18:16:27Z,3,COMMENT,Horror,The Shining,16
2kz159_17,2kz159,It's good but not a classic like The Shining.  It's not nearly as scary but worth reading as a character piece for grownup Danny.,guildenstern42,2014-11-01T14:51:24Z,3,COMMENT,Horror,The Shining,17
2kz159_18,2kz159,"I absolutely thought it was!  That's how a sequel is done. 

And I agree with the others.  It's nowhere near as scary as The Shining but the emotional undercurrent running between the books is what kept me going.  Just a terrific book. ",maverickx12,2014-11-01T15:01:05Z,1,COMMENT,Horror,The Shining,18
2kz159_19,2kz159,"I really really enjoyed Doctor Sleep.  It was great to get to follow up with Danny (now just called Dan) and the story was much different from The Shining.  Whereas the Shining is a horror novel, I actually thought Doctor Sleep was almost more fantasy horror.

All in all, a great story with some really neat characters.  Couldn't recommend it more.",Bartfuck,2014-11-01T17:05:59Z,1,COMMENT,Horror,The Shining,19
2kz159_20,2kz159,"It's much less scary than *The Shining*, but it's a great book in general. ",,2014-11-01T14:51:24Z,1,COMMENT,Horror,The Shining,20
2kz159_21,2kz159,"I think Kubrick created his own new points for the film. He took the main plot points from the novel and then filled in the rest of the movie with his own themes of a family going insane and children going through abuse.

Outside of the pin being removed from the food pantry, you could argue that the entire movie is about bad dreams and projecting your issues through dreams.

This guy writes a crazy long essay on why the Shining may be Kubrick's inversion of the [""haunted house"" trope](http://www.collativelearning.com/the%20shining.html).",theend31216,2014-11-01T16:00:28Z,3,COMMENT,Horror,The Shining,21
2kz159_22,2kz159,"You're basically expecting an artist to stop speaking for themselves and speak for someone else. I question whether this person is even an artist in this capacity. You can point to people who have done this, but I don't think The Shining film would be so monumental in film history if Kubrick had just been a puppet for someone else's voice. He took entire genres and made them his own; I'd hate to know what culture we would lose if he was forced to walk on eggshells over a single author's intent.",,2014-11-02T00:50:51Z,2,COMMENT,Horror,The Shining,22
2kz159_23,2kz159,"This. This is what I always tell people when they ask why I didn't like the movie. I can see how it's a decent movie on its own, but it totally missed the point of the book. If Kubrick wanted to make something so different from the book, he shouldn't have called it *The Shining.*",measureinlove,2014-11-01T16:40:54Z,0,COMMENT,Horror,The Shining,23
102w8m_1,102w8m,"It's been 35 years since The Shining, hell of a wait for a sequel.",Buhdahl,2012-09-18T17:17:54Z,2,COMMENT,Horror,The Shining,1
102w8m_2,102w8m,"I don't know. The whole ""shining"" part of the The Shining was my least favorite aspect of the novel. That isn't to say that I didn't like it, but the best part of the original was the setting and basically the parts of the story that drew Kubrick to make the movie. 

That being said, I love the title and pretty much like most every King novel. So I'm sure I'll like it.",gregishere,2012-09-18T18:29:26Z,0,COMMENT,Horror,The Shining,2
102w8m_3,102w8m,"In the audio version of ""The Wind through the Keyhole"" he read the first chapter of ""Dr.Sleep""/ It wasn't bad, and The Shining is defiantly in my top 3 favorite Stephen King novels, I'm kinda looking forward to it.",nempah,2012-09-18T18:41:02Z,1,COMMENT,Horror,The Shining,3
102w8m_4,102w8m,"If it's as long as ""The Shining"", and as good a quality as his latest work, the title, ""Doctor Sleep"" couldn't be more appropriate.

I-kid, I-kid!",Greg6711,2012-09-19T00:54:45Z,1,COMMENT,Horror,The Shining,4
102w8m_5,102w8m,Glad I didn't donate my copy of The Shining to the library.,jiveturkey99,2012-09-19T00:20:35Z,1,COMMENT,Horror,The Shining,5
102w8m_6,102w8m,"Is anyone else planning on totally avoiding this book so as to not destroy the experience of The Shining? I'm a little appalled that he wrote a FUCKING SEQUEL. I love Stephen King, but... not cool.

Edit: Nice to see the respect of others' opinions so well established here. /end sarcasm",mementomori4,2012-09-18T18:28:05Z,0,COMMENT,Horror,The Shining,6
102w8m_7,102w8m,"I cant bring myself to be excited about this. Anything he would write would sully Kuberick's interpretation of the novel. I somehow want to keep it as perversely dark and twisted as Kuberick imagined it to be.

Btw, there was a site that did a huge analysis of The Shining. It was several thousand pages long and absolutely brilliant. I can't seem to find the link. Does anybody have that info?",,2012-09-18T21:13:58Z,3,COMMENT,Horror,The Shining,7
102w8m_8,102w8m,"That's a good point. When I think of The Shining... I'm never actually thinking of the shining. I'm thinking of the setting, the characters, the scenario, the great movie. ",STXGregor,2012-09-19T00:13:22Z,1,COMMENT,Horror,The Shining,8
102w8m_9,102w8m,I agree. My favourite part of The Shining was the actual hotel.,morningfog,2012-09-19T01:56:26Z,1,COMMENT,Horror,The Shining,9
102w8m_10,102w8m,"Yeah, fuck him for doing whatever he wants with his own ideas. 

He's Not George Lucas, you know. He's not going to reprise The Shining so Danny hacks first. ",OGLothar,2012-09-18T18:59:27Z,3,COMMENT,Horror,The Shining,10
102w8m_11,102w8m,"Out of interest, why does it make you so mad? Because The Shining is one of his early, untouched classics?",BritishHobo,2012-09-18T19:49:11Z,3,COMMENT,Horror,The Shining,11
102w8m_12,102w8m,"King HATED Kubrick's interpretation of The Shining, so much he did his own version with Steven Weber as a miniseries: http://en.wikipedia.org/wiki/The_Shining_%28TV_miniseries%29

King does NOT care about ""sullying"" anything Kubrick did, I think they never even spoke again after the movie.",FCalleja,2012-09-18T21:51:34Z,0,COMMENT,Horror,The Shining,12
102w8m_13,102w8m,"When the subject comes up, I always say, we have two excellent works of art called ""the Shining"" and both can be independently enjoyed. ",,2012-09-19T16:45:47Z,2,COMMENT,Horror,The Shining,13
102w8m_14,102w8m,"I think because The Shining is SO good as it is, and for me, adding a history to Danny disrupts that. I know it's not realistic to think that way, but that's my reason. Also, I've been so disappointed with his later work... maybe I'm too dedicated to his older stuff, but that's how I feel.",mementomori4,2012-09-18T21:36:18Z,2,COMMENT,Horror,The Shining,14
102w8m_15,102w8m,"I know King hated Kuberick's adaptation, but for me, Kuberick's work was better than King's original. It would sully the Shining for me at least, if not for King and the rest of the audience.",,2012-09-18T21:55:35Z,2,COMMENT,Horror,The Shining,15
102w8m_16,102w8m,"Nah, I think it makes sense. I'm looking forward to it, but at the same time The Shining is really fantastic as a self contained novel. I suppose in a way it sort of feels like it's so far away from the original story - this isolated hotel with a fractured family alone inside - that it feels a little tacked on.",BritishHobo,2012-09-19T01:35:17Z,2,COMMENT,Horror,The Shining,16
ydcmxw_1,ydcmxw,"I agree! The shining IS scary, but not in the usual ""boo!""-scare that jumps out at you in 15 horror movies out of 10. Just as you say, the decline, the hotel slowly, sinister(...-ly?) crushing, ever tighter, around his mind, much more so than the body. That sort of scare and tension you get when reading IT; something dark is coming. Something... utterly evil. Something old. Slowly sneaking up on you. Dissolving your resistance, bit ny bit. I absolutely loved it as I read it at age 13-14, but much more as a grown man. It is even better now, because of your/my own experience. And continuing with dr Sleep is the way! I had forgotten a lot of the story from the Shining, that I actually just stopped reading Dr S about a third into the book, to reread Shining a second time. It made a LOT of difference! If I hadn't read the Shining, I still would have liked dr Sleep, but not nearly as much as the love I have for it now. A perfect end to a story that I didn't know was in need of a second phase!",EvulOne99,2022-10-25T19:18:47Z,1,COMMENT,Horror,The Shining,1
ydcmxw_2,ydcmxw,"You should read this: https://the-end-of-summer.blogspot.com/2012/02/before-play-prequel-to-shining.html

It’s the prequel narrative to The Shining which King cut from the initial draft. It’s mostly about the backstory to the Overlook but there is one part that is about “Jacky” Torrance at Danny’s age and his horrible relationship with his abusive father. It adds more interesting and visceral look at the idea of abusive parental relationships to the book.",SeekingTheRoad,2022-10-25T21:27:15Z,1,COMMENT,Horror,The Shining,2
ydcmxw_3,ydcmxw,Now I feel like I have to read The Shining again too.,JustMeLurkingAround-,2022-10-25T19:25:38Z,3,COMMENT,Horror,The Shining,3
ydcmxw_4,ydcmxw,"The Shining's tough because of Danny's extreme youth. Poor kid.

In the miniseries which was written by Stephen King, King takes out one of my favorite images: Where the Overlook embodied in Jack spins the wheel of the boiler --- the hot metal sinking into the palms of his hands and setting them on fire --- and when the gauge goes down, it shuffles in a victory dance with its flaming hands waving above its head.

Instead King replaces that with a scene where Jack takes back control of himself one final time as he stands in front of the boiler and deliberately refuses to spin the wheel to release the pressure and so makes the decision to blow up the Overlook.",Dana07620,2022-10-26T06:17:19Z,2,COMMENT,Horror,The Shining,4
